"question_flag","answer_flag","interjection_flag","speech_flag","petition_flag","quote_flag","motionnospeech_flag","chamber_flag","name","name.id","electorate","party","role","page.no","content","subdebateinfo","debateinfo","path","Speaker","Time"
"0","0","0","0","0","0","0","1","N/A","N/A","N/A","N/A","N/A","N/A","The President took the chair at 3 p.m,. and read prayers.","N/A","N/A","/hansard/chamber.xscript/business.start/para","N/A","N/A"
"0","0","0","1","0","0","0","1","PEARCE, George","K0F","Western Australia","ALP","Minister of Defence","7972",". By leave In connexion with the speech delivered in the House of Representatives last night by the PostmasterGeneral, referring to matters of administration of the Department of Home Affairs, the Government proposes to arrange for the appointment of a Royal Commission. If possible, the Commission will consist of a Judge, and the Acting Prime Minister will arrange for that. The Commission will be asked to take as the basis of such inquiry the Hansard reports of the speech above referred to and the speeches delivered since the reassembling of Parliament by the honorable member for Hindmarsh, dealing with administrative matters in the Home Affairs Department, and also statements and answers to questions dealing with the same matters made by the Minister of Home Affairs in the House of Representatives . ","N/A","HOME AFFAIRS DEPARTMENT ROYAL COMMISSION","/hansard/chamber.xscript/debate[1]/speech/talk.start/para","N/A","N/A"
"1","0","0","0","0","0","0","1","GRANT, John","KMP","N/A","N/A","N/A","7972","Has the Minister of Defence information about the reported arrival of Bulgarians at Broken Hill? ","BULGARIANS","QUESTION","/hansard/chamber.xscript/debate[2]/subdebate.1/question/talk.start/para","N/A","N/A"
"0","1","0","0","0","0","0","1","PEARCE, George","K0F","N/A","ALP","N/A","7972","In view of your ruling yesterday, Mr. President, and as my answer is rather explanatory, I ask leave to make a statement.  Leave granted. On the 2nd March, 1916, the Secretary of State for the Colonies cabled to the Commonwealth Government, intimating that an arrangement had been made with the Bulgarian Government, on the basis of reciprocity, not to detain in the United Kingdom or the British Empire, or in His Majestys Overseas Dominions, Bulgarian subjects who were under seventeen, or over fortyfive years of age on the date of the declaration of war between Great Britain and Bulgaria, nor to intern Bulgarian subjects of any age so long as they are able to provide for themselves, unless there are special reasons of a military character which would render internment desirable. The Secretary of State expressed the hope that the Commonwealth Government would concur in this policy. The Minister for Defence issued instructions to the Commandant of each Military District in accordance with this notification from the Secretary of State, and instructed each Commandant to go through the lists of Bulgarians interned from his district, to ascertain who on these lists conformed with the notification of the Secretary of State, and to communicate with the Commandant of the Concentration Camp where the Bulgarians were interned, who had been instructed to liberate those recommended by the District Commandants. Commandants were also informed that, in considering future cases of internment, they should be guided by the above arrangements. In the 4th Military District, South Australia, fortyseven Bulgarians were affected by the arrangements set out, and the Commandant of the Concentration Camp was instructed that they were to be released on condition that they reported to the police of the place to which they were proceeding. He was further instructed to provide railway warrants for their return to Adelaide. If a large batch of them desired to travel together the Commandant was informed that it would be wise to defer their release until he had an escort going to the State in question. No instructions were issued from headquarters that any of these Bulgarians were to be sent to Broken Hill, nor for any military guard to be sent to Broken Hill in connexion therewith; and up to the present the Department has no information as to how it came about that they were sent there. Inquiries are, however, being made. The guard which escorted these Bulgarians from the Concentration Camp is now in Melbourne, on its return to New South Wales. The officer in charge of the guard states that his orders were to take the men to Adelaide, and hand them over to the authorities there. This he did. There is no reply yet from the Commandant in Adelaide. The authorities were rung up this morning to expedite matters.","BULGARIANS","QUESTION","/hansard/chamber.xscript/debate[2]/subdebate.1/answer/talk.start/para","N/A","N/A"
"0","0","0","0","0","0","0","1","N/A","N/A","N/A","N/A","N/A","N/A","Report (No. 6) presented by Senator Barker.","N/A","PRINTING COMMITTEE","/hansard/chamber.xscript/debate[3]/para","N/A","N/A"
"0","0","0","0","0","0","0","1","N/A","N/A","N/A","N/A","N/A","N/A","The following papers were presented","N/A","PAPERS","/hansard/chamber.xscript/debate[4]/para","N/A","N/A"
"0","0","0","0","0","1","0","1","N/A","N/A","N/A","N/A","N/A","N/A","Defence Act 19031915. Regulations amended, &c.  Statutory Rules 1916, No. 73. Statutory Rules 1916, No. 80. War Precautions Act 19141915. Regulations amended, &c. Statutory Rules 1916, No. 81. Statutory Rules 1916, No. 88.","N/A","PAPERS","/hansard/chamber.xscript/debate[4]/quote/para[1]","N/A","N/A"
"0","0","0","0","0","0","0","1","N/A","N/A","N/A","N/A","N/A","N/A","Concessions to University Students.","PUBLIC SERVICE","QUESTIONS","/hansard/chamber.xscript/debate[5]/subdebate.1[1]/para","N/A","N/A"
"1","0","0","0","0","0","0","1","TURLEY, Henry","K8W","N/A","N/A","N/A","7973","asked the Acting Prime Minister, upon notice  1.Is the Government aware that persons in the employ of the Queensland Government, and who are students of the University, are given the time off from their duties to attend the lectures at the University on Saturday mornings? 2.Are persons in the employ of the Federal Government allowed the same privilege? 3.If not, will the Government make arrangements for such privilege to be granted to those students in Federal Government employment?","PUBLIC SERVICE","QUESTIONS","/hansard/chamber.xscript/debate[5]/subdebate.1[1]/question/talk.start/para","N/A","N/A"
"0","1","0","0","0","0","0","1","PEARCE, George","K0F","N/A","ALP","N/A","7973","The answers are  1.No. 2 and 3. Subject to the convenience of the Departments concerned, officers of the Commonwealth Public Service are granted permission to absent themselves from their official duties to attend University lectures on condition that the time thereby lost by the officer is made up. These arrangements are regarded as adequately meeting the circumstances.","PUBLIC SERVICE","QUESTIONS","/hansard/chamber.xscript/debate[5]/subdebate.1[1]/answer/talk.start/para","N/A","N/A"
"1","0","0","0","0","0","0","1","NEEDHAM, Edward","JXJ","N/A","N/A","N/A","7973","asked the Minister representing the Minister of Trade and Customs, upon notice  1.Is he aware that the lighthousekeepers stationed at the following northern stations, viz., Cape Leveque, Gantheaume Point, Jaronan Island, North West Cape, Cloates Point, and Cape Inscription ore only to Be relieved every three years and then to be transferred to southern stations? 2.Is he aware that under previous conditions transference from those northern stations to southern stations could be obtained every two years ? 3.Does he not think that, owing to the loneliness and monotony of the occupation, and the rigour of the northern climes, three years is too long? 4.Will be take immediate steps to alter the period from three to two years?","LIGHTHOUSEKEEPERS","QUESTIONS","/hansard/chamber.xscript/debate[5]/subdebate.1[2]/question/talk.start/para","N/A","N/A"
"0","1","0","0","0","0","0","1","RUSSELL, Edward","K3E","N/A","ALP","N/A","7973","The answers are  1.Yes. 2.Prior to the Commonwealth assuming control on 1st July, 1915, transference to southern stations was not given as a matter of course after two years, although in some cases this was done. 3.It is considered that the extra years service at northern stations is more than compensated for by the longer leave (twelve weeks) which accrues, and the right of transfer to southern stations. The position of keepers at these isolated stations has been specially considered, and a steamer service is being arranged for three times annually instead of once only as formerly. Additional quarters will also be built as soon as possible at the majority of the stations named, and another man appointed at each place. 4.Instructions were given in December last that the whole matter should be reviewed at the end of 1916. Consideration will then be given as to whether the period of service at the northern stations should remain at two years.","LIGHTHOUSEKEEPERS","QUESTIONS","/hansard/chamber.xscript/debate[5]/subdebate.1[2]/answer/talk.start/para","N/A","N/A"
"0","0","0","0","0","0","0","1","N/A","N/A","N/A","N/A","N/A","N/A","Army Medical Corps Commissions Letters and Parcels from Soldiers Razors Supplied to Claremont Camp.","AUSTRALIAN IMPERIAL FORCE","QUESTIONS","/hansard/chamber.xscript/debate[5]/subdebate.1[3]/para","N/A","N/A"
"1","0","0","0","0","0","0","1","NEEDHAM, Edward","JXJ","N/A","N/A","N/A","7973","asked the Minister of Defence, upon notice  1.Is it a fact that qualified pharmacists in the A.M.C. are only ranked as staffsergeants, whereas commissioned rank is given in all other callings where professional services of a skilled expert nature are requires? 2.Is it a fact that in the Canadian, French, Italian, Japanese, and German armies commissions are granted to all qualified pharmacists undertaking dispensary duties? 3.Have any commissions been granted to qualified pharmacists in charge of any of the A.M.C. dispensaries in any of the camps? 4.Is it a fact that qualified pharmacists have for several months been undertaking dispensing work in camps with the rank of actingcorporal and with privates pay? 5.Seeing that the duties of quartermasters in the A.M.C. units are of a medical and pharmaceutical nature, will the Minister give instructions that a proportion of qualified pharmacists are to be appointed to these positions? 6.Have any instructions been issued that qualified pharmacists only are to be placed in charge of all camp dispensaries ? 7.Will the Minister, in view of the serious dearth of qualified pharmacists, give instructions that no further pharmacists are to be allowed to leave in the A.I.F. except in connexion with the medical service?","AUSTRALIAN IMPERIAL FORCE","QUESTIONS","/hansard/chamber.xscript/debate[5]/subdebate.1[3]/question[1]/talk.start/para","N/A","N/A"
"0","1","0","0","0","0","0","1","PEARCE, George","K0F","N/A","ALP","N/A","7973","The answers are  1.No. Both commissioned and noncommissioned officer rank are granted. 2.Information in regard to the matter is not available. 3.No. 4.If so, it is contrary to orders from Headquarters. 5.No. Quartermasters have nothing to do with pharmaceutical duties. They require special military knowledge. 6.Yes. 7.Not considered advisable.","AUSTRALIAN IMPERIAL FORCE","QUESTIONS","/hansard/chamber.xscript/debate[5]/subdebate.1[3]/answer[1]/talk.start/para","N/A","N/A"
"1","0","0","0","0","0","0","1","GUY, James","KNN","N/A","N/A","N/A","7974","asked the Minister representing the PostmasterGeneral, upon notice  Is there any truth in the statement to the effect that thousands of letters and parcels from members of the Australian Military Forces serving abroad, and now in the Melbourne General Post Office, are not to be delivered, but to be destroyed? And if true, what is the reason for such?","AUSTRALIAN IMPERIAL FORCE","QUESTIONS","/hansard/chamber.xscript/debate[5]/subdebate.1[3]/question[2]/talk.start/para","N/A","N/A"
"0","1","0","0","0","0","0","1","GARDINER, Albert","KKZ","N/A","ALP","N/A","7974","The answer is  The following information has been furnished by the Deputy PostmasterGeneral, Melbourne, viz. : No. So far as letters received from members of the Australian Military Forces serving abroad are concerned they receive preferential treatment, and are delivered at the earliest possible moment after arrival at the General Post Office. The major portion of these letters is sorted en route in the sorting van by the staff of sorters which is sent to Adelaide to deal with the English and Expeditionary Forces mails on the return journey.","AUSTRALIAN IMPERIAL FORCE","QUESTIONS","/hansard/chamber.xscript/debate[5]/subdebate.1[3]/answer[2]/talk.start/para","N/A","N/A"
"1","0","0","0","0","0","0","1","READY, Rudolph","K2D","N/A","N/A","N/A","7974","asked the Minister of Defence, upon notice  1.Who are the contractors supplying razors to the troops at Claremont Military Camp, Tasmania ? 2.What are the contract prices, and what brand of razor is specified?","AUSTRALIAN IMPERIAL FORCE","QUESTIONS","/hansard/chamber.xscript/debate[5]/subdebate.1[3]/question[3]/talk.start/para","N/A","N/A"
"1","0","0","0","0","0","0","1","PEARCE, George","K0F","N/A","N/A","N/A","7974","The answers are 1 and 2. There is no contractor for the supply of razors to the Claremont Camp. Supplies of razors of the same quality as issued to the British Army were obtained some time ago from the War Office for general issue, and recently the Military Commandant was authorized to requisition local stocks in Hobart. The source of supply of the razors issued to troops at the Claremont Camp is not known, but inquiries are being made, and the honorable senator will be further informed when the information is received from the Commandant. ","AUSTRALIAN IMPERIAL FORCE","QUESTIONS","/hansard/chamber.xscript/debate[5]/subdebate.1[3]/question[3]/continue/talk.start/para","N/A","N/A"
"0","0","0","0","0","0","0","1","N/A","N/A","N/A","N/A","N/A","N/A","Enemy Shareholders Exemptions","WAR PRECAUTIONS ACT","QUESTIONS","/hansard/chamber.xscript/debate[5]/subdebate.1[4]/para","N/A","N/A"
"1","0","0","0","0","0","0","1","FERRICKS, Myles","JYT","N/A","N/A","N/A","7974","asked the Minister representing the AttorneyGeneral, upon notice  1.What number of applications have been lodged for exemption under the enemy shareholders regulations of the War Precautions Act? 2.How many of these applications have been granted ? 3.How many have been refused?","WAR PRECAUTIONS ACT","QUESTIONS","/hansard/chamber.xscript/debate[5]/subdebate.1[4]/question/talk.start/para","N/A","N/A"
"0","1","0","0","0","0","0","1","GARDINER, Albert","KKZ","N/A","ALP","N/A","7974","The answers are  1.Number of applications lodged for exemption. 1,428. 2. (a) Number of exemptions granted generally, 346; (b) Number of exemptions granted to a limited extent, 171; Total, 517. 3.Number of applications for exemptions refused, 21. These applications are those of naturalized persons only. The Regulations do not allow of exemption to enemy subjects, all of whom are obliged to transfer their shares to the Public Trustee.","WAR PRECAUTIONS ACT","QUESTIONS","/hansard/chamber.xscript/debate[5]/subdebate.1[4]/answer/talk.start/para","N/A","N/A"
"0","0","0","0","0","0","0","1","N/A","N/A","N/A","N/A","N/A","N/A","(No. 3.).","N/A","TRADING WITH THE ENEMY BILL","/hansard/chamber.xscript/debate[6]/para[1]","N/A","N/A"
"0","0","0","0","0","0","0","1","N/A","N/A","N/A","N/A","N/A","N/A","Motion (by Senator Gardiner) agreed to","N/A","TRADING WITH THE ENEMY BILL","/hansard/chamber.xscript/debate[6]/para[2]","N/A","N/A"
"0","0","0","0","0","1","0","1","N/A","N/A","N/A","N/A","N/A","N/A","That leave be given to introduce a Bill for an Act to amend the Trading with the Enemy Acts 1914. ","N/A","TRADING WITH THE ENEMY BILL","/hansard/chamber.xscript/debate[6]/quote/para","N/A","N/A"
"0","0","0","0","0","0","0","1","N/A","N/A","N/A","N/A","N/A","N/A","Bill presented, and read a first time.","N/A","TRADING WITH THE ENEMY BILL","/hansard/chamber.xscript/debate[6]/para[3]","N/A","N/A"
"0","0","0","0","0","0","0","1","N/A","N/A","N/A","N/A","N/A","N/A","Motion (by Senator Russell) agreed to","N/A","COMMERCE (TRADE DESCRIPTIONS) BILL","/hansard/chamber.xscript/debate[7]/para[1]","N/A","N/A"
"0","0","0","0","0","1","0","1","N/A","N/A","N/A","N/A","N/A","N/A","That leave be given to introduce a Bill for an Act to amend the Commerce (Trade Descriptions) Act 1905. ","N/A","COMMERCE (TRADE DESCRIPTIONS) BILL","/hansard/chamber.xscript/debate[7]/quote/para","N/A","N/A"
"0","0","0","0","0","0","0","1","N/A","N/A","N/A","N/A","N/A","N/A","Bill presented, and read a first time.","N/A","COMMERCE (TRADE DESCRIPTIONS) BILL","/hansard/chamber.xscript/debate[7]/para[2]","N/A","N/A"
"0","0","0","0","0","0","0","1","N/A","N/A","N/A","N/A","N/A","N/A","Motion (by Senator Ferricks) agreed to","N/A","GOVERNMENT IMPORTATIONS","/hansard/chamber.xscript/debate[8]/para","N/A","N/A"
"0","0","0","0","0","1","0","1","N/A","N/A","N/A","N/A","N/A","N/A","That there be laid on the table of the Senate a return showing the value of importations by the Federal Government and the respective State Governments of the Commonwealth, of materials for, or of, dredges, bridges, sugar mills, and locomotives, respectively, during the past ten years. ","N/A","GOVERNMENT IMPORTATIONS","/hansard/chamber.xscript/debate[8]/quote/para","N/A","N/A"
"0","0","0","1","0","0","0","1","LYNCH, Patrick","KRZ","Western Australia","N/A","N/A","7974",". I move ","N/A","NAME OF FEDERAL CAPITAL","/hansard/chamber.xscript/debate[9]/speech[1]/talk.start/para","N/A","N/A"
"0","0","0","0","0","1","0","1","N/A","N/A","N/A","N/A","N/A","N/A","That in the opinion of the Senate the name of the Federal Capital should be changed from Canberra, and the capital rechristened  Anzac. ","N/A","NAME OF FEDERAL CAPITAL","/hansard/chamber.xscript/debate[9]/speech[1]/quote/para","N/A","N/A"
"0","0","0","1","0","0","0","1","None","KKZ","N/A","N/A","N/A","N/A","I have to congratulate myself on having such a favorable opportunity to present this most important motion for the consideration of the Senate. It will serve a double purpose. In the first place, it enables me to invite the Senate to consider what, in my opinion, is one of the most important propositions ever placed before it, and, in the second place, it will provide work for honorable senators at a time when, but for a combination of circumstances in another place, they might be employed in the consideration of ordinary Government business. It would appear that even the Fates have conspired to afford me a fitting opportunity to deal with this most important question. I know that in making a request for a change in the name of the Federal Capital, I am engaging in no light task.  I feel that the greatest care and foresight must be applied in the selection of a name for anything if it is to do us justice and credit. In the sphere of the family we are always very careful as to the names we select, because those names remain a test of our judgment in after years. As we think of such names from day to day we are reminded in some form or other of the care and prudence brought to bear in their selection. Even in the naming of domestic animals we are equally circumspect. If it be only a horse that we have to name, we feel some pride in thinking that the name we give will not be the subject of unfavorable comment or ridicule by our neighbours. When we consider the naming of the Federal Capital we have to bear in mind that we are giving a name to a place that will .last for all time, and be the citadel of the countrys liberty and countrys law making. We should, therefore, be careful to select for it a name which will do justice to the people of the Commonwealth. I am aware that in asking the Senate to agree to a change of name for the Federal Capital, I shall be up against the influence of old opinions, though in this case they are not older than about three and a half years. In proposing this innovation, I feel that even the passing of three and a half years is quite enough to constitute for some people a reason why the action taken originally should not be reviewed, and the name then selected for the capital changed to some other name. In submitting my motion I have to be on my guard against the influence of preconceived opinions as to the name which should be selected, even though they should have been formed only three and a half years ago, and also against a feeling which may be present in this chamber that the action I propose is of such a violent character that it will nob reflect the wisdom and judgment of the Senate. I feel that I have to steer, so to speak, between Scylla and Charybdis, two dangers not so very far from the Dardanelles, which were a menace to the mariner of old, as by trying to avoid striking one with his frail barque, he was in danger of being sucked down by the other. It would appear, from hints that I have heard dropped, that my proposal may have to run the gauntlet which the ancient mariner had to run when he had to steer his barque between the two perils I have referred to. Be that as it may. I am quite content to let the motion rest on its merits, as before I conclude I hope to submit sound reasons sufficient to convince every member of the Senate not only that a change of the name of the Federal Capital is necessary, but that it should take place as soon as possible. Honorable senators will remember that when about three and a half years ago,  Canberra  was revealed to the world as the name by which the Federal Capital would be known, it was neither in accordance with the inclination, the assumption or belief of the people that such a name was chosen. What would be a suitable name for the Federal Capital was canvassed in the press, not for one or two, but for several years. Several names were suggested, according to the tastes of those making the suggestions. These names had a political or national significance, and some had reference to the part which the hardy and daring pioneers took in the early history of the country. Some names suggested had merely a geographical significance. Honorable senators will remember that such names as  Parkes,  Barton,   Cook,   Leichhardt,    Kingston, and others were suggested. It is rather strange that some name was not selected that would be a perpetual reminder to the people of the Commonwealth of the special admiration merited by some outstanding figure in the development of our country in the past. The wisdom of the Government of the day apparently went in the direction of ignoring all that had been done in the past in the industrial, political, and pioneering spheres of the activities of our people, and they came down to the plain, prosy, monotonous level of choosing a name which, so far as inquiry and research have gone, indicates nothing, points nowhere, and does not appeal to the imagination of any person in the Commonwealth.","N/A","NAME OF FEDERAL CAPITAL","/hansard/chamber.xscript/debate[9]/speech[1]/para[1]","N/A","N/A"
"0","0","1","0","0","0","0","1","DE LARGIE, Hugh","JU7","N/A","N/A","N/A","7975","And leads into the bush. ","N/A","NAME OF FEDERAL CAPITAL","/hansard/chamber.xscript/debate[9]/speech[1]/interjection[1]/talk.start/para","N/A","N/A"
"0","0","0","1","0","0","0","1","LYNCH, Patrick","KRZ","N/A","N/A","N/A","7975","That is so. It is surrounded by the bush at present. With due respect to the action of the Government of the day in selecting  Canberra  as the name of the Federal Capital, we have had an opportunity to look around since that selection was made, and in the meantime have had the record of an event which revealed in a marked degree the true type of the Australian character. The obligation, I think, is cast upon us to review our action, and to endeavour to find some more suitable name than  Canberra  for the Federal Capital, that is to be not for today or next day, but for all time.  I said just now that the origin of  Canberra  is not clear. It is quite true that students of etymology and the archives stored here throwing some light on placenames were consulted in the past, but without result. The word  Canberra, so far as I can learn, has no significance worth speaking about. Colonel Miller, who is Administrator of the Federal Territory, is one authority I consulted. He thinks that it is a form of the word  Canbury, a place mentioned in some church records at the Federal Capital. This is merely a brilliant guess as to the probable origin of the name. I have tried by researches in the Library of this Parliament to discover the true origin of the word, whether it be an aboriginal name or an English name that has undergone some change of form, but the conclusion to which I have been forced to come is that  Canberra  has no real significance historically, geographically, or aboriginally. It is merely a chance word, the history of which was not important enough to be handed down to us by the aboriginals, if it be an aboriginal word, or by those who were associated . with the change from  Canbury  to  Canberra, if the latter be its true origin. It is not unreasonable now that three years have passed since the christening of the Federal Capital, that we should consider whether any warrant exists at the present time for a change of the name. It has been said by one authority that human action is mostly shaped in accordance with the current thought of the time, and really if that test of human action be applied to the selection of  Canberra, it is justified, since it indicates nothing, and the selection was made during a very placid period of this countrys history, when nothing in particular was happening.","N/A","NAME OF FEDERAL CAPITAL","/hansard/chamber.xscript/debate[9]/speech[1]/continue[1]/talk.start/para","N/A","N/A"
