"question_flag","answer_flag","interjection_flag","speech_flag","petition_flag","quote_flag","motionnospeech_flag","chamber_flag","name","name.id","electorate","party","role","page.no","content","subdebateinfo","debateinfo","path","Speaker","Time"
"0","0","1","0","0","0","0","1","DE LARGIE, Hugh","JU7","N/A","N/A","N/A","7976","Will the honorable senator tell us what  London  or  Paris  signifies? ","N/A","NAME OF FEDERAL CAPITAL","/hansard/chamber.xscript/debate[9]/speech[1]/interjection[2]/talk.start/para","N/A","N/A"
"0","0","0","1","0","0","0","1","LYNCH, Patrick","KRZ","N/A","N/A","N/A","7976","I shall try later on to enlighten the Senate on those points. According to the authority of the learned publicist I have quoted, human action is mostly influenced by the current or dominant thought of the period, and in accordance with that maxim, Canberra fills the bill. It explains nothing. It is a term of accidental origin which has no bearing whatever on the national life of the country, the character of its people, or the development of its resources. I think that something has happened during the last twelve months to warrant a change of the name. An event has occurred which has a bearing on the character of our people, and which, in my view, justifies the change I propose in this motion. Senator de Largie has asked me what is the meaning of London. Delving in the musty and misty records of the past, it is very hard to find out what is the true meaning or origin of the word  London. So far as the authorities consulted throw any light on the subject, I find that the word  London  is of Celtic origin, revealing the fact, which is already known to those acquainted with the subject, that the Celtic character has ever been noticeable in the vanguard of civilization and pioneering work everywhere. London, according to the authority I consulted, Longmans Gazetteer of the World, 1902 edition, is derived from the Celtic name   Linndun  or  Llyndun, Llyn  meaning a pool or marsh, and dun a fort erected over it. It would appear that even this word of Celtic origin was used to indicate the place out of regard merely for the physical features of the site. It was a marshy place with a mound or hill on which fortifications of a rude kind were erected. There is nothing in the use of the word  London  to indicate that those responsible for its selection looked for a name which would reflect the genius or character of its people. They were concerned only to give the place a name which indicated merely its physical or topographical features. That is not elevating at all. Those who have the power to give names, should, I think, select such names as will have an elevating and inspiring effect on the mind. That is the sum and substance of my effort this afternoon. With regard to the other national capitals, according to the authorities I have looked up, I find that the people of Germany were not at all fortunate in the choice of a name for their capital Berlin. ","N/A","NAME OF FEDERAL CAPITAL","/hansard/chamber.xscript/debate[9]/speech[1]/continue[2]/talk.start/para","N/A","N/A"
"0","0","1","0","0","0","0","1","DE LARGIE, Hugh","JU7","N/A","N/A","N/A","7977","We shall change that in the next few months. ","N/A","NAME OF FEDERAL CAPITAL","/hansard/chamber.xscript/debate[9]/speech[1]/interjection[3]/talk.start/para","N/A","N/A"
"0","0","0","1","0","0","0","1","LYNCH, Patrick","KRZ","N/A","N/A","N/A","7977","I hope so. If the derivation of the name Berlin is correctly stated, and after all it is only conjectural, it means uncultivated land, or a fordcrossing place. Paris comes next, and that name is derived from the Roman names Parisii and Lutetia Parisiorum. I suppose that it commemorates some Roman character of the early misty past, when the sway of the Roman eagle extended throughout the known world, and embraced all the western part of Europe, and even the British Islands. ","N/A","NAME OF FEDERAL CAPITAL","/hansard/chamber.xscript/debate[9]/speech[1]/continue[3]/talk.start/para","N/A","N/A"
"0","0","1","0","0","0","0","1","DE LARGIE, Hugh","JU7","N/A","N/A","N/A","7977","Not all of them. ","N/A","NAME OF FEDERAL CAPITAL","/hansard/chamber.xscript/debate[9]/speech[1]/interjection[4]/talk.start/para","N/A","N/A"
"0","0","0","1","0","0","0","1","LYNCH, Patrick","KRZ","N/A","N/A","N/A","7977","No, I believe they did not get into Ireland, the only unconquerable spot, or into Wales. Madrid is named from an Arabic word meaning a wind current. We know that Rome is called after its legendary founder, Romulus, but whether he existed or not has not been clearly established. Lisbon is from the Phoenician  Alis ubbo, meaning  delicious bay.* Venice is from the Latin Veneti, a maritime people. This selection comes more closely to my idea since it has some reference to the character of the people. The name Venice was chosen apparently out of respect for the calling in which its people were engaged, as they were a seafaring people. .Vienna is derived from  Vindobonia, a word of Celtic origin, meaning white castle. The origin of Brussels is doubtful, but the oldest form of the word is  Bruxella.  So much for the names of the capitals of the Old World. The records are preserved which show how the capitals of the new world were named, and the origin of their names. The greatest example is that of the United States of America, where the capital is named after the national hero and deliverer Washington. In the case of Canada, Ottawa, the Seat of Government is not named after any particular characteristic of the white races there, or to commemorate what they did in subjugating that large Dominion. The capital of Canada is called  Ottawa, after a native tribe. Then we have  Cape Town, which has no particular significance. The capital of New Zealand is certainly named after a warrior whose name stands high in military history, but it does not indicate in any way what the New Zealand people have done in colonizing that island Dominion. There is nothing in the word Wellington to indicate that the people of New Zealand on their own account have any special claim to or interest in it. The capital is called after a warrior who was certainly great and bold, and won a worthy reputation, but the word has no local significance to which the people of New Zealand may look up in the future. Reviewing in brief the origin of the names of national capitals from ancient times until now, it would appear that in only one or two outstanding instances has the selection made reflected any credit on those responsible for it. Athens, the ancient capital of Greece, took it name from Athene, the Goddess of science, arts, and arms. I look upon that as a worthy selection of a classic people. It is a name which specially appeals to all the beautiful tastes, habits, inclinations, and imagination of the people.  Washington, as the name for the capital of the United States of America, appeals to me also, and I trust that, following the temper and spirit of that worthy example, as a result of my motion the action taken by the Senate will cause Anzac to be substituted for  Canberra  as the name of the Federal Capital. .So much by way of the origin of names. We have a much stronger reason to name our Federal Capital  Anzac  than the Americans had to call their capital  Washington. The Americans had a long struggle for independence from the time when the first shot was fired at Lexington until the last was fired at Yorktown. A mighty effort was made by three and a half million of people, and it was fitting that when at last they secured their independence, and the new American nation was born, Americans should turn to the one man who had made it possible for them to achieve national success and greatness. They immortalized him by naming their capital after him. When I speak of  Anzac, however, and refer to it as the appropriate name for the Federal Capital, I would urge that it has a wider significance than Washington, because it represents, not the struggle for freedom by the people of one country only, but the effort put forward by our sons at the Dardanelles for the freedom of all the nations at present associated with the Allies cause.","N/A","NAME OF FEDERAL CAPITAL","/hansard/chamber.xscript/debate[9]/speech[1]/continue[4]/talk.start/para","N/A","N/A"
"0","0","1","0","0","0","0","1","BLAKEY, Albert","K22","N/A","N/A","N/A","7978","It is not a word. It is only a combination of five letters. ","N/A","NAME OF FEDERAL CAPITAL","/hansard/chamber.xscript/debate[9]/speech[1]/interjection[5]/talk.start/para","N/A","N/A"
"0","0","0","1","0","0","0","1","LYNCH, Patrick","KRZ","N/A","N/A","N/A","7978","I am aware of that, but I hope the honorable senator does not object to it on that account. The accidental grouping of the letters, to my mind, will always stimulate .thought, and in the future be an incentive for inquirers to ask something about it. When the Americans called their capital  Washington, they had in mind the thought which, I hope, will be in the minds of every honorable senator when they exchange the word  Canberra  for  Anzac. ","N/A","NAME OF FEDERAL CAPITAL","/hansard/chamber.xscript/debate[9]/speech[1]/continue[5]/talk.start/para","N/A","N/A"
"0","0","1","0","0","0","0","1","TURLEY, Henry","K8W","N/A","N/A","N/A","7978","Yes; when they do. ","N/A","NAME OF FEDERAL CAPITAL","/hansard/chamber.xscript/debate[9]/speech[1]/interjection[6]/talk.start/para","N/A","N/A"
"0","0","0","1","0","0","0","1","LYNCH, Patrick","KRZ","N/A","N/A","N/A","7978","The word, as I have already indicated, has a much wider significance than  Washington, because it stands for the effort made by Australians and New Zealanders on behalf of the liberties of thos© civilized nations fighting for the cause of the Allies, whereas  Washington  indicates only the name of a man who led the people of his country in a successful fight for freedom. The word  Anzac  applies not to a military leader, as does the name of the Capital of the United States of America, but to the first draft made on the manhood of Australia and New Zealand in the fight, on a foreign battlefield, for the freedom of civilization. ","N/A","NAME OF FEDERAL CAPITAL","/hansard/chamber.xscript/debate[9]/speech[1]/continue[6]/talk.start/para","N/A","N/A"
"0","0","1","0","0","0","0","1","BLAKEY, Albert","K22","N/A","N/A","N/A","7978","But might there not be greater exploits than the Anzac landing before the war is over ? ","N/A","NAME OF FEDERAL CAPITAL","/hansard/chamber.xscript/debate[9]/speech[1]/interjection[7]/talk.start/para","N/A","N/A"
"0","0","0","1","0","0","0","1","LYNCH, Patrick","KRZ","N/A","N/A","N/A","7978","I am assuming from the interjections that there is not a friendly feeling towards the change of name, and I would point out that  Canberra, for all practical purposes, might just as well be called Potberra or  Billyberra. I may remark also that an ingenious contributor to the press has suggested that in the early days when the aboriginals had dealings with the first settlers, they had then, as now, a taste for alcohol, and when they came down to the settlers camp, they asked,  Got em can, got em beer? Prom that time on, according to the press correspondent I have referred to, the site of the Capital City was called  Canberra. That is just as likely to be the origin of the name as any other, and  I ask Senator Blakey is there any reason why that name should stand for all time just because it was selected in no particularly ingenuous way, meaning nothing and signifying nothing ? Is it not our duty, if we can, to place on record, in the manner I suggest, those brave deeds done on the shores of Gallipoli by Australias sons ? If we wish to erect an imperishable monument to their memory, we can best do so by giving to the Federal Capital a name that will for all time call up a mental picture of those gallant exploits.","N/A","NAME OF FEDERAL CAPITAL","/hansard/chamber.xscript/debate[9]/speech[1]/continue[7]/talk.start/para","N/A","N/A"
"0","0","1","0","0","0","0","1","BLAKEY, Albert","K22","N/A","N/A","N/A","7978","But before the war is over might there not be greater exploits ? ","N/A","NAME OF FEDERAL CAPITAL","/hansard/chamber.xscript/debate[9]/speech[1]/interjection[8]/talk.start/para","N/A","N/A"
"0","0","0","1","0","0","0","1","LYNCH, Patrick","KRZ","N/A","N/A","N/A","7978","I hope so. ","N/A","NAME OF FEDERAL CAPITAL","/hansard/chamber.xscript/debate[9]/speech[1]/continue[8]/talk.start/para","N/A","N/A"
"0","0","1","0","0","0","0","1","BLAKEY, Albert","K22","N/A","N/A","N/A","7978","Then will you rechristen the Federal Capital? ","N/A","NAME OF FEDERAL CAPITAL","/hansard/chamber.xscript/debate[9]/speech[1]/interjection[9]/talk.start/para","N/A","N/A"
"0","0","0","1","0","0","0","1","LYNCH, Patrick","KRZ","N/A","N/A","N/A","7978","It is right that we should record our due appreciation of the efforts of our men. We have all read accounts by eyewitnesses of the landing of the Third Brigade. That brigade, whose daring has not been equalled in the annals of military history, embraced men from all over Australia. Then, after the landing came the events at Lonesome Pine. We have been told that, in that engagement, when the mules at length arrived with water for the men in the trenches, the soldiers, so thirsty were they, sprang out of the trenches on to the leadswept parapet, and with their tongues sucked the moisture from the water bags on the mules backs. Those brave fellows were down to a pint of water, under that subtropical sun, before they made that historic charge. Then what is to be said of the charge of the Light Horse Brigade, which has been well described as the greatest feat ever performed on Turkish soil, not excepting even thos© exploits of the Hellenic armies in the early days of history in that part of the world ? Even those classic exploits, so we have been informed, did not excel in bravery the charge made by the Light Horse Brigade on the slopes of Gallipoli. This great event stands out by itself as showing what could be done and what was done by Australians when they were called upon. All those incidents go to make up the magnificent effort made by Australians at the Dardanelles.  I believe I am correct in saying that every soldier who yielded his life at Anzac was perfectly satisfied to do so, and if it were given to him again, he would gladly yield that precious inheritance in defence of the cause that took them from Australia. It has not always been so with other people. My own countryman and patriot, Patrick Sarsfield, who, after he had fought the battles of his country, and had compelled the British forces of the day to come to terms with him terms which were afterwards broken met Ms fate subsequently on the battlefields of Europe. When his life blood was. oozing away, he dipped his fingers in it and said,  Oh, that this were for Ireland ! The Australian soldiers dying on the battlefields of Gallipoli did not have such discomforting thoughts. They were willing to do a dozen times over what they had done in the same cause. When we find the exploits of our people at the Dardanelles recorded by eyewitnesses in terms that confer immortal honour upon our men, surely it is our duty to take some action to perpetuate their memory!  Canberra  can remain. Yes ; but what does it signify? Put the word Anzac there and what would it signify? It would signify for all time the exploits of our soldiers on a foreign field in the fight of freedom and civilization, and would keep fresh in the peoples memory the incidents connected with that great struggle in the Dardanelles. When, in the future, a child asks its mother what the word  Anzac  means, she will be able to reply, assuming we adopt the name for our Capital city: Anzac means the going out from this country of some 50,000 of our best manhood to fight, against great odds, the battle of freedom and civilization on a battlefield in an alien land. Eyewitnesses declared that their exploits were never equalled in military history. Thousands of them lie today in nameless graves, but the Federal Parliament thought fit to perpetuate their memory by giving the name  Anzac  to the Federal Capital, so that it might remain for all time as an imperishable monument to their bravery. That is what an Australian mother will be able to say to her child in the years to come if we adopt this motion. Shall we be able to draw such an inspiration from the word Canberra? Certainly not, because Canberra has no history and no pedigree, so far as literary research takes us. It has nothing to recommend it except that it is a sweetsounding name a mere collection of alphabetical characters with an agreeable phonetic effect. It expresses nothing, leads to nowhere, and fails to kindle any pride or inspiration as is the case with 1  Anzac.    Anzac  grips the mind with the significance of what it stands for, and in the future it will be a stimulation to the young Australian of an inquiring mind to ask what it means. I do not intend to delay the Senate much further, because I feel that this motion may be debated, perhaps lengthily, although I would rather see a decision come to today. I wish, however, to point out that if we apply the name  Anzac  to the Federal Capital we will be doing honour to our sister Dominion in the Southern seas, and will link that Dominion with the Commonwealth more closely than could otherwise be done. It is a compliment that has been justly earned by New Zealanders in association with Australians at the Dardanelles. I do not claim originality for the word. There is nothing new in it. I have seen references to it in the press, both here and in Western Australia, and before the debate closes I shall be pleased to give the origin of the name. In submitting this motion I do, in all sincerity, ask the Senate to make the change. I want the word adopted, not for the sake of changing the name of the Capital, but so that it may stand as an evidence of our gratitude to those men who sacrificed their lives in the fight for freedom. I want also to give to our Federal Capital and Territory a name that will appeal to the imagination, the national pride and instincts of the people, and be a stimulus to our countrymen in the future to do similar acts of bravery. Above all, I want it to be a standing appeal to the men who will be sent to  Anzac, there to frame the laws for the government of this country, to be Anzac ian in name as well as in deed, by enacting laws that will insure the true welfare, complete and widespread, of the people of this country. I hope the motion will have the hearty approval of the Senate. I ask honorable senators to cast aside the thought that because Canberra, as a name for the Federal Capital, was adopted over three years ago, no change should be made now. There is nothing in  Canberra, as a word, to justify ite perpetuation. I repeat that it means nothing, has no father and no pedigree. If, on the other hand,  Anzac  be adopted as the name of our Capital city, it will, for all time until the book of fate is sealed up, and the story of human destiny is fully written stand for the glory and gallantry of the exploits of Australian and New Zealand soldiers on the slopes of Gallipoli.","N/A","NAME OF FEDERAL CAPITAL","/hansard/chamber.xscript/debate[9]/speech[1]/continue[9]/talk.start/para","N/A","N/A"
"0","0","0","1","0","0","0","1","RUSSELL, Edward","K3E","Victoria","ALP","Assistant Minister","7980",". The Government regret that they are not able to agree with Senator Lynch as to either the necessity or the desirability of the change which he proposes. It is true that  Canberra  has no great historical significance. Its generally accepted meaning is meeting place. So far as I have been able to ascertain, it is not a native name, but it has been associated with the district for a considerable time. Senator Lynch was very eloquent in pleading for a name distinctively Australian, which would appeal to the minds of the people, but the first weakness of that suggested by him is that it does not belong exclusively to us, and that it would be rather selfish and unfair of us to claim an absolute monopoly in it. We are as proud of those who fought with the Australians at Anzac as we are of our own boys, because if they were not Australians, they were, at all events, Australasians, but the fact remains that the New Zealanders have a distinct share in the name. Other events may happen later in which Australians alone will take part, and for which we can claim a name distinctively our own. I do not say that any deeds can be done in the future superior to those achieved at Anzac, because I do. not believe that to be possible; but it should be remembered that, while other places have been named after great leaders and great warriors, it is impossible to transfer the deed by transferring the name, and so long as the bones of Australians and New Zealanders lie buried at Anzac, Anzac will be in Gallipoli, in spite of any attempt to transfer the name to Australia. Anzac also should not be used as the name of our Federal Capital, because it will be always associated with the arms and deeds of Australians; and no matter how many centuries have rolled by, if, in the future, Australians are forced to engage in warfare again and I hope they will not every soldier in our Armies will strive to reach the standard set by the Australian lads at Anzac in 1915. So that, for the present at all events, we should leave that place enshrined in the memories of the people. The fact that Australians so distinguished themselves as to write pages of history on Gallipoli is no sound reason for changing the name of the Federal Capital of Australia. If the war took a turn in favour of the Allies, as we all hope it will, and it fell to the glorious good fortune of our troops to be the first to enter Berlin, that would be no argument for giving the name of Berlin to our Capital. This is a matter about which we must be very careful. The war has not yet concluded, and although we do not hope to excel the glorious deeds of Anzac, we believe that our soldiers will still make for themselves, in other parts of Europe, a reputation worthy to stand side by side with that historic achievement. We are indebted to Senator Lynch for his review of the titles of the worlds capitals, but all that is really beside the question. We fixed Canberra as the Capital after debates extending over a number of years, and, personally, I should not like to see a division taken on a motion of this sort. No member of this Chamber, however undesirable he thinks the change proposed by the honorable senator to be, would care to have his name recorded as voting against any proposal to perpetuate the memory of our heroes, of whom we are all so proud. I would, therefore, suggest that the honorable senator should withdraw the motion for the present. Opportunities will occur later to discuss even a better name, and if the honorable senator will not withdraw the proposal I trust that he will at least postpone it. I indorse all that he said with regard to Anzac, and assure him that the Government share the pride which the people of Australia take in that name, but we regret that we are not able to agree to the proposal to change the present title of the new Capital.  Debate (on motion by Senator Ready) adjourned. Senate adjourned at 4.7 p.m.","N/A","NAME OF FEDERAL CAPITAL","/hansard/chamber.xscript/debate[9]/speech[2]/talk.start/para","N/A","N/A"
