"question_flag","answer_flag","interjection_flag","speech_flag","petition_flag","quote_flag","motionnospeech_flag","chamber_flag","name","name.id","electorate","party","role","page.no","content","subdebateinfo","debateinfo","path","Speaker","Time"
"0","0","0","1","0","0","0","1","BROWN, Gordon","K6P","N/A","N/A","N/A","266","This Government contains the same conservative elements, and therefore it is still a tory government, and it is approving the same methods for the distribution of money for the assistance of wheatgrowers. We on this side are not opposed to assistance being given to primary producers who are in need of it. With Senator Johnston, we realize that there are in this country many thousands of wheatfarmers whose position is desperate in the extreme, and we consider that it is only fair that they should receive some measure of assistance from the Commonwealth. It is also interesting to note that Senator Johnston has changed his mind with regard to the distribution of this money, and it is pertinent to inquire the reason for this change. Apparently, the wheatgrowers themselves have their own opinion of the attitude of this Government. At the annual conference of the Wheatgrowers Union in Western Australia, on Saturday, the loth February, certain resolutions were reached.  Many controversial topics were debated at this conference, which, I understand, represented over 140 branches of the wheatgrowers in Western Australia. Many of these farmers are actually situated in the droughtstricken areas, and are among those on whose behalf Senator Johnston made a splendid plea for more assistance from this Government. I hope the Government will take notice of that plea for which I commend Senator Johnston. He takes his work as a Country party senator very seriously. However, I cannot commend him on the whole of his speech, because in his concluding remarks he advocated a continuance of the flour tax, to which members of the Opposition are opposed. But that was the only fault I could find with his speech. Possibly in time, we may influence him to change his views on this matter. At the conference of wheatgrowers to which I have referred, Mr. W. Bagshaw, who is a member of the Country party, moved that a vote of no confidence be recorded against all Federal Parliamentary members of the Country party, except Senator E. B. Johnston, for failing to implement the whole of the recommendations of the royal commission which inquired into the wheat and associated industries. This conference accepted Senator Johnston as the only real representative of the Country party in this chamber. Of course, members of the Opposition claim to be true representatives of the farmer. Whether the Country party is in office or out of office, we stand for the f farmer all the time. We believe that he should be enabled to enjoy, to the full, the products of his toil. Senator Johnston believes that the farmers interests should always come first and invariably he stands up for them. We must commend an honorable senator who fights so earnestly on behalf of a section of the people whose industry constitutes an important part of the economic structure of Western Australia. Senator Hardy criticized severely the Leader of the Opposition (Senator Collings). He asked what proposal we had to suggest. He said,  Criticism is generally destructive ; let us have something constructive. I ask him what is the use of honorable senators on this side of the chamber continually expounding the Labour partys programme, if no notice is to be taken of it by the honorable senator and others opposite. In season and out of season, wc have urged that the Government should tackle the fundamental problems confronting the wheatgrowers, and that it should put an end to its present policy of expediency. We say that the Government should take cognizance of economic developments throughout the world, and deal basically with these problems. I point OUt, particularly to Senator Hardy, that although this Government has been in office for the last four and a half years, it is still carrying out its same old policy of distributing, from time to time, certain sums of money which give only temporary relief to the wheatgrowers. I admit that in December last, rather belatedly, the Government introduced legislation for the establishment of a homeconsumption price. So far as that is a step towards stabilizing the industry on a thorough and efficient basis, we support it, because we believe that we must constantly progress towards the goal of efficient organization and control for every industry in Australia. So far as the organization of the wheat industry is concerned, the Labour partys policy was expounded in a statement made by me on behalf of exSenator OHalloran, when he was a member of this chamber. ExSenator OHalloran, who possesses one of the keenest minds in the Labour movement, and is himself a wheatfarmer, showed in his scheme how the industry could be stabilized, and how each farmer could be guaranteed a certain price for his wheat. Whether he be a member of the real Country party, like Senator Johnston, or the camouflaged Country party, like Senator Hardy, or a dyedinthewool supporter of the United Australia party, no honorable senator can justly charge the Labour party with having failed to place before the people of Australia constructive proposals to deal fundamentally with the problems confronting the wheat industry. We submit that this Government, since it assumed office in 1931, has failed to stabilize that industry.","N/A","WHEAT GROWERS RELIEF BILL 1936","/hansard/chamber.xscript/debate[3]/speech[6]/continue[3]/talk.start/para","N/A","N/A"
"0","0","1","0","0","0","0","1","MACDONALD, Allan","KS7","N/A","UAP; LP from 1944","N/A","267","The people did not believe in the Labour partys proposal. ","N/A","WHEAT GROWERS RELIEF BILL 1936","/hansard/chamber.xscript/debate[3]/speech[6]/interjection[2]/talk.start/para","N/A","N/A"
"0","0","0","1","0","0","0","1","BROWN, Gordon","K6P","N/A","N/A","N/A","267","This particular matter probably was not placed before the people of Australia with as much verve as the lies of honorable senators opposite. Had we made our appeal to the people as strongly backed financially as that of honorable senators opposite was, I have no doubt that the electors would have returned a Labour government. However, in good time, the Labour party will assume office in the federal sphere. Daily facts are revealed to show that our policy is being adopted by the wheatgrowers of Australia. A few years ago they would have nothing to do with a compulsory pool, but today the majority of them believe in a pool, and were a plebiscite taken on the issue of whether the wheat industry should be thoroughly and efficiently stabilized and a price guaranteed to the farmer for his wheat, the growers would vote overwhelmingly in favour of such a proposal. ","N/A","WHEAT GROWERS RELIEF BILL 1936","/hansard/chamber.xscript/debate[3]/speech[6]/continue[4]/talk.start/para","N/A","N/A"
"0","0","1","0","0","0","0","1","MCLACHLAN, James","KTX","N/A","UAP","N/A","267","The honorable senator would not be prepared to give a chance to those who, he says, are in favour of a compulsory pool to vote on such a proposal tomorrow. ","N/A","WHEAT GROWERS RELIEF BILL 1936","/hansard/chamber.xscript/debate[3]/speech[6]/interjection[3]/talk.start/para","N/A","N/A"
"0","0","0","1","0","0","0","1","BROWN, Gordon","K6P","N/A","N/A","N/A","267","The farmers should have the right to say whether or not they are desirous of reorganizing their industry. Daily, we see evidence of the fact that they are anxious that their industry should be thoroughly organized, so that they will be enabled to receive a decent return for their work. No one can deny that today the farmers are not receiving a fair return for their labour; that is the reason for the introduction of this measure, the faults in which have been revealed by Senator Johnston. However, we, as an Opposition, support any proposal that will assist the farmers. Although £47,000 has already been spent by this Government on trips abroad by its members, Dr. Earle Page has just gone to the United Kingdom. No reason has been given for his trip, although I suppose, according to his lights, he will do his best on behalf of this country on his present mission. No one is better acquainted than is Dr. Earle Page with the problems confronting the farmers. Last session he brought forward a measure to appropriate £12,000,000 to rehabilitate primary industry, but up to the present only a few thousand pounds of that sum has been distributed. Senator Hardy continually speaks of what the Government intends to do for the farmers, and the Government from time to time brings forward measures of this nature which are relatively drops in the ocean. The royal commission which inquired into the wheat industry revealed that the wheat farmers alone owe £140,000,000, and Senator Hardy has pointed out that £10,000,000 will be required to enable the growers to secure efficient machinery to enable them to carry on their industry economically. In contrast to those huge requirements we find today that a mere £1,600,000 is to be distributed through the States to the wheatgrowers, whilst another small sum is to be apportioned for the relief of necessitous growers. We do not oppose the granting of such assistance because we believe in giving assistance to every person who is in need of it. Because of the stupid economic system under which we live these number thousands. The Governments policy of continually tinkering with the situation will never prove effective. Although it claims that it has endeavoured to stabilize the industry, it has taken a long time to move towards that goal. Furthermore, it has only dealt superficially with the farmers problems, because it refuses to take cognizance of economic happenings throughout the world, so far as they affect the wheat industry. ExSenator Elliott, who was pushed out of this chamber by the United Australia party, repeatedly pointed to events happening in other parts of the world and warned the Government of the danger of com petition in a few years from other countries which have placed their industries on a sound economic basis. The honorable member for Macquarie in the House of Representatives (Mr. John Lawson), in addresses delivered at gatherings of United Australia party supporters, since his return from Europe has corroborated the statement of exSenator R. D. Elliott, and said that it is more than likely that in another ten years the Australian wheatgrower will be no longer in the export business. The Government should take notice of the remarks of these men, and not be content with a policy of expediency. There is need for planned action to solve the problems confronting our primary industries, but unfortunately, the attitude of honorable senators opposite is such that it is difficult for honorable senators on this side of the chamber to make them understand the real position. Not until the crisis arrives will they try to do something. We on this side prefer to prepare for the crisis. The statement of Senator Johnston bears out what has been said with regard to expediency. Had the Government been courageous, it would not have left the distribution of this money to the States. My understanding of clause 6 is that, under it, any State which receives a grant from the Commonwealth will be free to distribute the money as it likes so long as the Minister consents to the general basis of distribution whether it shall be an acreage basis or a bushelage basis. I now ask the Minister to say whether or not the States will be absolutely free to distribute the money as they wish, subject to the general approval of the Minister. ","N/A","WHEAT GROWERS RELIEF BILL 1936","/hansard/chamber.xscript/debate[3]/speech[6]/continue[5]/talk.start/para","N/A","N/A"
"0","0","1","0","0","0","0","1","BRENNAN, Thomas","K2Z","N/A","N/A","N/A","268","Yes, subject to the Ministers approval of the scheme. ","N/A","WHEAT GROWERS RELIEF BILL 1936","/hansard/chamber.xscript/debate[3]/speech[6]/interjection[4]/talk.start/para","N/A","N/A"
"0","0","0","1","0","0","0","1","BROWN, Gordon","K6P","N/A","N/A","N/A","268","That means, I take, it, that the Commonwealth Government wipes its hands of the distribution of the money, and leaves it to the judgment of the States, once the scheme of distribution has been generally approved. In my opinion, the Commonwealth should have imposed conditions. Let us suppose that among the wheatfarmers of this country there are a few rich men. I know that, according to the Seventeenth Report of the Commissioner of Taxation, schedule 2, only 3,611 farmers pay in come tax, their taxable income being £1,569,636. Among them are some members of this Parliament, who are said to be well endowed with this worlds goods. In the distribution of this money, would it be possible for a State government to discriminate between a necessitous farmer and a wealthy farmer ? If not, why not ? There is discrimination in regard to the payment of invalid and oldage pensions ; a man with an income above a certain amount is not entitled to a pension. Moreover, a woman whose husband has a certain income is not entitled to a maternity allowance. ","N/A","WHEAT GROWERS RELIEF BILL 1936","/hansard/chamber.xscript/debate[3]/speech[6]/continue[6]/talk.start/para","N/A","N/A"
"0","0","1","0","0","0","0","1","BRENNAN, Thomas","K2Z","N/A","N/A","N/A","269","There is no discrimination between one recipient of an oldage pension and another. ","N/A","WHEAT GROWERS RELIEF BILL 1936","/hansard/chamber.xscript/debate[3]/speech[6]/interjection[5]/talk.start/para","N/A","N/A"
"0","0","0","1","0","0","0","1","BROWN, Gordon","K6P","N/A","N/A","N/A","269","But there is discrimination between one human being and another. The Commonwealth proposes to hand to the States the sum of £1,878,546 for distribution among the wheatgrowers of this country. I should like to know whether it intends to impose any conditions, as, for instance, one which would prevent a very rich man from receiving any of the grant? ","N/A","WHEAT GROWERS RELIEF BILL 1936","/hansard/chamber.xscript/debate[3]/speech[6]/continue[7]/talk.start/para","N/A","N/A"
"0","0","1","0","0","0","0","1","BRENNAN, Thomas","K2Z","N/A","N/A","N/A","269","The Commonwealth docs not propose to act as a policeman. It assumes that the States are as honest as is the Commonwealth. A certain sum will be allotted to each State, but the method of distributing it will be for each State to decide. ","N/A","WHEAT GROWERS RELIEF BILL 1936","/hansard/chamber.xscript/debate[3]/speech[6]/interjection[6]/talk.start/para","N/A","N/A"
"0","0","0","1","0","0","0","1","BROWN, Gordon","K6P","N/A","N/A","N/A","269","I do not impugn the honesty of either the Commonwealth or State governments. I merely ask whether it is mandatory that, once the general basis of distribution has been decided on and approved by the Minister whether it is to be on the basis of acreage or of bushel age there can be no discrimination. ","N/A","WHEAT GROWERS RELIEF BILL 1936","/hansard/chamber.xscript/debate[3]/speech[6]/continue[8]/talk.start/para","N/A","N/A"
"0","0","1","0","0","0","0","1","BRENNAN, Thomas","K2Z","N/A","N/A","N/A","269","The States will distribute the money as they think best, subject to the general approval of the Minister. ","N/A","WHEAT GROWERS RELIEF BILL 1936","/hansard/chamber.xscript/debate[3]/speech[6]/interjection[7]/talk.start/para","N/A","N/A"
"0","0","0","1","0","0","0","1","BROWN, Gordon","K6P","N/A","N/A","N/A","269","Some time ago Senator Johnston suggested that no action by a creditor should leave a farmer with less than £50. I should like to see some provision whereby the money paid to a farmer under this legislation may be safeguarded against confiscation by his creditors. ","N/A","WHEAT GROWERS RELIEF BILL 1936","/hansard/chamber.xscript/debate[3]/speech[6]/continue[9]/talk.start/para","N/A","N/A"
"0","0","1","0","0","0","0","1","BRENNAN, Thomas","K2Z","N/A","N/A","N/A","269","That point is dealt with in clause 8. ","N/A","WHEAT GROWERS RELIEF BILL 1936","/hansard/chamber.xscript/debate[3]/speech[6]/interjection[8]/talk.start/para","N/A","N/A"
"0","0","0","1","0","0","0","1","BROWN, Gordon","K6P","N/A","N/A","N/A","269","That clause reads ","N/A","WHEAT GROWERS RELIEF BILL 1936","/hansard/chamber.xscript/debate[3]/speech[6]/continue[10]/talk.start/para","N/A","N/A"
"0","0","0","0","0","1","0","1","BROWN, Gordon","K6P","N/A","N/A","N/A","N/A","Subject to the last precedingsection, any amount due and payable to a wheatgrower under this act shall not be paid to any person other than the wheatgrower. ","N/A","WHEAT GROWERS RELIEF BILL 1936","/hansard/chamber.xscript/debate[3]/speech[6]/quote/para","N/A","N/A"
"0","0","0","1","0","0","0","1","BROWN, Gordon","K6P","N/A","N/A","N/A","N/A","It does not meet the point that I have raised. Some farmers who pay income tax will draw money under this measure. I should like to know whether that money will be treated as income. If it is treated as income in the case of a farmer who pays income tax, it will be regarded as income in the case of a necessitous farmer also, in which event it will be subject to the predatory actions of certain creditors who have no bowels of compassion when it comes to getting back money that they have lent. ","N/A","WHEAT GROWERS RELIEF BILL 1936","/hansard/chamber.xscript/debate[3]/speech[6]/para[3]","N/A","N/A"
"0","0","1","0","0","0","0","1","HARDY, Charles","KNZ","N/A","N/A","N/A","269","A necessitous farmer will not have any taxable income. ","N/A","WHEAT GROWERS RELIEF BILL 1936","/hansard/chamber.xscript/debate[3]/speech[6]/interjection[9]/talk.start/para","N/A","N/A"
"0","0","0","1","0","0","0","1","BROWN, Gordon","K6P","N/A","N/A","N/A","269","I am aware of that, but a rich farmer will have a taxable income, and will pay tax on the bounty because it will be part of his income. Also it will be income to the poor farmer, and his creditors will be after it. ","N/A","WHEAT GROWERS RELIEF BILL 1936","/hansard/chamber.xscript/debate[3]/speech[6]/continue[11]/talk.start/para","N/A","N/A"
"0","0","1","0","0","0","0","1","HARDY, Charles","KNZ","N/A","N/A","N/A","269","In New South Wales farmers are protected by the Farmers Relief Act. ","N/A","WHEAT GROWERS RELIEF BILL 1936","/hansard/chamber.xscript/debate[3]/speech[6]/interjection[10]/talk.start/para","N/A","N/A"
"0","0","0","1","0","0","0","1","BROWN, Gordon","K6P","N/A","N/A","N/A","269","I should like the Minister, when replying, to clear up the points that. I have mentioned. The Opposition supports the bill, and hopes that the Government will go further and render a measure of assistance to necessitous farmers in. Western Australia and elsewhere who have suffered from drought. ","N/A","WHEAT GROWERS RELIEF BILL 1936","/hansard/chamber.xscript/debate[3]/speech[6]/continue[12]/talk.start/para","N/A","N/A"
"0","0","0","1","0","0","0","1","MCLACHLAN, James","KTX","SOUTH AUSTRALIA","UAP","N/A","269",". As a representative of one of the major wheatgrowing States, and also having had considerable experience of the wheat industry, although not now financially interested in it, I desire to address the Senate on this bill. Despite what Senator Johnston has said of the injustice done to South Australia, I am of the opinion that the farmers of that State are grateful to the Commonwealth Government for the assistance which will be rendered to them under this legislation. In his opening remarks the Acting AttorneyGeneral (Senator Brennan) said that there was nothing new in the bill. That is true; but I find consolation in the belief that it is the last measure of its kind that will come before the Senate. This Parliament enacted legislation last year which should make the introduction of similar bills unnecessary in the future. The Minister said that the shrinkage of wheat prices was the biggest factor in making this legislation necessary. While agreeing with that statement in the main, I point out that there are other factors and circumstances which have placed the wheatgrowing industry in its present unsatisfactory condition. Fortunately the prices received by wheatgrowers some years ago enabled their operations to be remunerative. In fact, wheatgrowers were urged by the various Governments, particularly the Commonwealth Government, to produce more wheat. These and other factors had the effect of inducing large numbers to undertake wheatgrowing on land totally unsuitable for the purpose. One of the main difficulties today is that many wheatgrowers who are in necessitous circumstances have been endeavouring to produce wheat on land quite incapable of growing a remunerative crop. Some time ago wheatgrowing appeared to be so easy and so profitable that some overlooked the fact that years of training were necessary. Some thought that ail that they had to do was to take up a block of land, purchase a team of horses, scatter the seed and sit on the fence and watch the crop grow. Difficulties occasioned in that way cannot be removed by the Commonwealth authorities, but they can me rectified by State Parliaments. These and other matters must be faced quickly and in a determined manner, because it is useless to endeavour to keep men on marginal land when they must necessarily always be a burden on the State. It is a responsibility of governments in wheatgrowing States to reorganize the wheatgrowing industry, so that some land now used for wheatgrowing may revert to grazing areas.  There has been a good deal of discussion this afternoon in connexion with the allocation of grants to the various States, but I contend that it is wise to leave the allocation to the State Parliaments, which are quite capable of making the distribution on an equitable basis. I should like to inform Senator Brown, who said that the Federal Government should be responsible for the distribution of the grant, that the members of State Parliaments are quite as capable as are the members of this Parliament. There are certain provisions of the bill of which I do not approve, particularly in respect of the allocation of the grant. The measure provides that the State Governments shall have the power to deal with necessitous farmers, and to pay a bounty on an acreage basis. I am opposed to both these features, but I am not unmindful of the position of many necessitous wheatgrowers. Abnormal conditions prevail in all States at different times, when some farmers owing to their crops being destroyed cannot pay their way, and it is only fair that those who suffer in that way should receive financial assistance from the Government , but if a bounty is to be paid on an acreage basis, the Commonwealth Government will be disposing of large sums of money to persons who merely sow wheat instead of those who are actually endeavouring to grow it profitably. In South Australia, and probably in some of the other States, men are being assisted by governments merely to sow wheat. They are provided with seed wheat, fertilizers and horse feed and if they receive a bounty on an acreage basis, what is to prevent some sowing seed wheat in such a way that a profitable crop cannot be reaped?","N/A","WHEAT GROWERS RELIEF BILL 1936","/hansard/chamber.xscript/debate[3]/speech[7]/talk.start/para","N/A","N/A"
"0","0","1","0","0","0","0","1","FOLL, Hattil","JZD","N/A","N/A","N/A","270","But surely there is some form of inspection to ensure that the crop is properly sown. ","N/A","WHEAT GROWERS RELIEF BILL 1936","/hansard/chamber.xscript/debate[3]/speech[7]/interjection[1]/talk.start/para","N/A","N/A"
"0","0","0","1","0","0","0","1","MCLACHLAN, James","KTX","N/A","UAP","N/A","270","There is no adequate check so far as I know. I am not saying that such things actually occur, but it is quite possible for unscrupulous persons to act in the way I have mentioned. If an inspector has to visit 250 farms some of which are many miles away, he cannot possibly ascertain whether the superphosphate and seed wheat are being used effectively. ","N/A","WHEAT GROWERS RELIEF BILL 1936","/hansard/chamber.xscript/debate[3]/speech[7]/continue[1]/talk.start/para","N/A","N/A"
"0","0","1","0","0","0","0","1","FOLL, Hattil","JZD","N/A","N/A","N/A","270","On a production basis, the man with the heavy crop gets everything. ","N/A","WHEAT GROWERS RELIEF BILL 1936","/hansard/chamber.xscript/debate[3]/speech[7]/interjection[2]/talk.start/para","N/A","N/A"
"0","0","0","1","0","0","0","1","MCLACHLAN, James","KTX","N/A","UAP","N/A","270","I agree with Senator Brown that there should be some discrimination. Possibly,  Senator Foll may have the idea that a grower who reaps 20 bushels an acre should not receive a bounty and that the one who reaps 10 bushels an acre is entitled to it. Perhaps the honorable senator is unaware of the fact that some wheatgrowers on land producing 12 bushels an acre may be better off financially than those producing 24 bushels an acre. Those producing the smaller yield may be working poorer land, and do not have to pay either Federal or Commonwealth land tax, but those on land producing 24 bushels to the acre, may have to contribute substantially. A man producing 24 bushels an acre may be working land assessed by the Taxation department at £10 an acre, and I maintain that those in that position have to expend more in producing a bushel of wheat than those who do not have to pay any land tax at all.","N/A","WHEAT GROWERS RELIEF BILL 1936","/hansard/chamber.xscript/debate[3]/speech[7]/continue[2]/talk.start/para","N/A","N/A"
