"question_flag","answer_flag","interjection_flag","speech_flag","petition_flag","quote_flag","motionnospeech_flag","chamber_flag","name","name.id","electorate","party","role","page.no","content","subdebateinfo","debateinfo","path","Speaker","Time"
"0","0","0","0","0","0","0","1","N/A","N/A","N/A","N/A","N/A","N/A","The President (Senator the Hon. P. J. Lynch) took the chair at 12 noon, and read prayers.","N/A","N/A","/hansard/chamber.xscript/business.start/para","N/A","N/A"
"0","0","0","0","0","0","0","1","N/A","N/A","N/A","N/A","N/A","N/A","The following papers were presented:","N/A","PAPERS","/hansard/chamber.xscript/debate[1]/para[1]","N/A","N/A"
"0","0","0","0","0","0","0","1","N/A","N/A","N/A","N/A","N/A","N/A","Commonwealth Public Service Act Appointments Department of External Affairs A. T. Stirling, T. Mathew and P. R. Heydon.","N/A","PAPERS","/hansard/chamber.xscript/debate[1]/para[2]","N/A","N/A"
"0","0","0","0","0","0","0","1","N/A","N/A","N/A","N/A","N/A","N/A","Commonwealth Public Service Act Twelfth Report on the Commonwealth Public Service by the Board of Commissioners, dated 11th December, 1935.","N/A","PAPERS","/hansard/chamber.xscript/debate[1]/para[3]","N/A","N/A"
"1","0","0","0","0","0","0","1","HARDY, Charles","KNZ","N/A","N/A","N/A","245","Has the attention of the Leader of the Senatebeen drawn to the press statement that it is the intention of the Commonwealth Government to send to the coronation celebrations a contingent of 1,000 Australian returned soldiers? Will he say whether that is or is not the intention of the Government ? ","CORONATION CELEBRATIONS","QUESTIONS","/hansard/chamber.xscript/debate[2]/subdebate.1[1]/question/talk.start/para","N/A","N/A"
"0","1","0","0","0","0","0","1","PEARCE, George","K0F","N/A","N/A","N/A","245","So far as I am aware, the Government has not yet received an invitation to have any form of representation at the coronation celebrations. No arrangements will be made until such an invitation is received. ","CORONATION CELEBRATIONS","QUESTIONS","/hansard/chamber.xscript/debate[2]/subdebate.1[1]/answer/talk.start/para","N/A","N/A"
"1","0","0","0","0","0","0","1","JOHNSTON, Edward","KP8","N/A","N/A","N/A","245","I ask the Minister in charge of Territories whether the attention of the Government has been drawn to the statement of Mr. F. H. G. Simcocks, an accountant in the Treasury at Rabaul, reported in todays Canberra Times, that the Treasury officials of the mandated territory of New Guinea are concerned in regard to the excessive amount of revenue which is pouring in and do not know which tax should be most reduced in order to dispose of some of the funds which have accumulated? Is it a fact that a duty of 10 per cent. is charged on all mining machinery, including Australian, imported into the territory, and that a royalty of 5 per cent. is charged on all gold produced in it? Will the Government suggest to the administration that the desire of the treasury officials to reduce the revenue might be met by affording some relief to the goldmining industry ? ","RABAUL FINANCES","QUESTIONS","/hansard/chamber.xscript/debate[2]/subdebate.1[2]/question[1]/talk.start/para","N/A","N/A"
"0","1","0","0","0","0","0","1","PEARCE, George","K0F","N/A","N/A","N/A","245","I have seen this unauthorized statement which merely expresses the personal opinion of an official, and does not bear the authority of the Administrator, who is the only official in the territory possessing any right to make such a statement. In reply to the second portion of his question,I inform the honorable senator that representations have been made to me as to the alleged inequitable nature of the existing tax on gold produced in the territory. In fulfilment of a promise that I made, I am at present conducting an investigation into the allegation, to see whether a more equitable form of taxation can be devised. ","RABAUL FINANCES","QUESTIONS","/hansard/chamber.xscript/debate[2]/subdebate.1[2]/answer[1]/talk.start/para","N/A","N/A"
"1","0","0","0","0","0","0","1","COLLINGS, Joseph","K7P","N/A","N/A","N/A","245","Will the Leader of the Senate consult with Mr. Simcocks, who is now in Sydney, with a view to ascertaining how a result similar to that experienced in Rabaul may be achieved in Australia? ","RABAUL FINANCES","QUESTIONS","/hansard/chamber.xscript/debate[2]/subdebate.1[2]/question[2]/talk.start/para","N/A","N/A"
"0","1","0","0","0","0","0","1","PEARCE, George","K0F","N/A","N/A","N/A","245","I do not propose to confer with Mr. Simcocks. I believe, however, that some one else will confer with him. ","RABAUL FINANCES","QUESTIONS","/hansard/chamber.xscript/debate[2]/subdebate.1[2]/answer[2]/talk.start/para","N/A","N/A"
"1","0","0","0","0","0","0","1","COLLINGS, Joseph","K7P","N/A","N/A","N/A","245","Will the Minister representing the Prime Minister state whether it is a fact that during last year certain. Japanese interests endeavoured to obtain a lease of the vast iron ore deposits in Yampi Sound, Western Australia, and whatsteps, if any, were taken by the Government to prevent the lease from being granted? ","YAMPI SOUND IRON ORE DEPOSITS","QUESTIONS","/hansard/chamber.xscript/debate[2]/subdebate.1[3]/question/talk.start/para","N/A","N/A"
"0","1","0","0","0","0","0","1","PEARCE, George","K0F","N/A","N/A","N/A","245",".I am not aware of any endeavour by Japanese interests to obtain a lease of the Yampi Sound iron ore deposits. If such an attempt were made, the matter would not come within the province of the Commonwealth Government, because the granting of mining leases is the prerogative of the State Government. ","YAMPI SOUND IRON ORE DEPOSITS","QUESTIONS","/hansard/chamber.xscript/debate[2]/subdebate.1[3]/answer/talk.start/para","N/A","N/A"
"0","0","0","0","0","0","0","1","N/A","N/A","N/A","N/A","N/A","N/A","Assistance To Growers","WHEAT INDUSTRY","QUESTIONS","/hansard/chamber.xscript/debate[2]/subdebate.1[4]/para","N/A","N/A"
"1","0","0","0","0","0","0","1","PEARCE, George","K0F","N/A","N/A","N/A","246","Information is being obtained in answer to a series of questions asked upon notice by Senator E. B. Johnston regarding Commonwealth relief for wheatgrowers. ","WHEAT INDUSTRY","QUESTIONS","/hansard/chamber.xscript/debate[2]/subdebate.1[4]/question/talk.start/para","N/A","N/A"
"1","0","0","0","0","0","0","1","JOHNSTON, Edward","KP8","N/A","N/A","N/A","246","asked the Minister representing the Prime Minister. upon notice ","PEARLING INDUSTRY","QUESTIONS","/hansard/chamber.xscript/debate[2]/subdebate.1[5]/question[1]/talk.start/para","N/A","N/A"
"0","0","0","0","0","1","0","1","N/A","N/A","N/A","N/A","N/A","N/A","1.Has the Prime Minister received a request from the Government of Western Australia for a grant of £10,000 for the further assistance of the pearling industry in northwestern Australia, following on last years cyclone disaster?  2.What decision has been arrived at in the matter ?","PEARLING INDUSTRY","QUESTIONS","/hansard/chamber.xscript/debate[2]/subdebate.1[5]/question[1]/quote/list/item[1]/para","N/A","N/A"
"0","1","0","0","0","0","0","1","PEARCE, George","K0F","N/A","N/A","N/A","246","The Prime Minister has supplied the following answers :  1.Yes. 2.The Commonwealthhas already contributed £7,500 towards the pearling industry at Broome, including £5,000 for assistance in connexion with the hurricane disaster. The request for further assistance is receiving consideration.","PEARLING INDUSTRY","QUESTIONS","/hansard/chamber.xscript/debate[2]/subdebate.1[5]/answer[1]/talk.start/para","N/A","N/A"
"1","0","0","0","0","0","0","1","JOHNSTON, Edward","KP8","N/A","N/A","N/A","246","asked the Minister representing the Minister for Trade and Customs, upon notice ","PEARLING INDUSTRY","QUESTIONS","/hansard/chamber.xscript/debate[2]/subdebate.1[5]/question[2]/talk.start/para","N/A","N/A"
"0","0","0","0","0","1","0","1","JOHNSTON, Edward","KP8","N/A","N/A","N/A","N/A","1.Has the Tariff Board reported on the question of assistance to the pearling industry in northwestern Australia?  2.If so, when will the report be available to Parliament?","PEARLING INDUSTRY","QUESTIONS","/hansard/chamber.xscript/debate[2]/subdebate.1[5]/question[2]/quote/list/item[1]/para","N/A","N/A"
"0","1","0","0","0","0","0","1","PEARCE, George","K0F","N/A","N/A","N/A","246","The Minister for Trade and Customs has supplied the following answers :  1.Yes, but further inquiries are in progress. 2.When the Government has made a decision on the matter the report will be tabled in the House.","PEARLING INDUSTRY","QUESTIONS","/hansard/chamber.xscript/debate[2]/subdebate.1[5]/answer[2]/talk.start/para","N/A","N/A"
"1","0","0","0","0","0","0","1","JOHNSTON, Edward","KP8","N/A","N/A","N/A","246","asked the Minister representing the Minister for Trade and Customs, upon notice ","MOTOR CAR BODIES","QUESTIONS","/hansard/chamber.xscript/debate[2]/subdebate.1[6]/question/talk.start/para","N/A","N/A"
"0","0","0","0","0","1","0","1","N/A","N/A","N/A","N/A","N/A","N/A","1.Is it a fact that a serious position exists in Western Australiaas the distributors of English motor cars are unable to obtain body supplies manufactured in Australia for English cars?  2.Has the Minister received requests for cancellation of all duty and primage on English panels and bodies for English motor cars ? 3.Would such action result in increased revenue in chassis imports from Great Britain and create extra employment in Australian chassis employment plants? 4.Is it a fact that the duty on galvanized iron was lifted owing to inadequacy of Australian supplies? 5.If so, could this precedent be extended to English bodies and panels? 6.If not, why not?","MOTOR CAR BODIES","QUESTIONS","/hansard/chamber.xscript/debate[2]/subdebate.1[6]/question/quote/list/item[1]/para","N/A","N/A"
"0","1","0","0","0","0","0","1","PEARCE, George","K0F","N/A","N/A","N/A","246","Tie Minister for Trade and Customs informs me that the information is being obtained. ","MOTOR CAR BODIES","QUESTIONS","/hansard/chamber.xscript/debate[2]/subdebate.1[6]/answer/talk.start/para","N/A","N/A"
"0","0","0","0","0","0","0","1","N/A","N/A","N/A","N/A","N/A","N/A","Restrictions upon Shipping.","NEW GUINEA","QUESTIONS","/hansard/chamber.xscript/debate[2]/subdebate.1[7]/para","N/A","N/A"
"1","0","0","0","0","0","0","1","JOHNSTON, Edward","KP8","N/A","N/A","N/A","246","asked the Minister in Charge of Territories, upon notice ","NEW GUINEA","QUESTIONS","/hansard/chamber.xscript/debate[2]/subdebate.1[7]/question/talk.start/para","N/A","N/A"
"0","0","0","0","0","1","0","1","N/A","N/A","N/A","N/A","N/A","N/A","1.Is it a fact that a new Ordinance restricting shipping in the Territory of New Guinea is now awaiting the assent of the GovernorGeneral?  2.If so, is it a fact that the restrictions imposed by this new Ordinance are regarded in the Territory as very inimical to all interests there ? 3.Is it a fact that a unanimous resolution of both official and nonofficial members of the Legislative Council of New Guinea in 1934 urged the Commonwealth Government to refrain from interference with shipping in the territory ? 4.Is it a fact that the official members of the Legislative Council of New Guinea were unsympathetic to the new Ordinance, but passed it under the direction of the Commonwealth Government? 5.If so, what were the reasons for the Commonwealth Governments action in the matter? 6.Is it a fact that every nonofficial member of the Legislative Council of New Guinea opposed the new Ordinance on the grounds that shipping and buying competition would be restricted, and planters and returned soldier settlers exposed to exploitation? 7.Is the Ordinance directly contrary to assurances previously given to the settlers by the Commonwealth Government? 8.Will the Government consider the Hansard reports of the debates on this subject in the Legislative Council of New Guinea, before approving this Ordinance? 9.If not, why not?","NEW GUINEA","QUESTIONS","/hansard/chamber.xscript/debate[2]/subdebate.1[7]/question/quote/list/item[1]/para","N/A","N/A"
"0","1","0","0","0","0","0","1","PEARCE, George","K0F","N/A","N/A","N/A","246","The answers to the honorable senators questions are as follows:  1.Yes. 2 to 9. The ordinance, which is entitled the Shipping Ordinance 1930, has been reserved for the pleasure of the GovernorGeneral pursuant to the New Guinea Act 19201935, and will not come into operation until a notification of the GovernorGenerals pleasure in regard thereto is published in New Guinea by the Administrator of the Territory. The Government is aware that there is certain opposition to the enactment of the ordinance, and has received and considered representations against the ordinance including a resolution passed by the Legislative Council of New Guinea in 1034. Those representations and all aspects of the question have received the careful consideration of the Commonwealth Government, which, however, is of opinion that the public interest of the Commonwealth and the territories makes it necessary that action should be taken to promulgate an ordinance on the lines of the Shipping Ordinance 1936.","NEW GUINEA","QUESTIONS","/hansard/chamber.xscript/debate[2]/subdebate.1[7]/answer/talk.start/para","N/A","N/A"
"1","0","0","0","0","0","0","1","MACDONALD, Allan","KS7","N/A","UAP; LP from 1944","N/A","247","asked the Minister representing the Prime Minister, upon notice ","NATIONAL INSURANCE","QUESTIONS","/hansard/chamber.xscript/debate[2]/subdebate.1[8]/question/talk.start/para","N/A","N/A"
"0","0","0","0","0","1","0","1","N/A","N/A","N/A","N/A","N/A","N/A","1.Will he inform the Senate if the Western Australian Government Statistician (Mr. Bennett), who was on loan to the Federal Government, has concluded his actuarial calculations in connexion with the proposed scheme for national insurance, under consideration by this Government?  2.If so, will it be possible for senators to obtain Mr. Bennetts uptodate figures, as a result of his research work?","NATIONAL INSURANCE","QUESTIONS","/hansard/chamber.xscript/debate[2]/subdebate.1[8]/question/quote/list/item[1]/para","N/A","N/A"
"0","1","0","0","0","0","0","1","PEARCE, George","K0F","N/A","N/A","N/A","247","The Prime Minister has supplied the following answers :  1. The Government has received a report from Messrs. S. Bennett, Government Statistician, Western Australia, and F. F. Innes, Actuary, Australian Mutual Provident Society, who were asked to inquire into the question of national insurance. 2.The report is now being considered by the Government, and an announcement will bo made when a decision has been arrived at.","NATIONAL INSURANCE","QUESTIONS","/hansard/chamber.xscript/debate[2]/subdebate.1[8]/answer/talk.start/para","N/A","N/A"
"0","0","0","0","0","0","0","1","N/A","N/A","N/A","N/A","N/A","N/A","Bill received from the House of Representatives.","N/A","WHEAT GROWERS RELIEF BILL 1936","/hansard/chamber.xscript/debate[3]/para[1]","N/A","N/A"
"0","0","0","0","0","0","0","1","N/A","N/A","N/A","N/A","N/A","N/A","Suspension of Standing and Sessional Orders.","N/A","WHEAT GROWERS RELIEF BILL 1936","/hansard/chamber.xscript/debate[3]/para[2]","N/A","N/A"
"0","0","0","1","0","0","0","1","PEARCE, George","K0F","Western Australia","UAP","Minister for External Affairs","247","[12.11]. I move ","N/A","WHEAT GROWERS RELIEF BILL 1936","/hansard/chamber.xscript/debate[3]/speech[1]/talk.start/para","N/A","N/A"
"0","0","0","0","0","1","0","1","N/A","N/A","N/A","N/A","N/A","N/A","That so much of the Standing and Sessional Orders be suspended as would prevent the hill being passed through all its stages without delay. ","N/A","WHEAT GROWERS RELIEF BILL 1936","/hansard/chamber.xscript/debate[3]/speech[1]/quote/para","N/A","N/A"
"0","0","0","1","0","0","0","1","None","K0F","N/A","N/A","N/A","N/A","This is the principal appropriation measure which it is necessary for the Senate to pass. Three other smaller appropriation measures have to he considered later. When these are passed and certain bills have been returned from the House of Representatives it will be possible for the Senate to adjourn until the House of Representatives has completed its consideration of the tariff.  Question resolved in the affirmative. Standing and Sessional Orders suspended. Bill (on motion by Senator Brennan) read a first time.","N/A","WHEAT GROWERS RELIEF BILL 1936","/hansard/chamber.xscript/debate[3]/speech[1]/para[1]","N/A","N/A"
"0","0","0","0","0","0","0","1","N/A","N/A","N/A","N/A","N/A","N/A","Second Reading","N/A","WHEAT GROWERS RELIEF BILL 1936","/hansard/chamber.xscript/debate[3]/para[3]","N/A","N/A"
"0","0","0","1","0","0","0","1","BRENNAN, Thomas","K2Z","VICTORIA","UAP","Minister without portfolio assisting the Minister for Commerce","248","I move ","N/A","WHEAT GROWERS RELIEF BILL 1936","/hansard/chamber.xscript/debate[3]/speech[2]/talk.start/para","N/A","N/A"
"0","0","0","0","0","1","0","1","BRENNAN, Thomas","K2Z","N/A","N/A","N/A","N/A","That the bill be now read a second time. ","N/A","WHEAT GROWERS RELIEF BILL 1936","/hansard/chamber.xscript/debate[3]/speech[2]/quote/para","N/A","N/A"
"0","0","0","1","0","0","0","1","BRENNAN, Thomas","K2Z","N/A","N/A","N/A","N/A","This measure is designed to provide relief for the wheatgrowers of Australia with respect to the harvest of 193536.  Yesterday, the Leader of the Opposition (Senator Collings) criticized the Government for its handtomouth policy is regard to many matters that affect the rural industries. Criticism of that sort leaves out of account the fact that Australia not long ago passed through the greatest war in history, the effects of which are still being felt, and, possibly as a consequence of it, experienced the greatest depression in our history. It would be a great mistake, I think, and I believe that honorable senators will agree with me if we were to choose a time when the world was suffering from the consequences of a very grave war or depression to embark upon some great change in our social and economic system. The time for such a change is when normal conditions prevail. The conditions through which we have passed are, in themselves, a justification for measures of a temporary character; and in that respect the Government feelsthat it has not failed. In successive years since the prices of rural products generally, and possibly wheat in particular, dropped in 1930, financial assistance has been given by the Commonwealth to the wheat industry. Justification for that lay in the fact that other industries had been assisted, and that the wheat industry is of such importance to the community that, if it were not saved, the rest of the community must go down with it. More than 70,000 persons, it is estimated, are directly connected with the wheat industry, and in respect of production it is now second in importance only to wool. At the same time, the Government has not been unmindful of the need for doing something which will obviate these yearly appeals to Parliament which the Leader of the Opposition (SenatorCollings) yesterday deprecated. To a certain extent, I concur in his objections. In 1933 a royal commission was appointed for the very purpose of discovering whether something could not be done to obviate the necessity for these yearly appeals to Parliament for assistance by the wheat industry. The second report drawn up by the. commission, which has now completed its labours, contained u recommendation that something in the nature of a homeconsumption price should be created.","N/A","WHEAT GROWERS RELIEF BILL 1936","/hansard/chamber.xscript/debate[3]/speech[2]/para[1]","N/A","N/A"
"0","0","1","0","0","0","0","1","COLLINGS, Joseph","K7P","N/A","N/A","N/A","248","Did not Che commission also say something about a compulsory pool? ","N/A","WHEAT GROWERS RELIEF BILL 1936","/hansard/chamber.xscript/debate[3]/speech[2]/interjection[1]/talk.start/para","N/A","N/A"
