"question_flag","answer_flag","interjection_flag","speech_flag","petition_flag","quote_flag","motionnospeech_flag","chamber_flag","name","name.id","electorate","party","role","page.no","content","subdebateinfo","debateinfo","path","Speaker","Time"
"0","0","1","0","0","0","0","1","JOHNSTON, Edward","KP8","N/A","N/A","N/A","279","I do not regard it as part of my duty to come to this Parliament to attack any State government in regard to matters of which I have not an intimate knowledge. I have, however, an intimate knowledge of federal affairs, which it is my duty to watch, and I condemn the Commonwealth ","N/A","WHEAT GROWERS RELIEF BILL 1936","/hansard/chamber.xscript/debate[3]/speech[11]/interjection[11]/talk.start/para","N/A","N/A"
"0","0","0","1","0","0","0","1","JOHNSTON, Edward","KP8","N/A","N/A","N/A","N/A","Government for its policy in regard to the wheat industry as evidenced by this bill. ","N/A","WHEAT GROWERS RELIEF BILL 1936","/hansard/chamber.xscript/debate[3]/speech[11]/para","N/A","N/A"
"0","0","1","0","0","0","0","1","MACDONALD, Allan","KS7","N/A","UAP; LP from 1944","N/A","280","I, too, desire to make a personal explanation in order to refute a statement made by Senator Johnston in relation to the Leader of the Senate (Senator Pearce). ","N/A","WHEAT GROWERS RELIEF BILL 1936","/hansard/chamber.xscript/debate[3]/speech[11]/interjection[12]/talk.start/para","N/A","N/A"
"0","0","0","1","0","0","0","1","PRESIDENT, The","10000","N/A","N/A","N/A","280","Is the honorable senator personally affected? ","N/A","WHEAT GROWERS RELIEF BILL 1936","/hansard/chamber.xscript/debate[3]/speech[11]/continue[6]/talk.start/para","N/A","N/A"
"0","0","1","0","0","0","0","1","MACDONALD, Allan","KS7","N/A","UAP; LP from 1944","N/A","280","I am in a better position to state the facts than is Senator Johnston. ","N/A","WHEAT GROWERS RELIEF BILL 1936","/hansard/chamber.xscript/debate[3]/speech[11]/interjection[13]/talk.start/para","N/A","N/A"
"0","0","0","1","0","0","0","1","PRESIDENT, The","10000","N/A","N/A","N/A","280","The honorable senator would be in order only if he himself were affected by any remark made by another honorable senator. ","N/A","WHEAT GROWERS RELIEF BILL 1936","/hansard/chamber.xscript/debate[3]/speech[11]/continue[7]/talk.start/para","N/A","N/A"
"0","0","0","1","0","0","0","1","BRENNAN, Thomas","K2Z","N/A","N/A","N/A","280","in reply I shall be brief in my reply, particularly since the fierce attack on the Government by Senator Johnston has already been adequately dealt with. The honorable senator described the assistance proposed to be given by this measure to the wheatgrowers of Australia as the least generous help given in five years. He spoke as if it were the duty of the Commonwealth Government to vote sums of money year after year for the relief of wheatgrowers. That is not so. The grants which have been made from time to time have been the result of a recognition by the Commonwealth Government of the exceptional circumstances which have operated during recent years. A complete answer to the charge that the amount this year is smaller than it has been for five years is that the position of the wheatgrowers of Australia today is better than it has been at any time during the last five years. The honorable senators constant references to the unsympathetic action of the Government are, I am afraid, due to an unconquerable tendency to criticize the Government whatever it does. We, in this chamber, are aware that the honorable senators speech is the outcome of his great solicitude for the wheatfarmers of Western Australia, but other persons, more cynical and censorious, may attribute his attack to entirely different causes. If they do so, it will be the misfortune of the honorable senator, and we shall be able only to sympathize with him. In a long speech, the honorable senator had little to say by way of criticism of the measure itself. ","N/A","WHEAT GROWERS RELIEF BILL 1936","/hansard/chamber.xscript/debate[3]/speech[12]/talk.start/para","N/A","N/A"
"0","0","1","0","0","0","0","1","BROWN, Gordon","K6P","N/A","N/A","N/A","280","asked if it would be possible for the Government to protect from garnishee proceedings the sums paid to wheatgrowers under this bill. That subject has been raised on a number of occasions in connexion with bills of a similar nature. The Government has declined to include a clause of that nature, because of a doubt as to the constitutionality of such a provision, and of the power of the Commonwealth to pass laws to deal with matters which are entirely within the province of a State. That is the reason for the inclusion of clause 8, which provides that the money shall not be paid to any one but the wheatgrower. It is therefore clear that if the money is obtained from him, it must be by legal proceedings taken after the money has come into his possession. ","N/A","WHEAT GROWERS RELIEF BILL 1936","/hansard/chamber.xscript/debate[3]/speech[12]/interjection[1]/talk.start/para","N/A","N/A"
"0","0","0","1","0","0","0","1","BROWN, Gordon","K6P","N/A","N/A","N/A","N/A","Senator Allan MacDonald referred to the definition of wheatgrower in clause 2. I remind him that the Acts Interpretation Act provides that  person  includes a corporation. I cannot understand the particular case to which the honorable senator referred. ","N/A","WHEAT GROWERS RELIEF BILL 1936","/hansard/chamber.xscript/debate[3]/speech[12]/para[1]","N/A","N/A"
"0","0","1","0","0","0","0","1","MACDONALD, Allan","KS7","N/A","UAP; LP from 1944","N/A","280","The fact remains that the limited liability company to which I referred did not get the money. ","N/A","WHEAT GROWERS RELIEF BILL 1936","/hansard/chamber.xscript/debate[3]/speech[12]/interjection[2]/talk.start/para","N/A","N/A"
"0","0","0","1","0","0","0","1","BRENNAN, Thomas","K2Z","N/A","N/A","N/A","280","Under the Wheat Bounty Act a wheatgrower was not defined in the way that he is defined in this bill. The weakness which existed in the act mentioned, has now been removed, and the definition is sufficiently wide to cover a corporation or a small company engaged in the production of wheat The honorable senator also asked a question in connexion with clause 6, which can be answered in committee.  Question resolved in the affirmative. Bill read a second time. In committee: Clauses 1 to 5 agreed to. Clause 6","N/A","WHEAT GROWERS RELIEF BILL 1936","/hansard/chamber.xscript/debate[3]/speech[12]/continue/talk.start/para","N/A","N/A"
"0","0","0","0","0","1","0","1","BRENNAN, Thomas","K2Z","N/A","N/A","N/A","N/A","Any amount granted to a State in accordance with the provisions of section four of this act shall be paid on condition that it is applied by the State in providing relief to wheatgrowers in such manner aa is approved by tha Minister after recommendation by the prescribed authority of that State. ","N/A","WHEAT GROWERS RELIEF BILL 1936","/hansard/chamber.xscript/debate[3]/speech[12]/quote/para","N/A","N/A"
"0","0","0","1","0","0","0","1","COLLINGS, Joseph","K7P","Queensland","N/A","N/A","280",". Speaking on the second reading of this bill, I said that I would endeavour to improve it in committee. The members of the Opposition are strongly opposed to wealthy wheatgrowers receiving any of the money which has been contributed by all taxpayers including the poor. We cannot see any reason why wheatgrowers not in need of financial assistance should receive any portion of this grant. I therefore move ","N/A","WHEAT GROWERS RELIEF BILL 1936","/hansard/chamber.xscript/debate[3]/speech[13]/talk.start/para","N/A","N/A"
"0","0","0","0","0","1","0","1","COLLINGS, Joseph","K7P","N/A","N/A","N/A","N/A","That at the end of the clause the following proviso be added:  Provided no approval shall be given in respect of payment to any wheatgrower who is assessed as capable of paying working expenses and meeting present interest charges, plus £125 per annum being the amount set down by the commission as a full remuneration to the farmer for his own personal efforts.","N/A","WHEAT GROWERS RELIEF BILL 1936","/hansard/chamber.xscript/debate[3]/speech[13]/quote[1]/para[1]","N/A","N/A"
"0","0","0","1","0","0","0","1","COLLINGS, Joseph","K7P","N/A","N/A","N/A","N/A","I stated earlier in the day that an amount larger than £125 would be our objective, but in order to meet the Government in this matter, I have adopted that amount. I accept the statement of the royal commission on the wheat industry that £125 is a reasonable personal income for a farmer, after paying working expenses, and meeting present interest charges. ","N/A","WHEAT GROWERS RELIEF BILL 1936","/hansard/chamber.xscript/debate[3]/speech[13]/para[1]","N/A","N/A"
"0","0","1","0","0","0","0","1","HARDY, Charles","KNZ","N/A","N/A","N/A","281","Is that amount to represent the new basic wage for the wheatgrowers ? ","N/A","WHEAT GROWERS RELIEF BILL 1936","/hansard/chamber.xscript/debate[3]/speech[13]/interjection/talk.start/para","N/A","N/A"
"0","0","0","1","0","0","0","1","COLLINGS, Joseph","K7P","N/A","N/A","N/A","281","Of course it is not. It is the amount mentioned by the royal commission. I trust that the amendment will be carried, because on the 8th December, 1933, the Government embodied a similar clause in the Wheat Growers Relief Bill then before Parliament. I am endeavouring to assist wheatgrowers who have no taxable income, and I have used the amount embodied in my amendment because it was used by the commission. A similar clause inserted in the Wheat Growers Relief Bill 1933 read ","N/A","WHEAT GROWERS RELIEF BILL 1936","/hansard/chamber.xscript/debate[3]/speech[13]/continue/talk.start/para","N/A","N/A"
"0","0","0","0","0","1","0","1","COLLINGS, Joseph","K7P","N/A","N/A","N/A","N/A","A wheatgrower shall not he entitled to receive assistance under this act unless  (a)during the year ended on the thirtieth day of June One thousand nine hundred and thirty three he derived no taxable income.","N/A","WHEAT GROWERS RELIEF BILL 1936","/hansard/chamber.xscript/debate[3]/speech[13]/quote[2]/para","N/A","N/A"
"0","0","0","1","0","0","0","1","COLLINGS, Joseph","K7P","N/A","N/A","N/A","N/A","That was supported by nineteen honorable senators including members of the present Opposition and was opposed by only six. I trust that the amendment will he accepted because the members of the Opposition strongly object to wheat growers not in needy circumstances receiving financial assistance in this form. ","N/A","WHEAT GROWERS RELIEF BILL 1936","/hansard/chamber.xscript/debate[3]/speech[13]/para[2]","N/A","N/A"
"0","0","0","1","0","0","0","1","HARDY, Charles","KNZ","New South Wales","N/A","N/A","281",". I am extremely surprised that the Leader of the Opposition (Senator Collings) should move such an amendment, because in the past he has always claimed that not only the city workers, but also the farmers, should receive a reasonable return for their labour. He now declares that a reasonable return for a wheatgrower should be less than 50s. a week, an admission which he will find it hard to justify in the future. In endeavouring to calculate a wheat growers costs, the royal commission on the wheat industry used an amount of £125 a year, but it did not at any stage state that that should be the maximum amount which he should receive. ","N/A","WHEAT GROWERS RELIEF BILL 1936","/hansard/chamber.xscript/debate[3]/speech[14]/talk.start/para","N/A","N/A"
"0","0","1","0","0","0","0","1","COLLINGS, Joseph","K7P","N/A","N/A","N/A","281","And I am not suggesting that it should be. Wheatgrowers are entitled to more than that. ","N/A","WHEAT GROWERS RELIEF BILL 1936","/hansard/chamber.xscript/debate[3]/speech[14]/interjection/talk.start/para","N/A","N/A"
"0","0","0","1","0","0","0","1","HARDY, Charles","KNZ","N/A","N/A","N/A","281","Because I believe that they should receive more than 50s. a week, I shall oppose the amendment. ","N/A","WHEAT GROWERS RELIEF BILL 1936","/hansard/chamber.xscript/debate[3]/speech[14]/continue/talk.start/para","N/A","N/A"
"0","0","0","1","0","0","0","1","BRENNAN, Thomas","K2Z","Victoria","UAP","Acting AttorneyGeneral","281",". I, too, am surprised that the Leader of the Opposition (Senator Collings) should move such an amendment, because it has always been the objective of the party of which he is a member that there should be no discrimination in the payment of money appropriated for bounties, pensions, and similar purposes. The Opposition has always advocated a flat rate, and has contended that, in the payment of bounties, there should not be any inquiries into the circumstances of any individual. It is true that under this clause certain rich wheatgrowers may receive the bounty provided in the bill. For instance., Senator Johnston, who does not require the money, and who possibly will not collect it, can benefit under the measure in its present form; but it would be peculiarly discriminatory if the measure were so framed that Senator Johnston and others in a similar position were precluded from participating. ","N/A","WHEAT GROWERS RELIEF BILL 1936","/hansard/chamber.xscript/debate[3]/speech[15]/talk.start/para","N/A","N/A"
"0","0","1","0","0","0","0","1","HARDY, Charles","KNZ","N/A","N/A","N/A","281","Senator Johnston is not a necessitous wheatgrower. ","N/A","WHEAT GROWERS RELIEF BILL 1936","/hansard/chamber.xscript/debate[3]/speech[15]/interjection[1]/talk.start/para","N/A","N/A"
"0","0","0","1","0","0","0","1","BRENNAN, Thomas","K2Z","N/A","N/A","N/A","281","No. But the honorable senator could benefit under other provisions unless special steps are taken to exclude him. I do not think that the Leader of the Opposition can expect a majority of the committee, or of the members of the House of Representatives, to accept his amendment. ","N/A","WHEAT GROWERS RELIEF BILL 1936","/hansard/chamber.xscript/debate[3]/speech[15]/continue[1]/talk.start/para","N/A","N/A"
"0","0","1","0","0","0","0","1","COLLINGS, Joseph","K7P","N/A","N/A","N/A","282","Will the Acting AttorneyGeneral (Senator Brennan) guarantee that money appropriated under this bill will not he paid to persons, including some members of Parliament, who do not need it? ","N/A","WHEAT GROWERS RELIEF BILL 1936","/hansard/chamber.xscript/debate[3]/speech[15]/interjection[2]/talk.start/para","N/A","N/A"
"0","0","0","1","0","0","0","1","BRENNAN, Thomas","K2Z","N/A","N/A","N/A","282","We cannot set up an inquisition. The committee is asked to pass a measure under which all wheatgrowers may benefit. ","N/A","WHEAT GROWERS RELIEF BILL 1936","/hansard/chamber.xscript/debate[3]/speech[15]/continue[2]/talk.start/para","N/A","N/A"
"0","0","1","0","0","0","0","1","COLLINGS, Joseph","K7P","N/A","N/A","N/A","282","Will the Minister accept an amendment to ensure that payments will not be made to persons who have a taxable income? ","N/A","WHEAT GROWERS RELIEF BILL 1936","/hansard/chamber.xscript/debate[3]/speech[15]/interjection[3]/talk.start/para","N/A","N/A"
"0","0","0","1","0","0","0","1","BRENNAN, Thomas","K2Z","N/A","N/A","N/A","282","No. I ask the Leader of the Opposition not to press the amendment, because he must realize that the committee cannot support it, and even if it were accepted here it would be rejected by a majority of the House of Representatives. ","N/A","WHEAT GROWERS RELIEF BILL 1936","/hansard/chamber.xscript/debate[3]/speech[15]/continue[3]/talk.start/para","N/A","N/A"
"0","0","0","1","0","0","0","1","COLLINGS, Joseph","K7P","Queensland","N/A","N/A","282",". I do not propose to be influenced by threats to the effect that my amendment will misrepresent the views of my party, which may have to carry the stigma in the future, because I have included an income of £125 per annum in my amendment. I want from the Minister an assurance that a portion of this grant will not be paid to wealthy wheatgrowers. Even if the amendment be rejected, I shall submit another to ascertain whether a majority of the committee think it right to vote public money to wealthy persons, some of whom are members of this Parliament. Why should money contributed by all sections of the community be used to supplement the incomes of wealthy wheatgrowers? ","N/A","WHEAT GROWERS RELIEF BILL 1936","/hansard/chamber.xscript/debate[3]/speech[16]/talk.start/para","N/A","N/A"
"0","0","1","0","0","0","0","1","HARDY, Charles","KNZ","N/A","N/A","N/A","282","Does the honorable senator think that a wheatgrower who receives more than £125 per annum is a wealthy man? ","N/A","WHEAT GROWERS RELIEF BILL 1936","/hansard/chamber.xscript/debate[3]/speech[16]/interjection[1]/talk.start/para","N/A","N/A"
"0","0","0","1","0","0","0","1","COLLINGS, Joseph","K7P","N/A","N/A","N/A","282","I contend that if a farmer receives an amount exceeding £125 a year after paying working expenses and meeting interest charges, his position is superior to that of a basic wage worker. If the Minister will give an assurance that this money will not be paid to wealthy people, the position will be altered materially. I believe that the moneyshould be paid to persons who have no taxable income, and I am prepared to reconstruct my amendment in those terms if that will suit the Minister. ","N/A","WHEAT GROWERS RELIEF BILL 1936","/hansard/chamber.xscript/debate[3]/speech[16]/continue/talk.start/para","N/A","N/A"
"0","0","1","0","0","0","0","1","BRENNAN, Thomas","K2Z","N/A","N/A","N/A","282","I regret that I am unable to give such an assurance. ","N/A","WHEAT GROWERS RELIEF BILL 1936","/hansard/chamber.xscript/debate[3]/speech[16]/interjection[2]/talk.start/para","N/A","N/A"
"0","0","0","1","0","0","0","1","BRENNAN, Thomas","K2Z","N/A","N/A","N/A","N/A","Amendment negatived. ","N/A","WHEAT GROWERS RELIEF BILL 1936","/hansard/chamber.xscript/debate[3]/speech[16]/para","N/A","N/A"
"0","0","0","1","0","0","0","1","MACDONALD, Allan","KS7","WESTERN AUSTRALIA","UAP; LP from 1944","N/A","282",". Will the Minister indicate whether he intends to investigate the finding of the select committee of the Legislative Council of Western Australia, in regard to the actions of the distributing agent for the Commonwealth, the Agricultural Bank? ","N/A","WHEAT GROWERS RELIEF BILL 1936","/hansard/chamber.xscript/debate[3]/speech[17]/talk.start/para","N/A","N/A"
"0","0","0","1","0","0","0","1","BRENNAN, Thomas","K2Z","Victoria","UAP","Acting AttorneyGeneral","282",". If any violation of Commonwealth law has occurred, the matter will be investigated; otherwise I regret that I am unable to accede to the honorable senators wish. ","N/A","WHEAT GROWERS RELIEF BILL 1936","/hansard/chamber.xscript/debate[3]/speech[18]/talk.start/para","N/A","N/A"
"0","0","0","1","0","0","0","1","COLLINGS, Joseph","K7P","Queensland","N/A","N/A","282",". As the Minister gave us no assurance that he will safeguard the allocation of this money in order to prevent it from reaching the bank accounts of those who cannot by any stretch of the imagination be said to require it, I move ","N/A","WHEAT GROWERS RELIEF BILL 1936","/hansard/chamber.xscript/debate[3]/speech[19]/talk.start/para","N/A","N/A"
"0","0","0","0","0","1","0","1","COLLINGS, Joseph","K7P","N/A","N/A","N/A","N/A","That at the end of the clause the following proviso be added:  Provided no approval shall be given in respect of payment to any wheat grower who is assessed as capable of paying working expenses and meeting present interest charges, plus £260 per annum. ","N/A","WHEAT GROWERS RELIEF BILL 1936","/hansard/chamber.xscript/debate[3]/speech[19]/quote/para","N/A","N/A"
"0","0","1","0","0","0","0","1","BRENNAN, Thomas","K2Z","N/A","N/A","N/A","282","If this amendment be rejected, the honorable senator will apparently continue to move similar amendments, merely altering the amount each time. ","N/A","WHEAT GROWERS RELIEF BILL 1936","/hansard/chamber.xscript/debate[3]/speech[19]/interjection/talk.start/para","N/A","N/A"
"0","0","0","1","0","0","0","1","The CHAIRMAN (Senator Sampson).","10000","N/A","N/A","N/A","282","As the amendment moved by the honorable senator is, in substance, the same as the amendment just negatived, only the amount being altered, I rule that it is out of order.  Clause agreed to. Clauses 1 to 11 agreed to. Preamble and title agreed to. Bill reported without amendment; report adopted. Bill read a third time.","N/A","WHEAT GROWERS RELIEF BILL 1936","/hansard/chamber.xscript/debate[3]/speech[19]/continue/talk.start/para","N/A","N/A"
"0","0","0","0","0","0","0","1","N/A","N/A","N/A","N/A","N/A","N/A","Bill returned from the House of Representatives with a message intimating that it had made the amendments requested by the Senate in this bill.","N/A","PRIMARY PRODUCERS RELIEF BILL 1936","/hansard/chamber.xscript/debate[4]/para[1]","N/A","N/A"
"0","0","0","0","0","0","0","1","N/A","N/A","N/A","N/A","N/A","N/A","Bill read a third time.","N/A","PRIMARY PRODUCERS RELIEF BILL 1936","/hansard/chamber.xscript/debate[4]/para[2]","N/A","N/A"
"0","0","0","0","0","0","0","1","N/A","N/A","N/A","N/A","N/A","N/A","Sitting suspended from5.43 to 9.30 p.m.","N/A","PRIMARY PRODUCERS RELIEF BILL 1936","/hansard/chamber.xscript/debate[4]/para[3]","N/A","N/A"
"0","0","0","0","0","0","0","1","N/A","N/A","N/A","N/A","N/A","N/A","Bill received from the House of Representatives.","N/A","APPLE AND PEAR BOUNTY BILL 1936","/hansard/chamber.xscript/debate[5]/para[1]","N/A","N/A"
"0","0","0","0","0","0","0","1","N/A","N/A","N/A","N/A","N/A","N/A","Standing and Sessional Orders suspended.","N/A","APPLE AND PEAR BOUNTY BILL 1936","/hansard/chamber.xscript/debate[5]/para[2]","N/A","N/A"
"0","0","0","0","0","0","0","1","N/A","N/A","N/A","N/A","N/A","N/A","Bill (on motion by Senator Sir George Pearce) read a first time.","N/A","APPLE AND PEAR BOUNTY BILL 1936","/hansard/chamber.xscript/debate[5]/para[3]","N/A","N/A"
"0","0","0","0","0","0","0","1","N/A","N/A","N/A","N/A","N/A","N/A","Second Reading","N/A","APPLE AND PEAR BOUNTY BILL 1936","/hansard/chamber.xscript/debate[5]/para[4]","N/A","N/A"
"0","0","0","1","0","0","0","1","PEARCE, George","K0F","WESTERN AUSTRALIA","ALP; NAT from 1917; UAP from 1931","Minister for External Affairs","283","[9. I move ","N/A","APPLE AND PEAR BOUNTY BILL 1936","/hansard/chamber.xscript/debate[5]/speech[1]/talk.start/para","N/A","N/A"
"0","0","0","0","0","1","0","1","N/A","N/A","N/A","N/A","N/A","N/A","That the bill be now read a second time. ","N/A","APPLE AND PEAR BOUNTY BILL 1936","/hansard/chamber.xscript/debate[5]/speech[1]/quote/para","N/A","N/A"
"0","0","0","1","0","0","0","1","None","10000","N/A","N/A","N/A","N/A","At the outset I wish to say that Senator Payne and other Tasmanian senators have made strong representations that the amount of money to be provided under this bill should be distributed on a case basis. The Government has given full consideration to their requests and I propose to set out the reasons why we are asking the Senate to pass the measure in its present form.  The bill provides for the distribution to growers of apples and pears of £80,000 a portion of the amount of £100,000 which was placed an the Estimates for the assistance of necessitous fruitgrowers in respect of the 1935 export season at the rate of 4d. a bushel on all fruit exported during the year ended the 31st December, 1935. In 1933, following urgent representations on behalf of growers for assistance to compensate them for losses incurred in the export trade during that year, the Government caused an investigation to be made of the position of growers in Tasmania, which State suffered more acutely than other States, with a view to determining the best means of rendering assistance to the industry. Many proposals were examined, but most of them were found to be impracticable, and the Government finally made available £125,000, in the form of grants to the States, for assistance to growers of apples and pears. This sum was apportioned between the various States in proportion to their share in the export trade. In 1934, although export prices for apples were much better than in 1933, the industry was still in a difficult position, and again Parliament was asked to set aside £125,000 for the purpose of assisting the industry. For the financial year 193536 an amount of £100,000 was provided for the same purpose, and as I have said, the Government has given considerable thought to the best method of distributing this money. The Department of Commerce has been at some pains to examine the financial results of the 1935 export season, and it has ascertained that the net realizations f.o.b. Australian ports were much better than any price obtained since 1929. In 1935 the average f.o.b. price for all overseas shipments of apples in Tasmania was 6s. 5d. a bushel, compared with ls. Sd. a bushel in 1933, and 3s. a bushel in 1934. Tasmania is responsible for the export of over 50 per cent, of the total Australian export of apples. Growers in all the other States also reported much better prices in 1934 than in previous years.","N/A","APPLE AND PEAR BOUNTY BILL 1936","/hansard/chamber.xscript/debate[5]/speech[1]/para[1]","N/A","N/A"
"0","0","1","0","0","0","0","1","HAYES, John","KOF","N/A","N/A","N/A","283","Is that 6s. 5d. a case the figure for Tasmania ? ","N/A","APPLE AND PEAR BOUNTY BILL 1936","/hansard/chamber.xscript/debate[5]/speech[1]/interjection[1]/talk.start/para","N/A","N/A"
"0","0","0","1","0","0","0","1","PEARCE, George","K0F","N/A","N/A","N/A","283","Yes. Having regard to the improved returns obtained for fruit exported in 1935, it was thought that some means of assistance could be devised which would be of more lasting benefit to the industry than the payment of a bounty on export. ","N/A","APPLE AND PEAR BOUNTY BILL 1936","/hansard/chamber.xscript/debate[5]/speech[1]/continue[1]/talk.start/para","N/A","N/A"
