"question_flag","answer_flag","interjection_flag","speech_flag","petition_flag","quote_flag","motionnospeech_flag","chamber_flag","name","name.id","electorate","party","role","page.no","content","subdebateinfo","debateinfo","path","Speaker","Time"
"0","0","0","1","0","0","0","1","MCKENNA, Nicholas","KTN","N/A","N/A","N/A","926","That is so, but in the Broadcasting Act the subject matters were at least detailed whereas in this measure we have not one incident of television detailed. Yet, there are many incidents, such as, the number of television stations, their frequency, their hours of broadcasting and the class of programme that they may broadcast. In passing this clause, the committee will be handing an instruction to the Minister to do what he likes about commercial television stations. That is exactly what we are being asked to do. The Minister has simply replied that, under the clause, the committee is giving to him a completely blank cheque without limiting him by any regulation in respect of any matter relating to television. He might add, as the Prime Minister has done, in effect, Do not worry about that. We are not going to do anything under the clause at all . That proves the point that the Opposition has been making that this bill is a sham. It merely pretends to the public that something is going to be d jue. As I said earlier, the only single virtue about the clause is that it will afford a very good opportunity to any one who desires to challenge the validity of this measure in the courts. I cannot see that the clause has any other virtue. It is dangerous, and both the Prime Minister and the Minister for Repatriation recognize that fact, because they have assured the Parliament that nothing will be done under it. That being so, I ask again what reason exists for inserting it in the bill. I shall leave it at that.  Clause agreed to. Clause 5 (National television programmes). . This clause is just another instance of the lack of care and haste with which this measure has been prepared. The clause reads","N/A","TELEVISION BILL 1953","/hansard/chamber.xscript/debate[7]/speech[3]/continue[1]/talk.start/para","N/A","N/A"
"0","0","0","0","0","1","0","1","MCKENNA, Nicholas","KTN","N/A","N/A","N/A","N/A","The Minister may direct an authorized authority ","N/A","TELEVISION BILL 1953","/hansard/chamber.xscript/debate[7]/speech[3]/quote[1]/para","N/A","N/A"
"0","0","0","1","0","0","0","1","MCKENNA, Nicholas","KTN","N/A","N/A","N/A","N/A","And we are obliged to the Minister for telling us that the authorized authority is an authorized authority to provide television programmes for transmission from a television station that is made available by the PostmasterGeneral under section three of this Act and that authority shall, subject to this Act and any directions of the Minister, provide adequate and comprehensive programmes for transmission from that station.  When we refer to the Broadcasting Act, we find that one of the fundamental functions of the Australian Broadcasting Control Board is set out in section 6k to which reference has already been made. Subsection (1.) of that section reads","N/A","TELEVISION BILL 1953","/hansard/chamber.xscript/debate[7]/speech[3]/para[3]","N/A","N/A"
"0","0","0","0","0","1","0","1","MCKENNA, Nicholas","KTN","N/A","N/A","N/A","N/A","The functions of the Board shall be  (c)to ensure that adequate and comprehensive programmes are provided by such stations to serve the best interests of the general public","N/A","TELEVISION BILL 1953","/hansard/chamber.xscript/debate[7]/speech[3]/quote[2]/para","N/A","N/A"
"0","0","0","1","0","0","0","1","MCKENNA, Nicholas","KTN","N/A","N/A","N/A","N/A","That refers to both broadcasting and television stations. I underline the words  to serve the best interests of the general public . That is a function that is committed under the Broadcasting Act to the Australian Broadcasting Control Board. But under this clause, not only is the authorized authority to be completely divested of power to determine what are adequate and comprehensive programmes, but also all power, again, is to be vested in the Minister, who may direct the authority to provide adequate and comprehensive programmes for transmission from the studio. I ask the committee to note the omission from this bill of the words,  to serve the best interests of the general public . That is a significant omission. The power to provide adequate and comprehensive programmes is vested in the Minister, and the function that wa3 committed to the Australian Broadcasting Control Board is bypassed and completely overridden. The obligation that was placed on the board in providing programmes to serve the best interests of the general public is not imposed on the Minister under this bill. Surely, if the Government is concerned, as it expresses itself to have been, to serve the best interests of the general public in introducing television, should it not, as a part of that policy, be bound in determining the programmes, as they are the main bone of contention, to serve the best interests of the Australian public just as the Australian Broadcasting Control Board is bound in the provision of radio programmes? The Minister may say that such a provision is not necessary, because he will serve the best interests of the general public, and that that will be done automatically. But that is evidence of haste in the preparation of this measure. It is a grave omission. This clause vests complete power in the Minister to control programmes. Again that is dangerous. The Minister merely tells the committee that no television stations will be established until after the comprehensive bill has been introduced, that nothing will be done under this measure and, therefore, there is no reason for the Minister to direct anybody in this respect. I readily believe that nothing will be done under this bill. That has been the case for a period of three years, and I believe that it will continue to be the case under this Government for a considerable period. If nothing is to be done until after the comprehensive bill has been dealt with, 1 again ask the Minister to explain the reason for the insertion of this clause. ","N/A","TELEVISION BILL 1953","/hansard/chamber.xscript/debate[7]/speech[3]/para[5]","N/A","N/A"
"0","0","0","1","0","0","0","1","BYRNE, Condon","K3R","QUEENSLAND","ALP; QLP from 1957; DLP from 1968","N/A","928","; I direct the attention of the committee particularly to the words  provide adequate and comprehensive programmes for transmission from that station . Significantly, those words are used only in this clause, which applies to national stations only. However, section 6k of the Broadcasting Act applies a similar phrase in respect of both national and commercial stations. Under that section, the latter are required to provide adequate and comprehensive programmes ; and the conditions with which they must comply are definitely set out. Reference has already been made to some of those conditions. The point I make is that under this clause only the national stations, and not commercial stations, will be obliged, in express terms, to provide adequate and comprehensive programmes. Furthermore, the meaning of the words  adequate and comprehensive programmes i# expressly set out in the Broadcasting Act. That fact gives additional significance to the omission of those words from this clause. The conditions that the Australian Broadcasting Control Board must observe relate to variety of programmes, broadcasting of divine worship, political and controversial matter and the proportion of advertisements. Significantly, no provision is being made in this bill in respect of such matters, whereas specific provision is made in respect of them in the Broadcasting Act. This departure is so pronounced that it warrants the closest attention by the Minister; and I have no doubt that the committee will expect him to give an acceptable explanation of the fact that, whereas the corresponding provision in the Broadcasting Act covers both national and commercial stations, this clause, as drafted, will cover national stations only. ","N/A","TELEVISION BILL 1953","/hansard/chamber.xscript/debate[7]/speech[4]/talk.start/para","N/A","N/A"
"0","0","0","1","0","0","0","1","COOPER, Walter","JQP","Queensland","CP","Min ister for Repatriation","928",". I shall reply first to the comments that were made by the Leader of the Opposition (Senator McKenna). When I was replying to the debate on the motion for the second reading, I said that the Government was expressing in this bill its policy in respect of television, and that provision was being made for the introduction of television on the dual system. The authorized authority to be directed by the Minister will first have to be granted authority under a further bill to be introduced in the Parliament. The Parliament will thus have a full opportunity  to discuss, at that time, matters relating to the authorized authority referred to in the clause.  It is considered desirable that, for the time being, the authority which is to provide the national television programme should bo required to consult the Minister and accept his directions before developing any organization or expending substantial sums of money in connexion with plans for the provision of programmes from national television stations. The British Broadcasting Corporation was, until recently, subject to a similar requirement in respect of television. The licence under which that organization operated until the end of 1951 prescribed that  the corporation shall observe and perform such stipulations, conditions and restrictions, and do such acts and things in relation to the television broadcasting station, or the television service, as from time to time may be prescribed by the PostmasterGeneral in writing . The matters to which Senator Byrne referred this afternoon are covered by the terms of reference of the royal commission. When the report of the commission is received, I suggest that the Government will have in its possession a worthwhile basis on which to proceed.","N/A","TELEVISION BILL 1953","/hansard/chamber.xscript/debate[7]/speech[5]/talk.start/para","N/A","N/A"
"0","0","0","1","0","0","0","1","MCKENNA, Nicholas","KTN","Tasmania","N/A","N/A","928",". I think that the Minister for Repatriation (Senator Cooper) is in error in informing the Senate that clause 5 deals with the Australian Broadcasting Commission. It does nothing of the kind. Clause 5 states, inter alia, that the Minister may direct an authorized authority. According to the definition clause contained in the bill, that authority may be either the Australian Broadcasting Commission or some other body set up by the Government. The Minister has given us no information whatsoever concerning the composition of that body. We do not know whether, it will be composed of one man or ten men. If it is to be composed of more than one person, what interests will the representatives on that body serve? We have been given no information inn t&at respect.  To the claim of the Minister that this bill is declaratory of the Governments policy, let. me say that this is the most extraordinary medium that I have seen for that purpose. I recollect an honorable senator this afternoon, with great glee picking, up the joint policy speech of the present Government parties, made by the Prime Minister (Mr. Menzies) in 1949, I believe that that was the first time that any honorable senator on the other side of the chamber has had the courage to produce that policy speech in three and a half years. They have been ashamed of it, and with very good reason. On this very point, an honorable senator on the other side of the chamber rose with pride and pointed out how the policy of the Government in relation to television, and private interests being allowed to enter the field, was declared in 1949. Why, therefore, the sham ,and the pretence that this bill is intended to declare government policy ? Why choose this particular medium with which to take up the time of the Senate? I suggest that if the1 Government wishes to announce its policy, a more appropriate method would be to make a statement in the Parliament or a press statement outside it. It is obvious, from the explanations which the Minister has made, that the whole bill is complete humbug. The purpose behind it has never been revealed by the Government. Every clause that we have dealt with so far has been shown to be a hollow sham. For the Minister to try to tell us that this is a proper medium for the declaration of government policy is asking the Opposition to believe something that it cannot accept. Nor, I believe, will the public accept it. I should like the Minister, or any other honorable senator opposite, to point to one effective thing which this bill1 will do in relation to the introduction of television in Australia. The Government has been most careful to say, in effect,  We shall do nothing under the legislation but will wait till we hear from the royal commission. Then we shall bring in a comprehensive bill, which will deal with all the details . I think that the Minister had better find some explanation for the introduction of this bill other than that it is merely an announcement of Government policy. I wonder whether some other honorable senators opposite would care to have a shot at trying to tell us why the bill has been introduced.","N/A","TELEVISION BILL 1953","/hansard/chamber.xscript/debate[7]/speech[6]/talk.start/para","N/A","N/A"
"0","0","0","1","0","0","0","1","COOPER, Walter","JQP","Queensland","CP","Minister for Repatriation","929",". It is of little use my attempting to tell the honorable senator the purpose of the bill if he will not take any notice of what I say. ife knows as well as I do that the authorized authority referred to in clause 5 cannot be described or explained at the present time. That is clear to everybody who takes the trouble to read the bill. I have already informed the honorable senator that no such authority will be appointed before the matter comes before the Parliament again. ","N/A","TELEVISION BILL 1953","/hansard/chamber.xscript/debate[7]/speech[7]/talk.start/para","N/A","N/A"
"0","0","0","1","0","0","0","1","MCKENNA, Nicholas","KTN","N/A","N/A","N/A","929","Then why refer to it in the bill? ","N/A","TELEVISION BILL 1953","/hansard/chamber.xscript/debate[7]/speech[7]/continue[1]/talk.start/para","N/A","N/A"
"0","0","0","1","0","0","0","1","COOPER, Walter","JQP","N/A","N/A","N/A","929","I have already told the honorable senator why. It is futile to repeat the reason if he will not take any notice of what I say. It is clear that the  authorized authority , about which he is making so much fuss, will not be declared by the Minister before the matter is discussed by the Parliament. ","N/A","TELEVISION BILL 1953","/hansard/chamber.xscript/debate[7]/speech[7]/continue[2]/talk.start/para","N/A","N/A"
"0","0","0","1","0","0","0","1","COOKE, Joseph","JQN","Western Australia","N/A","N/A","929",". Clause 5 refers to a television station that is made available by the PostmasterGeneral under section three of this Act . . . I take it that that reference is to a national television station only. It thus appears that the Government is prepared to make rules for national television stations and to incorporate such rules in legislation at the same time as it appoints a royal commission which is charged with the duty of inquiring into and reporting upon the standards which national television stations should observe. It is pertinent to ask whether the royal commission is to be governed by this legislation or by its terms of reference. ","N/A","TELEVISION BILL 1953","/hansard/chamber.xscript/debate[7]/speech[8]/talk.start/para","N/A","N/A"
"0","0","0","1","0","0","0","1","COOPER, Walter","JQP","Queensland","CP","Minister for Repatriation","929",". The royal commission will be governed by the terms of reference which it has already received. ","N/A","TELEVISION BILL 1953","/hansard/chamber.xscript/debate[7]/speech[9]/talk.start/para","N/A","N/A"
"0","0","0","1","0","0","0","1","GRANT, Donald","KMN","New South Wales","N/A","N/A","930",". I have been listening very intently to the attempts of the Minister for Repatriation (Senator Cooper) to answer the queries raised by the Leader of the Opposition (Senator McKenna) concerning the  authorized authority  referred to in the clause. I must say that I have been learning more and more about less and less. I do not think the Minister knows the answers to those queries, but it seems to me that certain powerful representatives of private interests have been promised something by this discredited government. I think that it has said to them,  This is like the appointment of the Commonwealth Bank Board personnel. We cannot tell you who the representatives are going to be, but you can be sure that certain private interests will be represented. We cannot yet tell the country who they are going to be; indeed, we cannot even tell the Minister for Repatriation . If the clause does not mean that, I suggest that it means nothing. When my friend, the Opposition Whip, Senator Critchley, asked me several times during the last few days to speak on this bill, I told him that I think it is a fraud and means nothing. We have heard a great deal about the technical difficulties involved in the introduction of television. Much has been said about costs, what has happened in England and other countries, and about the moral and ethical aspects, all of which is really extraneous. We have not yet been told why television is to be introduced. ","N/A","TELEVISION BILL 1953","/hansard/chamber.xscript/debate[7]/speech[10]/talk.start/para","N/A","N/A"
"0","0","0","1","0","0","0","1","BYRNE, Condon","K3R","QUEENSLAND","ALP; QLP from 1957; DLP from 1968","N/A","930",". I wish to know whether the Government proposes to tender its point of view before the royal commission, because, under the first of its terms of reference, the commission may find that television is not practicable in this country for the reasons that it is contrary to the financial and economic considerations involved. The Government, of course, is the custodian of the economic situation of the country. I therefore consider that it has a moral obligation to go before the commission and, if necessary, give evidence that television is not practicable at this stage.  Does the Government intend to assist the commission by putting forward the point of view represented by the measure we now have before us? In my opinion, it is under an obligation to both the commission and the people to do so. I should like to have an assurance from the Minister one way or the other on that point.","N/A","TELEVISION BILL 1953","/hansard/chamber.xscript/debate[7]/speech[11]/talk.start/para","N/A","N/A"
"0","0","0","1","0","0","0","1","COOPER, Walter","JQP","Queensland","CP","Minister for Repatriation","930",". The answer is  No . ","N/A","TELEVISION BILL 1953","/hansard/chamber.xscript/debate[7]/speech[12]/talk.start/para","N/A","N/A"
"0","0","0","1","0","0","0","1","SANDFORD, Charles Walter","K4S","Victoria","N/A","N/A","930",". The Minister has stated that further legislation on this subject will be introduced by the Government after the royal commission has taken evidence. Why, then, is it necessary to provide, in this clause, that  the Minister may direct an authorized authority . . .  if such an authority does not exist? Can the Minister answer that question? ","N/A","TELEVISION BILL 1953","/hansard/chamber.xscript/debate[7]/speech[13]/talk.start/para","N/A","N/A"
"0","0","0","1","0","0","0","1","COOPER, Walter","JQP","Queensland","CP","Minister for Repatriation","930",". I have already answered that question.  Clause agreed to. Clause 6 (Powers of commission).","N/A","TELEVISION BILL 1953","/hansard/chamber.xscript/debate[7]/speech[14]/talk.start/para","N/A","N/A"
"0","0","0","1","0","0","0","1","MCKENNA, Nicholas","KTN","Tasmania","N/A","Leader of the Opposition","930",". This clause in effect states that where a Minister directs the Australian Broadcasting Commission to provide television programmes, the commission is to have all the necessary or financial powers to enable it to carry out that instruction. Then certain particular powers are to be conferred without limiting the general grant of power. The broad ones are that the commission may deal with land, buildings or other property and rights and secondly it may pay costs, charges and expenses. This clause relates to the Australian Broadcasting Commission only. The bill is a farce. The Minister may set up an authorized body and then the commission is given power only if it is directed to provide programmes. In other words, if, instead of empowering the commission to provide the programme, the Minister, under the authority previously taken in this bill, empowers an authorized body to do so, this bill does not confer a single power or authority on the authorized body. Can I prove in any other way the futility of referring to an authorized body in this bill? It explains the brilliant answer that came from the Minister today when he said that an authorized body is an authorized body. I point out that the power that is conferred by this clause applies only if the Australian Broadcasting Commission is authorized to provide certain programmes but if the Minister in his wisdom decides to authorize another body, no powers are conferred on that body to carry out its duty although he is free, under this bill, to impose them upon the authorized body. There could not be a clearer indication of the stupidity and futility of the bill. ","N/A","TELEVISION BILL 1953","/hansard/chamber.xscript/debate[7]/speech[15]/talk.start/para","N/A","N/A"
"0","0","0","1","0","0","0","1","VINCENT, Victor","KAC","Western Australia","N/A","N/A","931",". I point out to the Leader of the Opposition (Senator McKenna) that an enabling act would cover adequately the problem to which he has referred. This clause attempts to widen or alter the powers of the Australian Broadcasting Commission to cover television programmes in addition to its existing powers with regard to broadcasting services. Section 48 of the Australian Broadcasting Act 19421948 gives the Australian Broadcasting Commission the right to spend £5,000 without reference to the Minister. I understand from clause 6 of the bill that the Australian Broadcasting Commission cannot spend one penny under the provisions of the bill without the consent of the Minister. It could not even buy a pen. Will the Minister explain why the Australian Broadcasting Commission is given power under the Broadcasting Act to spend £5,000 without ministerial consent but that under the bill it will not be allowed to spend a penny without his consent ? ","N/A","TELEVISION BILL 1953","/hansard/chamber.xscript/debate[7]/speech[16]/talk.start/para","N/A","N/A"
"0","0","0","1","0","0","0","1","COOPER, Walter","JQP","Queensland","CP","Minister for Repatriation","931",". In reply to the comments of the Leader of the Opposition (Senator McKenna) with regard to powers for other authorities, I point out that the necessary powers will be given in the legislation under which any such authority is to be set up. ","N/A","TELEVISION BILL 1953","/hansard/chamber.xscript/debate[7]/speech[17]/talk.start/para","N/A","N/A"
"0","0","1","0","0","0","0","1","MCKENNA, Nicholas","KTN","N/A","N/A","N/A","931","Does that not show the futility of referring in the bill to an authorized body which can have no powers? ","N/A","TELEVISION BILL 1953","/hansard/chamber.xscript/debate[7]/speech[17]/interjection/talk.start/para","N/A","N/A"
"0","0","0","1","0","0","0","1","COOPER, Walter","JQP","N/A","N/A","N/A","931","The honorable senator is entitled to his point of view and I am entitled to mine. ","N/A","TELEVISION BILL 1953","/hansard/chamber.xscript/debate[7]/speech[17]/continue/talk.start/para","N/A","N/A"
"0","0","0","1","0","0","0","1","COOKE, Joseph","JQN","Western Australia","N/A","N/A","931",". This clause states that the commission may have such powers as are necessary or convenient for the purpose of enabling it to comply with the preceding section and without limiting the generality of those powers. Does that apply also to an authorized body or only to the Australian Broadcasting Commission ? Whether it be one or the other, is the power unlimited? Once the Minister gives the signal, apparently the relevant authority will have unlimited power without further reference to the Minister. ","N/A","TELEVISION BILL 1953","/hansard/chamber.xscript/debate[7]/speech[18]/talk.start/para","N/A","N/A"
"0","0","0","1","0","0","0","1","COOPER, Walter","JQP","Queensland","CP","Minister for Repatriation","931",". Clause fi deals with the Australian Broadcasting Commission only.  Clause agreed to. Clauses 7 and 8 agreed to. Clause 9 (Offences).","N/A","TELEVISION BILL 1953","/hansard/chamber.xscript/debate[7]/speech[19]/talk.start/para","N/A","N/A"
"0","0","0","1","0","0","0","1","MCKENNA, Nicholas","KTN","Tasmania","N/A","Leader of the Opposition","931",". The clause now before the committee reads ","N/A","TELEVISION BILL 1953","/hansard/chamber.xscript/debate[7]/speech[20]/talk.start/para","N/A","N/A"
"0","0","0","0","0","1","0","1","MCKENNA, Nicholas","KTN","N/A","N/A","N/A","N/A","A person who contravenes or fails to comply with any provision of this act or the regulations, or with a condition of a licence granted under this Act, is guilty of an offence against this Act punishable upon conviction by such penalty as is prescribed. ","N/A","TELEVISION BILL 1953","/hansard/chamber.xscript/debate[7]/speech[20]/quote/para","N/A","N/A"
