"question_flag","answer_flag","interjection_flag","speech_flag","petition_flag","quote_flag","motionnospeech_flag","chamber_flag","name","name.id","electorate","party","role","page.no","content","subdebateinfo","debateinfo","path","Speaker","Time"
"0","0","0","1","0","0","0","1","COLE, George","K6W","Tasmania","N/A","N/A","911",". p[ost aspects of this bill have been dealt with adequately by previous speakers. I propose therefore to confine my speech to a few personal views on television. I have been prompted to speak on this measure by a very significant sentence in the speech of the Leader of the Opposition (Senator McKenna). The honorable senator said that television was virgin soil in the entertainment field. We must be sure that the ground is not already fouled when this new industry is founded. I shall not deal with the technicalities of television. That phase of the measure was well covered by Senator Byrne.  I should like to see the introduction of television delayed as long as possible, but I realize that we cannot halt scientific progress. Ultimately, television must become an important medium of education and entertainment in Australia, but the programmes will have to be strictly censored. That will be the responsibility of the Government. Only the best programmes should be permitted. Undoubtedly, television could be a wonderful aid to education, particularly the education of the children, but I have no doubt that, in wrong hands, television could also Have horrible effects on rising generations. Moral considerations are of great importance. Undoubtedly, television has reached great heights of popularity in the entertainment field of the United States of America, but it is because of the need for strict censorship of television broadcasts that I criticize the Governments decision to allow commer cial interests into the television field. 1 realize, however, that the Constitution clearly indicates that the Commonwealth has.not sole control of television. Therein lies the great weakness. The primary objective of commercial television broadcasts is to ensure that advertising shall reach the community. In the absence of stern censorship there is danger that commercial television broadcasts will be very much like commercial radio broadcasts. That would be to the great detriment of our young people. We, in Australia, do not fully grasp the potentialities of television. It is entirely different from radio broadcasts. Imagination plays a very important part in wireless broadcasts, but with television nothing will be left to the imagination. All the horrible facts will be before the eyes of the child. ","N/A","TELEVISION BILL 1953","/hansard/chamber.xscript/debate[4]/speech[5]/talk.start/para","N/A","N/A"
"0","0","1","0","0","0","0","1","HENTY, Norman","KOW","N/A","N/A","N/A","912","Surely the honorable senator does not believe that the Government would provide television broadcasts of that kind. ","N/A","TELEVISION BILL 1953","/hansard/chamber.xscript/debate[4]/speech[5]/interjection[1]/talk.start/para","N/A","N/A"
"0","0","0","1","0","0","0","1","COLE, George","K6W","N/A","N/A","N/A","912","We need have no fear on that score, because the Government will not be relying on profits from advertising to provide programmes. ","N/A","TELEVISION BILL 1953","/hansard/chamber.xscript/debate[4]/speech[5]/continue[1]/talk.start/para","N/A","N/A"
"0","0","1","0","0","0","0","1","HENTY, Norman","KOW","N/A","N/A","N/A","912","The Governments programmes might be worse than the commercial programmes. ","N/A","TELEVISION BILL 1953","/hansard/chamber.xscript/debate[4]/speech[5]/interjection[2]/talk.start/para","N/A","N/A"
"0","0","0","1","0","0","0","1","COLE, George","K6W","N/A","N/A","N/A","912","That will depend upon the individual point of view. Some people do not regard the chamber music that is broadcast by the Australian Broadcasting Commission as good entertainment. Nevertheless, from the cultural point of view the Australian Broadcasting Commission does broadcast the bestprogrammes. Australian Broadcasting Commission stations do not broadcast any immoral matter of any advertising matter. They do not have to make broadcasting pay. They can present educational programmes which are worthwhile. The Boya! Com mission on Television should visit the United States of America or send for the findings of committees of educationists who have examined television there. With that information in its possession the Government would be careful not to license television programmes indiscriminately. Of 150 children who were interviewed in the United States of America, many suffered a physical effect from television. At least 40 per cent, have developed the habit of biting their finger nails and they experienced nightmares. In that way television has had an almost immoral effect. We shall have to guard against that possibility in bringing television to Australia.  According to a report that I have read, of 856 programmes that were televised in Los Angeles or San Francisco in one week, 75 per cent, dealt with crime. About 60 per cent, of the programmes were shown during hours when children would be watching them. It is obvious that there must be a stern control of television. Although we cannot confine the televising of entertainment to the Australian Broadcasting Commission or a similar body we must be very wary in granting licences to commercial broadcasting stations. I should like the Government to examine carefully all television programmes. I would prefer the sole control of television to be with the Australian Broadcasting Commission or a similar body so that all programmes could be carefully examined and presented at suitable times. I should like television to be kept solely as an educational medium which would uplift the children of Australia instead of having a demoralizing effect. It has been estimated that children in the United States of America spend from three to four hours a day watching television. I have always maintained that too many people watch sport in this country and that not enough take part in it. The introduction of television will add to that trend. At least in attending sports people have the exercise of walking to the grounds and at a football match they may indulge in a couple of fights. But they will only sit and watch television and. will not even get the fresh air that they would get at sporting events. A lot of people will sit, as people sit in America, in bars consuming beer and watching in a very muggy atmosphere. That might be all right for some people but it is not a suitable activity for the youth of Australia. As I said before, I do not wish to deal with technicalities or with the legal aspect of television which has been dealt with very well by the Leader of the Opposition, Senator Byrne. I simply want to make my plea to the Government to ensure that when this entertainment comes to Australia it will be carefully supervised. I am sure that the censorship will be of the highest order in the Government television stations. I am pleased that television will be introduced by a Labour government which I am sure will be responsible for the introduction of worthwhile programmes. I shall support the amendment although I am a little against its timing as I desire the measure to be introduced by a soon to be elected Labour Government.","N/A","TELEVISION BILL 1953","/hansard/chamber.xscript/debate[4]/speech[5]/continue[2]/talk.start/para","N/A","N/A"
"0","0","0","1","0","0","0","1","ARMSTRONG, John Ignatius","K0C","New South Wales","N/A","N/A","913",". This legislation appears to me to be completely unnecessary. It will give the right to private enterprise to share television with the government authority. Why legislation is necessary for that purpose I am not certain. However, this legislation has provided the Senate with the opportunity to hold an interesting debate which has ranged over all aspects of television. The matter of primary importance in connexion with television is what is presented to the people who view it. The Government must accept the responsibility of ensuring programmes of a reasonably high standard. I was in London for about seven weeks in 1948 and I had a television viewing set in my room all that time. Not many honorable senators have had as great an opportunity to view television as I had in those weeks. During that period the greatest television subject, of all times the 1948 Olympic Games provided television entertainment of the very highest order. One was able to view the swimming, the foot racing, and the marathon race, and witness the intense drama of the final 400 yards of that race. As most of the television time was occupied by the Olympic Games, only a few hours were left each day for studio programmes and one would expect, in view of that fact, that the standard of those programmes would have been very high. In fact, the quality of the rest of the programme was extremely low. The Australian public is entitled to much better television programmes than the British public received at that time. How they will secure such programmes lies in the dim mists of the future.  Television is designed for the general utility and benefit of those people who buy television sets and view it. So we must work out a system whereby the buyer of television sets can view programmes of a reasonable standard. In the great cities there will be two channels. It has been decided that one will be a government channel and the other a commercial channel. I do not think that the wisdom of Solomon could cope with the problem of allocating the second channel. Newspaper interests, churches, sporting interests, commercial interests, and big advertisers will bid for it and whoever it is given to the Government will be criticized. I think that the Government will have to establish a second station under Commonwealth control and auction the time available on it to private interests. I do not think that it will be possible to allocate the second channel to a single individual because such a course would add tremendous difficulties to television. I shall now direct, the attention of honorable senators to the tremendous importance of the industries that develop and sustain the television industry. Television involves the use of electronics, and therefore it has great defence significance. There has been an almost negligible development of electronics used in the radio industry of this country during the last ten years, and further development depends on the establishment of the television industry. It will be necessary for us to train technicians, because of the increasingly important: part, that the electronic industry plays in wartime. There has been a tendency to place more emphasis on the development of proximity fuses and guided weapons. As honorable senators know, scientists have developed rockets which are guided from the ground, and will catch and destroy the target. The basis for further improvement is the electronics industry, which is now the bottleneck. Modern aircraft, such as jet fighters, travel so fast that the human reactions of the pilots of attacking aircraft are too slow to enable them to aim orthodox weapons. Consequently, the weapons are actuated by electronics. Scientific development has thus been concentrated on electronics. There is not in Australia today any appreciable commercial reserve from which we could draw if we were plunged into another war and had to develop our electronic industry quickly. When the last war broke out our radio industry, which was well developed, was expanded to an extraordinary degree. .Servicemen and women were taught the art of radio signalling, and in addition many hundreds of employees of the radio industry were quickly trained, and subsequently they contributed materially to our war effort. Unfortunately, that is not the position of the electronics industry in Australia today. It is for that reason that I consider that it is important to commence television here as soon as possible. Then, if war should materialize, we would have available a moderate electronics industry, which could be developed. Let us not forget that, in the event of war, the odds would be against our being able to obtain from America many essential items of technical equipment, particularly if other countries were ahead of us in the queue. In 1941 and 1942 we experienced great difficulty in obtaining technical equipment overseas. Our only hope is to try to make ourselves reasonably independent in this connexion. In conclusion, I want to emphasize that the Australian Labour party is the only political party that has shown any indication of goodwill and honesty in its approach to television. The previous Labour government invited tenders for the erection of television stations in this country, and had it not been defeated at the general election of December, 1949, television would now be a normal part of the life of the Australian community. The present Government has deliberately frustrated the development of television in Australia, and the bill before the chamber is further evidence that the Government is not honest in its approach to television. There are too many problems associated with it, and the Government has shown since it has been in office that it does not like problems; indeed, by its actions, it has shown that it cannot solve them. lt now seems inevitable that Labour, which made the first great step towards the introduction of television in this country, will ultimately bear the responsibility for providing the Australian people with television services.","N/A","TELEVISION BILL 1953","/hansard/chamber.xscript/debate[4]/speech[6]/talk.start/para","N/A","N/A"
"0","0","0","1","0","0","0","1","SANDFORD, Charles Walter","K4S","Victoria","N/A","N/A","914",". Although I did not intend to participate in this debate, I have been impelled to do so in order to try to provoke the Government to state a justifiable reason for the introduction of this measure at this juncture. Very little more than has already been mentioned could be said about the advantages and disadvantages of introducing television into Australia. The Opposition does not want to stem progress, but it wants toknow why the Government has seen fit to bring down this legislation before the sittings of the Royal Commission on Television have been concluded. As the terms of reference of the royal commission are very wide, this bill cannot possibly have any effect until its recommendations have been furnished. For that reason, I consider that the Government should accept the amendment that has been moved by the Leader of the Opposition (Senator McKenna), the effect of which would be to allow this bill to stand over at least until the report of the royal commission has been received.. I support the contention of my leader that a limit should be imposed on the time for the completion of the taking of evidence. As television will be an innovation for Australia, I agree with previous speakers that conceivably the royal commission will want to obtain as much evidence as possible from other countries where television is an accomplished fact. We want to learn from the experiences of those countries. As some honorable senators have mentioned, the impact of television on the community will be vastly different from the impact of radio, because television will provide visual education for our young people. If television is to be introduced into Australia by the haphazard method of permitting commercial stations to decide their own programmes without being subject to rigid supervision, I consider that the air will be polluted as it has already been polluted by the commercial broadcasting stations. When we consider the inferior quality of some of the commercial broadcasting programmes, it is obvious that we should not permit television to be operated by commercial interests without very strict and rigid supervision. From the point of view of defence, it is essential that the evidence that will be obtained and collated by the royal commission should be carefully considered. I am sure that honorable senators appreciate the dangers inherent in a television system in Australia not subject to rigid control.  I cannot understand why the Government has hastily introduced this legislation. Having gone to the trouble and expense of appointing a royal commission to inquire into television, at least the Government should have refrained from introducing legislation on the subject until the report of the royal commission had been received. Obviously, a time limit should have been imposed on the royal commission; it should not have given a blank cheque in that connexion. As matters stand, it could take many months for the royal commission to collect and collate evidence. Conceivably the royal commission may wish to take evidence in various parts of Australia, and also to travel overseas to obtain information. The Leader of the Opposition has moved the amendment in an attempt to obtain finality on this matter. It should be supported by honorable senators opposite, if they are sincere, but the results of recent State elections show that the Government is held in great disrespect. I consider that this bill is merely political window dressing. It has been introduced by the Government in an endeavour to convince the people of this country that it is doing something towards introducing television services. In point of fact, the measure is only makebelieve. I should like the Minister for Repatriation (Senator Cooper) to explain the necessity for this measure at the present time, and what the Government hopes to gain from it. As far as I can see, all that it will do is to give the Government additional regulation making power. It is somewhat ironical that, although the Government is unable to make available to the States sufficient money for urgently required hospital and education facilities, it is rushing through this legislation to provide for the introduction of television, which will be much more costly, than was the establishment of the radio industry. The Government should do first things first. The depths to which television programmes will descend if television is introduced into Australia without proper safeguards and rigid control, can well be imagined. Commercial interests would be able to manipulate the television programmes just as they have manipulated the radio programmes. It has been suggested that some of the existing commercial radio stations may be converted to television stations. In the absence of safeguards, television programmes could have a very detrimental effect on the children of this country. Senator Willesee has mentioned some of the effects of television on American children. As honorable senators know, television is operated by private companies in the United States of America. It is obvious, from the dearth of Government speakers on this measure, that the Government has no sound reason for introducing this bill. Some honorable senators opposite who are usually vociferous in proclaiming that the Government has a mandate for this or that have remained silent in this debate. That is because they realize that they cannot possibly justify the Governments action in rushing this bill through. The Governments only concern is that it has the requisite numbers. Consequently, its supporters, instead of stating the Governments reasons for introducing the bill, are prepared merely to sit pat and bludgeon it through when the vote is taken. Government supporters are under instruction not to participate in this debate. Fortunately, members of the Opposition are able to express their opinions freely. I urge the Minister, when he is replying to the debate, to state the Governments reasons for introducing this measure at this time and for refusing to accept the amendment that has been moved by the Leader of the Opposition. I should also like to know why the Government is not eager to expedite the commissions inquiry by obliging it to report by the date proposed in the amendment and, at the same time, postpone further consideration of this measure until the commission has presented its final report. The Government should give serious consideration to the Oppositions amendment which, I repeat, is reasonable.","N/A","TELEVISION BILL 1953","/hansard/chamber.xscript/debate[4]/speech[7]/talk.start/para","N/A","N/A"
"0","0","0","1","0","0","0","1","SHEEHAN, James","K5X","Victoria","N/A","N/A","916",". ^Television, possibly, is one of the most important subjects that this, or any other Parliament has had the responsibility of considering. This wonderful invention, which has been in the experimental stage for many years and is now approaching perfection, is of great public importance. Its impact upon the life of the community raises complex problems. However, this measure is possibly the mo.st ineffectual bill that has been introduced into the Parliament since I have been a member of the Senate. One would have thought that the Government would accept the amendment that has been moved by the Leader of the Opposition (Senator McKenna) and would be prepared to postpone further consideration of the bill until the royal commission had presented its final report. If the Government objected to the date by which it is proposed in the amendment that the commission should present its report, it could fix a different date, but no Government supporter has advanced any argument on that aspect of the amendment. Senator Seward made one of the most useful contributions to this debate. He expressed much common sense, and showed that he had thoroughly studied the implications of television and its possible effects upon the community. The Minister, in his secondread ing speech, said that the Government had appointed a royal commission te examine important aspects of television. Tt is true that he said that the bill relates solely to the fundamental system of television which the Government proposes should be introduced into Australia. He went on to say ","N/A","TELEVISION BILL 1953","/hansard/chamber.xscript/debate[4]/speech[8]/talk.start/para","N/A","N/A"
"0","0","0","0","0","1","0","1","SHEEHAN, James","K5X","N/A","N/A","N/A","N/A","The detailed conditions in accordance with which the services will be conducted will be determined after consideration has been given to the recommendations of the royal commission which was appointed by the Government.  When the royal commission has submitted its final report, it is the intention of the Government to bring down a comprehensive measure sp as to give the Parliament an opportunity to debate fully its detailed plans for the establishment and regulation of the television services of the Commonwealth.","N/A","TELEVISION BILL 1953","/hansard/chamber.xscript/debate[4]/speech[8]/quote/para[1]","N/A","N/A"
"0","0","0","1","0","0","0","1","SHEEHAN, James","K5X","N/A","N/A","N/A","N/A","Does not that statement indicate that, at the moment, the Government does not know its own mind on this matter and that it has no idea of the actual conditions under which television will operate in this country? The Government has simply introduced the bill and said that it lay3 down the fundamental principles upon which television will be conducted in Australia. As no reason has been given to the Senate for the Governments attitude, its supporters cannot blame me when I draw the conclusion, which, no doubt, they will loudly deny, that certain vested interests are eagerly awaiting some indication fr.om the Government that when television is in operation in this country they will be permitted to engage it in .order to earn profits for themselves. ","N/A","TELEVISION BILL 1953","/hansard/chamber.xscript/debate[4]/speech[8]/para[1]","N/A","N/A"
"0","0","1","0","0","0","0","1","MCCALLUM, John","KT8","N/A","N/A","N/A","916","From what facts does the honorable senator draw that conclusion ? ","N/A","TELEVISION BILL 1953","/hansard/chamber.xscript/debate[4]/speech[8]/interjection[1]/talk.start/para","N/A","N/A"
