"question_flag","answer_flag","interjection_flag","speech_flag","petition_flag","quote_flag","motionnospeech_flag","chamber_flag","name","name.id","electorate","party","role","page.no","content","subdebateinfo","debateinfo","path","Speaker","Time"
"0","0","0","0","0","0","0","1","N/A","N/A","N/A","N/A","N/A","N/A","The PRESIDENT (Senator the Hon. Sir Alister McMuliin) took the chair at 3 p.m., and read prayers.","N/A","N/A","/hansard/chamber.xscript/business.start/para","N/A","N/A"
"0","0","0","0","0","0","0","1","N/A","N/A","N/A","N/A","N/A","N/A","AddressinReply Presentation to the GovernorGeneral .","N/A","GOVERNORGENERALS SPEECH","/hansard/chamber.xscript/debate[1]/para","N/A","N/A"
"0","0","0","0","0","0","0","1","PRESIDENT, The","10000","N/A","N/A","N/A","211","I desire to inform the Senate that on Friday last, accompanied by honorable senators, I waited on the GovernorGeneral and presented to him the AddressinReply to His Excellencys Speech on the occasion of the opening of the Third Session of the Twentysecond Parliament, agreed to on 13th March. His Excellency was pleased to make the following reply:","N/A","GOVERNORGENERALS SPEECH","/hansard/chamber.xscript/debate[1]/continue/talk.start/para","N/A","N/A"
"0","0","0","0","0","1","0","1","N/A","N/A","N/A","N/A","N/A","N/A","Mr. President,  Thank you for your AddressinReply which you have just presented to me. It will afford me much pleasure to convey to Her Most Gracious Majesty the Queen the message of loyalty from the Senate of the Commonwealth of Australia, to which the Address gives expression.","N/A","GOVERNORGENERALS SPEECH","/hansard/chamber.xscript/debate[1]/continue/quote/para[1]","N/A","N/A"
"1","0","0","0","0","0","0","1","BROWN, Gordon","K6P","N/A","N/A","N/A","211","I desire to ask the Minister for National Development two questions without notice. Regarding the release of £500,000 by the Commonwealth Trading Bank for home building and home purchase, has the Minister noted the statement by the president of cooperative building societies, Mr. Tytherleigh, that building societies operate only in two States, New South Wales and Victoria, so that the new loan will go to housing in those two States? Does this mean that Queensland, for instance, will receive no benefit from the new loan of £500,000? ","HOUSING FINANCE","QUESTIONS","/hansard/chamber.xscript/debate[2]/subdebate.1[1]/question/talk.start/para","N/A","N/A"
"0","1","0","0","0","0","0","1","SPOONER, William","K7A","N/A","LP","N/A","211","I am sorry to say I cannot answer the question adequately. I did read the statement by Mr. Tytherleigh with a good deal of interest, but I have to confess that I did not pick up the point that the honorable senator makes. I correct him, though, to this extent: Mr. Tytherleigh says that the building societies operate in only two States. That is rather a general statement. As Senator Brown himself doubtless knows, there has been quite an upsurge of building societies in Brisbane in Queensland itself and the same thing applies in other States. So I think Mr. Tytherleigh is talking in terms of terminating building societies, in which he is quite an expert, rather than of building societies generally. There would be an opportunity for the Commonwealth Trading Bank, if it so desired, to make this money available to building societies not only in New South Wales and Victoria, but also in most of the other States. Whether the Commonwealth Trading Bank proposes to do that or not, I could not say. I know that the Commonwealth Bank has made advances in the past to building societies operating in Brisbane. What the Commonwealth Trading Bank proposes to do 1 do not know. ","HOUSING FINANCE","QUESTIONS","/hansard/chamber.xscript/debate[2]/subdebate.1[1]/answer/talk.start/para","N/A","N/A"
"1","0","0","0","0","0","0","1","VINCENT, Victor","KAC","N/A","N/A","N/A","211","I desire to submit to the Minister for Customs and Excise a question relating to the matter of the censorship of Australian books and publications. First, has the Minister seen a statement in todays Melbourne  Age  which refers to a criticism of the Literature Censorship Board by Mr. Frederick Warburg, a London publisher? Secondly, is it correct to say, as was stated by Mr. Warburg, that 1,000 books have been banned by the board? Thirdly, is it true that there is a Government move to stop the public from knowing that a particular book is to be banned? And fourthly, is the Minister prepared to publish a list of banned books from time to time? ","CENSORSHIP","QUESTIONS","/hansard/chamber.xscript/debate[2]/subdebate.1[2]/question/talk.start/para","N/A","N/A"
"0","1","0","0","0","0","0","1","HENTY, Norman","KOW","N/A","LP","N/A","211","I have not digested the statement by Mr. Warburg, but the honorable senator was good enough to jot down two or three points from it and I shall attempt to say something about them. I do not know how many books are at present banned, but the list has been overhauled in the last few months by the Literature Censorship Board. The new list will be available in about a weeks time. It will be published in the Commonwealth  Gazette  as a customs document, so that every one will know which books are banned. The honorable senator asks whether a list of the banned books will be published from time to time. In future the title of any such book will be published in the Commonwealth  Gazette  for the information of all. I have prepared a very short statement on the subject so that the Senate might be kept fully informed. With the consent of the Senate I shall read it now. It reads ","CENSORSHIP","QUESTIONS","/hansard/chamber.xscript/debate[2]/subdebate.1[2]/answer/talk.start/para","N/A","N/A"
"0","0","0","0","0","1","0","1","HENTY, Norman","KOW","N/A","N/A","N/A","N/A","CENSORSHIP OF LITERATURE  The altered procedures announced some months ago were undertaken only after long and careful analysis and wide consultation throughout the Commonwealth, and provide the necessary safeguards for the censorship of imported literature. They are as follows: The departmental Inspectors of Publications at the point of import check the literature and detain any book they wish to have further examined. The book is forwarded to central office with the comments of the detaining officer. Here, after examination, it can be released or submitted to the Literature Censorship Board. This board can recommend release or banning. If, following the boards advice the book is banned, then the importer has the right to ask the Minister or the ComptrollerGeneral to submit this decision to the Literature Appeal Censor. Upon receipt of advice from this source the final decision rests with the Minister. Notification of a decision to ban will be made in the Commonwealth  Gazette . The practice of departmental officers of advising booksellers that a book at present on sale is under review, and of requesting its withdrawal from sale pending a decision, has been discontinued. It has led to wide misunderstanding by both the public and the press. In fact, this procedure has been used to gain wide publicity for, and enhance the sales of, the book. The corner stone of this reorganization is a free and independent Literature Censorship Board and Appeal Censor, consisting of men and women with a broad literary background, a sound social outlook and a wide experience. FILM CENSORSHIP I am examining the present Film Censorship Regulations to ascertain whether changes are necessary to bring them into line with modern conditions. To clarify regulation 13 (d) of the Cinematograph Regulations, i.e., the regulation referring to films which depict any matter, the exhibition of which is undesirable in the public interest, the following interpretation has been adopted. Regulation 13 (d) should not be used to debar the registration of religious films for the reason only that the nature of the films or critical commentary may be deemed to give offence to any one religious section of the community. TELEVISION Censorship of television films is undertaken by my department under the standards for television adopted by the Australian Broadcasting Control Board in conjunction with the Australian Broadcasting Commission.","CENSORSHIP","QUESTIONS","/hansard/chamber.xscript/debate[2]/subdebate.1[2]/answer/quote/para[1]","N/A","N/A"
"1","0","0","0","0","0","0","1","SANDFORD, Charles Walter","K4S","N/A","N/A","N/A","212","Some time ago I asked the Leader of the Government in the Senate a question on the proposed employment of Australian boys in the production of a horror film. Although the Government has no direct power in this matter, I was very concerned that it did not express or make known its disapproval of that proposal. I now ask the Minister in charge of the Senate whether he has seen reports of midnight horror films being shown in capital cities. Although the Commonwealth may not have any direct power in this matter, is the Government opposed to these antisocial activities? If so, will the Government make its opposition known, especially in view of the alarming increase in juvenile hooliganism? ","HORROR FILMS","QUESTIONS","/hansard/chamber.xscript/debate[2]/subdebate.1[3]/question/talk.start/para","N/A","N/A"
"0","1","0","0","0","0","0","1","SPOONER, William","K7A","N/A","LP","N/A","212","I have seen newspaper reports of these midnight horror films. It is extremely improbable that the Commonwealth Government will express any view on this matter, because it is one which, I understand, comes entirely within the jurisdiction of the State governments. If the Commonwealth Government expressed a view on such a matter, it could be criticized for extending its activities into a matter with which it had no concern. ","HORROR FILMS","QUESTIONS","/hansard/chamber.xscript/debate[2]/subdebate.1[3]/answer/talk.start/para","N/A","N/A"
"1","0","0","0","0","0","0","1","ROBERTSON, Agnes","K2S","N/A","N/A","N/A","212","My question is directed to the Minister representing the PostmasterGeneral. Is the PostmasterGeneral aware that recently an advertisement appeared in the press calling for applications to the Australian Broadcasting Commission for the position of organizer of womens sessions at Sydney headquarters, stating that the duties include general supervision of programmes for womens sessions conducted in other States? Will the PostmasterGeneral give an assurance that this stipulation will not mean dictatorship, and does not imply a radical change in the highly educational and intereststimulating programmes in Western Australia, which provide a lively and vigorous local touch with a widely spread listening audience of women in outback centres of the area? Will the PostmasterGeneral note that the twoway traffic between the sessions and the listeners the most fruitful form of broadcasting that now prevails in Western Australia would be quite impossible with broadcasts between Western Australia and Sydney, because conditions in those two places differ so completely? ","BROADCASTING","QUESTIONS","/hansard/chamber.xscript/debate[2]/subdebate.1[4]/question/talk.start/para","N/A","N/A"
"0","1","0","0","0","0","0","1","COOPER, Walter","JQP","N/A","CP","N/A","213","I have seen the advertisement calling for applications for appointment to this position with the Australian Broadcasting Commission in Sydney. I do not think there need be any fear of interference with present activities in Western Australia. However, I shall bring the honorable senators question to the notice of my colleague, the PostmasterGeneral, and ask him to give me a detailed reply. ","BROADCASTING","QUESTIONS","/hansard/chamber.xscript/debate[2]/subdebate.1[4]/answer/talk.start/para","N/A","N/A"
"1","0","0","0","0","0","0","1","KENNELLY, Patrick","KPK","N/A","N/A","N/A","213","Has the Minister representing the Minister for the Interior seen the answer to a question asked in another place, the answer being to the effect that a private bathroom has been installed in the Hotel Kurrajong for use by the Minister for Trade, at a cost of £355, for which an additional 3s. a day will be charged? Will the Minister ask his colleague to take action to see that at least a wash basin is provided in each of the small balcony rooms used by private secretaries, who pay the same tariff as persons who are given much larger rooms in which wash basins are installed? I can assure the Minister that many private secretaries would be only too pleased to pay an extra charge of 3s. a day for the exclusive use of a bathroom. ","HOTEL KURRAJONG","QUESTIONS","/hansard/chamber.xscript/debate[2]/subdebate.1[5]/question/talk.start/para","N/A","N/A"
"0","1","0","0","0","0","0","1","HENTY, Norman","KOW","N/A","LP","N/A","213","In answer to the honorable senators question, I should say that it is just as important for a secretary to wash as it is for anybody else. I shall have great pleasure in placing the honorable senators question before the Minister and obtaining a considered reply for him. ","HOTEL KURRAJONG","QUESTIONS","/hansard/chamber.xscript/debate[2]/subdebate.1[5]/answer/talk.start/para","N/A","N/A"
"1","0","0","0","0","0","0","1","MARRIOTT, John","KSN","N/A","LP","N/A","213","I ask the Minister for National Development, in the absence of the Leader of the Government in the Senate, whether any plans have been made which will permit nextofkin and representatives of returned servicemens associations to attend the unveiling ceremony by Her Majesty the Queen of the Brookwood Memorial to the Commonwealth Land Forces in Brookwood Military Cemetery near Woking, Surrey, England, on 25th October this year. If no plans have already been made, and in view of the fact that an invitation to attend the ceremony has been sent to the nextofkin of each man commemorated, will the Government give consideration to ensuring adequate Australian representation at the ceremony? ","BROOKWOOD MEMORIAL, ENGLAND","QUESTIONS","/hansard/chamber.xscript/debate[2]/subdebate.1[6]/question/talk.start/para","N/A","N/A"
"0","1","0","0","0","0","0","1","SPOONER, William","K7A","N/A","LP","N/A","213","I feel certain that over the years the Government has evolved some set of precedents or arrangements to cover invitations to such important ceremonies as this one. I am sorry to inform the honorable senator that I cannot say what those arrangements are, but I shall ask the Prime Ministers Department to let me know, and I shall convey the information to him. Then, if need be, we can discuss it further. ","BROOKWOOD MEMORIAL, ENGLAND","QUESTIONS","/hansard/chamber.xscript/debate[2]/subdebate.1[6]/answer/talk.start/para","N/A","N/A"
"1","0","0","0","0","0","0","1","ARNOLD, James","K0N","N/A","N/A","N/A","213","In view of the im portance of the city of Newcastle, which has no civil aerodrome, and in view of the fact that civilian aircraft are allowed to use the Royal Australian Air Force base for only a brief time before 9 a.m. and again after 6 p.m., will the Minister representing the Minister for Air see whether it is possible for the R.A.A.F. so to arrange its training programme as to make the aerodrome available in the middle of the day for civil aircraft to serve the city of Newcastle? ","NEWCASTLE AERODROME","QUESTIONS","/hansard/chamber.xscript/debate[2]/subdebate.1[7]/question/talk.start/para","N/A","N/A"
"0","1","0","0","0","0","0","1","PALTRIDGE, Shane","JZY","N/A","LP","N/A","213","I shall refer the honorable senators question to my colleague, the Minister for Air, and obtain an answer for him. ","NEWCASTLE AERODROME","QUESTIONS","/hansard/chamber.xscript/debate[2]/subdebate.1[7]/answer/talk.start/para","N/A","N/A"
"1","0","0","0","0","0","0","1","HANNAN, George","KNU","N/A","N/A","N/A","213","The Minister for National Development may recall that during last session I directed inquiries to him aimed at securing assistance for the Australian coppermining industry, and that he answered by referring to the Tariff Board inquiry into that industry, which had just been completed. Can the Minister now advise me whether the Tariff Boards report on the Australian coppermining industry is yet available? If it is not available, are there any particular difficulties of a technical or administrative nature holding it up, or is the delay an indication that the Tariff Board is considerably in arrears in the discharge of its important functions? ","COPPERMINING","QUESTIONS","/hansard/chamber.xscript/debate[2]/subdebate.1[8]/question/talk.start/para","N/A","N/A"
"0","1","0","0","0","0","0","1","SPOONER, William","K7A","N/A","LP","N/A","213","There has been, and still is, very great interest in the Tariff Boards report on the coppermining industry. I can only repeat what I am sure I said previously. The Tariff Board has completed its investigation. The report has gone to the Minister for Trade, and he is examining it, with some professional assistants. The Tariff Boards work is increasing in volume. Its staff is being strengthened. The secretariat that assists the board has been strengthened, and my colleague hopes this will result in a more efficient Tariff Board and more prompt reports based on its inquiries. ","COPPERMINING","QUESTIONS","/hansard/chamber.xscript/debate[2]/subdebate.1[8]/answer/talk.start/para","N/A","N/A"
"1","0","0","0","0","0","0","1","SPOONER, William","K7A","N/A","LP","N/A","214","I should like to refer to an answer I gave to a question without notice, on 13th March last, relating to the Tariff Board. I have had my attention directed to the fact that my answer, as reported in  Hansard , is not in accordance with facts. I am sure  Hansard  was right, as usual. I can only assume that in the stress of answering questions without notice I gave some information incorrectly.  I should like, therefore, to clarify the position and see that the record is corrected by saying that when I was replying to a question by Senator Wright, on 13th March last, and at the same time answering questions from other honorable senators who interjected, the words I uttered would make it appear that I was saying that Mr. Date had sought to make observations concerning his own private affairs on Tariff Board reports. This, of course, is not right. I think it is clearly understood that Mr. Date has, over a period, attached or sought to attach to Tariff Board reports, in association with his signature, his comments upon Tariff Board procedures, these comments having no relevancy whatever to the subjectmatter under examination by the board. Further, and over the same period, as the Minister for Trade has stated, Mr. Date has conducted an extensive campaign of protests addressed to numerous official people concerning a whole variety of matters on which he had legal and personal views, and his grievances have included questions of travelling allowance and such personal considerations.  Hansard  seems to read that I said that Mr. Date had endeavoured to incorporate these personal matters into Tariff Board reports. The things that he wanted to incorporate into the Tariff Board reports were strictures or comments on Tariff Board procedures.","TARIFF BOARD REPORTS","QUESTIONS","/hansard/chamber.xscript/debate[2]/subdebate.1[9]/question/talk.start/para","N/A","N/A"
"1","0","0","0","0","0","0","1","MCMANUS, Francis","KUD","N/A","N/A","N/A","214","My question is addressed to the Minister representing the Minister for Labour and National Service. In view of the assurance from the Minister that a close watch was being kept on the question of indemnity payments by shipowners, I now ask: Have the services of a tug been refused for the steamer  Iron Master , now located at Newcastle? If so, is the reason for the refusal the failure of the Hong Kong interests concerned in the sale of the ship to comply with the demand from maritime unions for an indemnity payment of £4,125? If this is so, does the failure of the seamens union to permit the use of a tug for  Iron Master  in these circumstances constitute industrial blackmail, and does the Government contemplate any action in the matter? ","SHIPOWNERS AND MARITIME UNIONS","QUESTIONS","/hansard/chamber.xscript/debate[2]/subdebate.1[10]/question/talk.start/para","N/A","N/A"
"0","1","0","0","0","0","0","1","SPOONER, William","K7A","N/A","LP","N/A","214","I have read with great interest the newspaper report to which the honorable senator refers, but I am sorry to say that I have not discussed the matter with my colleague, the Minister for Labour and National Service. I feel that I should do so, rather than make ,a reply now which the facts may not justify, or which may not be in accord with Government policy. Therefore, I must ask that the question be placed on the noticepaper. ","SHIPOWNERS AND MARITIME UNIONS","QUESTIONS","/hansard/chamber.xscript/debate[2]/subdebate.1[10]/answer/talk.start/para","N/A","N/A"
"1","0","0","0","0","0","0","1","SCOTT, Malcolm","K5K","N/A","N/A","N/A","214","I address a question to the Minister for Shipping and Transport. I understand that sheep affected by the disease known as foot rot have been transported recently from eastern Australia to Esperance, Western Australia. In view of the fact that Esperance has been completely free of this contagious disease, and because the officers of the Western Australian Department of Agriculture are doing all they can to wipe out the disease in that State, will the Minister inform me whether the Commonwealth proposes to take action to prohibit affected sheep from being sent to Western Australia? ","FOOT ROT","QUESTIONS","/hansard/chamber.xscript/debate[2]/subdebate.1[11]/question/talk.start/para","N/A","N/A"
"0","1","0","0","0","0","0","1","PALTRIDGE, Shane","JZY","N/A","LP","N/A","214","I very much doubt whether a prohibition on the transport of sheep affected with foot rot is a matter which would fall within my administration. However, I shall have a look at the matter, as it affects transport. I shall inquire into the circumstances and see what can be done. ","FOOT ROT","QUESTIONS","/hansard/chamber.xscript/debate[2]/subdebate.1[11]/answer/talk.start/para","N/A","N/A"
"1","0","0","0","0","0","0","1","TANGNEY, Dorothy","K7Y","N/A","N/A","N/A","215","I ask the Minister representing the Minister for Immigration: Is it a fact that there is in the Immigration Act an archaic, Hitlerian proviso which prohibits the entry into Australia, for permanent residence, of unmarried women who have reached the age of 40 years and have no close relatives in Australia? Is the reason given for such exclusion that these women are unlikely to marry and bear children and, therefore, are likely to become a charge on the community in their later years? In view of the fact that professional women, such as nurses, doctors, teachers and so on, would be of value to the Australian community, will the Minister indicate whether these women are prevented from taking up permanent residence here merely on the score of age? Does the Minister subscribe to the theory that a woman has outlived her usefulness to the community after she has reached the age of 40 years, if she is still unmarried? If the Minister believes that a womans natural function is that of motherhood, are the officers of his department competent to decide the exact age at which a woman ceases to be capable of fulfilling this function, bearing in mind Genesis, chapter 17, verses 17 to 19, wherein it is stated that Sarah was 90 years of age when Isaac was born? ","FEMALE IMMIGRANTS","QUESTIONS","/hansard/chamber.xscript/debate[2]/subdebate.1[12]/question/talk.start/para","N/A","N/A"
"0","1","0","0","0","0","0","1","HENTY, Norman","KOW","N/A","LP","N/A","215","As the matter comes under the jurisdiction of my colleague, the Minister for Immigration, I am not prepared to commit myself to a debate with the honorable senator on the question of age. If she places her long series of questions on the noticepaper, without doubt I shall get an answer for her. The honorable senator is not raising anything new. Apparently, there has been no alteration of the Immigration Act for a number of years. If the provision to which Senator Tangney refers is in the act, it has been there for quite a number of years and the Government of which she was a supporter could have altered it if it had so desired. I repeat that I shall obtain a reply for the honorable senator. ","FEMALE IMMIGRANTS","QUESTIONS","/hansard/chamber.xscript/debate[2]/subdebate.1[12]/answer/talk.start/para","N/A","N/A"
"1","0","0","0","0","0","0","1","MAHER, Edmund","KSL","N/A","N/A","N/A","215","Has the attention of the Minister representing the Minister for Trade been drawn to a statement made in Brisbane by Mr. D.J. Muir, the Queensland AgentGeneral in London, that the reputation of Australian canned meat on the English market is being ruined by inferior quality canned meat that is put up by meat packers in a State other than Queensland? Is the Minister aware that Mr. Muir said that the Queensland pack had a meat content of 85 per cent., that the pack produced by the southern firm had a meat content of only 65 per cent., that the British housewife judged Australian canned meat by the lowest quality article, and that our canned meat trade suffered accordingly? Is it not possible to standardize our canned meat export trade on a uniform pack and quality basis? ","CANNED MEAT","QUESTIONS","/hansard/chamber.xscript/debate[2]/subdebate.1[13]/question/talk.start/para","N/A","N/A"
