"question_flag","answer_flag","interjection_flag","speech_flag","petition_flag","quote_flag","motionnospeech_flag","chamber_flag","name","name.id","electorate","party","role","page.no","content","subdebateinfo","debateinfo","path","Speaker","Time"
"0","0","0","1","0","0","0","1","HANNAN, George","KNU","N/A","N/A","N/A","233","Very well, Sir. 1 think that the remarks could be linked up in this way: The peaceful development of atomic energy, with which, of course, we are primarily interested and concerned, is impossible unless we are free from fear but, having denuded ourselves of the great deterrent of nuclear weapons, we may be placed in a position where, because we are defenceless, we are no longer able to carry out peaceful work on atomic energy which holds so much good for the future of mankind.  If I am permitted to say so, we can draw an analogy from the position of Byzantium many centuries ago. From about the sixth century to the twelfth century, the Roman empire in the east was tossed on a sea of barbarism. It was hopelessly outnumbered, it could not hire sufficient mercenaries, and it would have been completely at the mercy of the Turks had it not been for the existence of the equivalent of atomic weapons in the form of a highly inflammable substance that was known as Greek fire. It is particularly important to remember, when we are considering the peaceful uses of atomic energy, that for 600 or 700 years Byzantium, without arms and proper protection, was able to develop the peaceful arts because it had this wonderful, unanswerable defensive weapon called Greek fire. On one occasion in the ninth century when the enemies of the Roman empire had forced the Bosphorus and all seemed lost, the engineers were able to fling themselves upon their pyrophorous syphons and eliminate 10,000 craft in an instant under a torrent of Greek fire. With the passage of time, nothing has been changed in principle. We hope and pray that the fearsome giant of atomic energy will never be let loose in violence again and will never be used to kill human beings; but, at the same time, we must be protected. I am particularly glad, therefore, that the Government is expanding and strengthening the important body which will have the control of atomic energy in this country. The legislation that is now before this chamber, which I support, will undoubtedly be fraught with great benefit for this community.","N/A","ATOMIC ENERGY BILL 1958","/hansard/chamber.xscript/debate[4]/speech[4]/continue[4]/talk.start/para","N/A","N/A"
"0","0","0","1","0","0","0","1","OFLAHERTY, Sidney","JYY","South Australia","N/A","N/A","234",". Although the Opposition is not opposing the bill, there are some points that honorable senators wish to discuss and which they are tempted to discuss perhaps a little more fully than if the measure were being opposed. I shall make one or two comments about the statements of Senator Laught. I have no objection to the honorable senators eulogizing the South Australian Government and the work it has done, but there is more to be considered than just the work that has been done by that government in the production of uranium oxide. I remind the honorable senator that the Department of National Development knew of deposits of uranium in quite a number of places in South Australia long before work was commenced on them by any South Australian authority. I have a distinct recollection of the discovery about 50 years ago of uranium ores and doing the best we could to separate the uranium salts or uranium oxide from the ores. Although we tried every process that was known to ordinary prospectors, we had to cease our efforts. I think the records of the South Australian Department of Mines will disclose analyses of particular ores and reports saying what those ores contained.  If one goes to Mount Painter one finds torbernites, and at Uranium Hill uraninites. To separate these ores is very difficult for the ordinary man and indeed for the big mining concerns, as I shall indicate presently. In those days the Department of Mines separated and analysed these ores and forwarded us a little chit saying that they contained certain percentages of uranium. But there  was no statement showing what we could do with it or what it could be used for. So we had to ask the department what uranium was used for. We were told, at that time, that there was not much, use for it. Although we could have sent it to Belgium or Germany, the market value was so low that it was not worth sending it overseas. That position obtained right up to the time when the Director of Mines in South Australia, Mr. Dickinson, started to prospect with the aid, of course, of money that was supplied by the South Australian Government, some of which had come from the Commonwealth Treasury. The result is that mines are actually working. Otherdeposits have been examined, but they would, not be paying propositions if developed by mining companies. In addition to the places I have mentioned, some work is being done at Crockers Well. Crockers Well is supposed to have been discovered only quite recently, and I saw a statement which indicated that it was located as a result of an aerial survey. But that is not correct. Crockers Well was known to contain some kind of foreign, ore it was not known to be uranium about twenty years ago. This area was discovered by a woman who used to potter around a station property. Eventually she obtained a geiger counter and discovered that the ore in which she was interested contained elements that registered on the counter. The South Australian Government examined the ore and discovered that it contained uranium. I think there is also a very small amount of ore there which contains thorium. There might even be some tin associated with it, too. But uranium was discovered in that area before an aerial survey was made. My reason for referring to this is that quite a number of people think that these minerals can be found by aerial surveys. But all that can be done is to get some idea of where the minerals might be. It is then necessary to go to the area and search for them. Sitting suspended from 5.45 to 8 p.m. I should like to mention one or two aspects of this bill. Up to the present time Australia has been exporting uranium ores that were processed and reduced in volume to concentrate form. We are now exporting uranium salts and condensations of uranium oxide. We know that it is too dangerous to export pure uranium to other parts of the world, and for that reason the concentrates uranium salts and uranium oxide of certain percentage of purity are sent to overseas plants where the process of separating the pure uranium from the concentrates is completed. The huge combines in the metal, mineral and chemical industries have complete control of all the secrets attached to the use of uranium. I have, on previous occasions, complained in this chamber about the secrecy surrounding the machinery and plant used in the treatment of uranium ores, yet we find, even on the Australian Atomic Energy Commission Advisory Board, representatives of some of the great metal and mineral cartels. With the exception of Great Britain, the major powers of the world have concentrated upon uranium ores and pure uranium because of their fusion value in the manufacture of atomic bombs. Great Britain, however, is establishing a plant that will produce power from uranium. The United States of America is still experimenting on those lines with a view to competing with Great Britain. Huge concerns such as Imperial Chemical Industries of Australia and New Zealand and the onetime great Farben organization of Germany are in possession of all the secrets in connexion with the processing necessary to produce uranium in its pure form. Those secrets are not available to anybody else. In Australia the Federal Government says,  Hush, hush; you must not have access to those secrets . I think that approach is entirely wrong. The matter ought to be open and above board because if those secrets were available to other persons those particular elements might possibly be used for peaceful purposes instead of being reserved completely for the manufacture of atomic bombs. If honorable senators were to visit Rum Jungle and South Australia they would find a security screen round the buildings through which they could not enter to view the processes being carried on. I think that also is entirely wrong. The secrets ought to be made available to those people who have the possibility of utilizing the power generated from the fusion material for the purpose of producing electricity and so on, and increasing the production of Australia. The fifth anual report of the Australian Atomic Energy Commission contains a list of names of the people acting in an advisory capacity to the commission. In that list are men ot considerable standing in the business world. I am not questioning their ability or the advice they would give, but they are connected with huge undertakings with worldwide ramifications, and those undertakings receive the benefit of Australias knowledge of processing of these ores while, on the other hand, that knowledge is withheld from the ordinary man in Australia who may be interested in the process. All of the ores in Australia are refractory ores, that is, they contain some other mineral, such as copper or gold. The treatment of a refractory ore is extraordinarily costly. I have some knowledge of the processes involved in the separation, for normal mining purposes, of ordinary and some refractory ores. Although we have the magnetic grids and the electrolytic and flotation processes, a still further process is involved in refining the uranium ore to obtain pure uranium. I am not suggesting that the people with overseas connexions are making use of their knowledge at the moment, but the possibility is that in the future they will choke out Australian manufacturers because of the secrets they learned in the experimental stages of the processing, even at Rum Jungle and in South Australia. That brings me to a consideration of the experiments that have been conducted in the treatment of various ores. I notice from the commissions report that more of the element itself is now being extracted from the ore than was obtained a couple of years ago. Of course, experiments are still being conducted in relation to extraction processes. As anybody with any knowledge of these processes knows, in the course of crushing the ore goes through a slurry. Uranium is one of the elements that tend to escape with the slurry* and experiments have been directed towards preventing loss of the element in this way when the slurry goes through the crushing plants and the magnetic grids, or during the electrolytic process and the flotation and zinc magnetic processes of separation. My complaint is that the Government has not gone fully into this matter and that it is not expending sufficient money on these experiments. At the risk of being thought parochial, I should like to mention that a branch of the South Australian Mines Department is continually conducting experiments in the separation of refractory ores, particularly uranium and thorium. Of course, the processes are different. There should be bigger plants than pilot plants in association with Rum Jungle and other places in Australia where there are huge deposits of certain classes of uranium ore. At some places there are deposits of pitchblende which probably contain purer forms of uranium than do other depots. But even pitchblende is a refractory ore, and separation is involved in order to extract the uranium. The Government should accelerate the experiments that are being conducted by the commission with a view to obviating the present wastage during extraction. I give credit to the Atomic Energy Commission for what it has done and what it is doing, and I give credit also to the Zinc Corporation for the work that it is doing at Rum Jungle. I recollect the Minister saying that it was proposed to farm out the treatment of the ore and that negotiations were taking place with some American firms. At the time, I directed attention to the fact that there were people in the mining sphere in Australia who were quite capable of treating any ore at Rum Jungle and of conducting any experiments necessary. I also mentioned that the experiments that had been conducted by Associated Smelters, Electrolytic Zinc and the Broken Hill Proprietary Company Limited had evolved methods which were being used in other countries to deal with various metals. The Zinc Corporation has done a very good job in this connexion but, as I have said, further experiments are needed in order to evolve a means of preventing wastage during extraction. The treatment process is not yet perfect. I think that the results of experiments in this field should be made available to all and sundry, in order to pave the way for anybody in Australia to use atomic energy for peaceful purposes, instead of practically 90 per cent, of the activity being concentrated on the production of atomic weapons. I think that the emphasis should be placed on the use of atomic energy for peaceful purposes. That brings me to my final point, which concerns the establishment of an atomic power house, similar to those in Great Britain. From what I have read on this subject, I understand that a huge volume of water is needed in the production of power from uranium, particularly during the fusion process. I understand that the huge volume of water is needed for cooling and circulation purposes. Furthermore, the quality of the water must be such that iswill not cause corrosion and so block thepipes. This afternoon, Senator Laught suggested that an atomic power plant should be established, I think, in the Northern Territory. When I visited the part of the Territory to which he referred I noticed that only a trickle of water was coming out of a pipe. I understand that after the rainy season, water that accumulates in certain areas in the Territory becomes highly mineralized. Therefore, I do not think that an atomicpower plant should be established there at the present time. I believe that the proper place to establish such a plant is where the Premier of South Australia has suggested it should be built, that is, between Port Augusta and Port Pirie, where there is an abundance of water and everything else that is needed. Furthermore, there are hugemineral deposits within a radius of approximately 100 miles, and all the extra electricity needed in South Australia could be generated by that plant. I urge the Government to establish an atomic energy plant at this location in preference to the location suggested by Senator Laught. Of course, if he had suggested the establishment of the plant at Rum Jungle, that would be another matter because a huge volume of water flows down the Finnis River. Although it may be practicable to establish a small power plant there, I point out that population is needed to establish and operate factories. Therefore, the lower end of South Australia commends itself for this purpose. In conclusion, I stress that it is time that we directed our attention to the production of uranium for peaceful purposes instead of weapons of destruction.","N/A","ATOMIC ENERGY BILL 1958","/hansard/chamber.xscript/debate[4]/speech[5]/talk.start/para","N/A","N/A"
"0","0","0","1","0","0","0","1","MCCALLUM, John","KT8","New South Wales","N/A","N/A","236",". I support the bill because it is intended to further the peaceful use of atomic energy. Since honorable senators on both sides of the chamber are convinced that this is a worthy purpose, I shall say nothing more about atomic energy. However, I do wish to discuss the details of the bill. I must congratulate the Minister for National Development (Senator Spooner) on the brevity of his secondreading speech. It certainly did not suffer from what some people regard as one of the chief weaknesses in both this chamber and the other place, namely, verbosity, but I wish it had been a little fuller. I noticed that his concluding paragraph contained these words  .. this is a simple and straightforward measure, and I hope can be dealt with as such. If that means that we are not to dissect the measure and ask questions about various clauses in it, I must say that I differ from the Minister, because I intend to do just that. I am amazed that no member of the Opposition has pointed out that the measure makes a fundamental change in the commissions setup. The former commission, which was set up by Act No. 31 of 1953, consisted of a chairman, a deputy chairman and a third member, all holding office on a parttime basis. The provision setting up the commission along those lines is repealed. Proposed new section 9(1.) reads","N/A","ATOMIC ENERGY BILL 1958","/hansard/chamber.xscript/debate[4]/speech[6]/talk.start/para","N/A","N/A"
"0","0","0","0","0","1","0","1","MCCALLUM, John","KT8","N/A","N/A","N/A","N/A","The Commission shall consist of a Chairman, a Deputy Chairman, an Executive Member and not more than two other members. 1 should have thought that the Minister, in introducing the bill, would have explained fully why this newcomer, the executive member, was included. All that we were told was that, in addition to the former membership there would be a fulltime member, who would act as the executive of the commission and would, within the policy laid down by the commission, generally administer its affairs. I want the Minister, either in his reply to this debate or in committee, to tell us why it has become necessary to appoint this executive member, and in what way the former commission has fallen short of requirements, or has been found by experience to be ineffective. It appears to me that the proposed executive member is to take over some at least of the duties that were formerly undertaken by the chairman. Proposed new section 9 (4.) reads  The Executive Member of the Commission shall, in accordance with the decisions and subject to the directions of the Commission, administer the affairs of the Commission.","N/A","ATOMIC ENERGY BILL 1958","/hansard/chamber.xscript/debate[4]/speech[6]/quote/para[1]","N/A","N/A"
"0","0","0","1","0","0","0","1","MCCALLUM, John","KT8","N/A","N/A","N/A","N/A","I do not see the necessity for that change. There may be good reasons for it, but we should have been told of them. I think, also, that the Opposition, not having been told, should have been the first to demand them. It has been left to what is called a  backbencher  although I happen to be sitting in a front bench to demand it.  There are many other clauses on which I should like more information, but I shall leave them until the committee stage arrives. One or two of them appear to be selfexplanatory. One refers to salaries and alters the maximum to which an officer can rise without the approval of the Minister. 1 presume that that is rendered necessary by the fact that all salaries in the Public Service have risen since the original bill was introduced. However, another clause repeals a series of existing provisions, which appear to deal with accountancy matters. I refer to the inquiry to be made by the AuditorGeneral into the work of the commission, and his responsibility to report thereon to the Parliament. From my reading of the original bill not being a chartered accountant or knowing very much about such things I should have thought that the relevant provisions were watertight, and did everything necessary to assure strict accountability. I should like the Minister to explain why those provisions are to be repealed, and certain others put in their place. Has that part of the bill been found ineffective, have accountancy methods changed in the interim, or is it intended to get away from some of the rigidities of the Public Service and allow the commission, being only a quasigovernmental body more freedom of action? I simply do not know why we were not told that by the Minister in his secondreading speech. I think that we should have been. I protest, as I have on previous occasions, against the assumption that when a certain kind of bill coming up from a department involves no questions of party policy and therefore the Opposition, presumably, can be expected not to be too vigilant concerning it we will sit here and pass it without inquiry. I think that if we do that we are failing in our duty and I ask the Minister to give such answers as he thinks fit, both during his reply, and subsequently during the committee stage to our inquiries. I hope that in committee he will be able to supply us with any advice that we need about machinery matters. I do not think that it is either beneath the dignity of the Senate, or beyond the scope of its work, to examine the machinery of the Public Service or of any quasigovernmental body. To the contrary, I think that we should be eternally vigilant. In the last year or two we have seen that these machinery bills and regulations warrant the closest scrutiny of all.. In the absence of party Opposition to them, the departments tend to assume that they will go through without criticism. I assure honorable senators that this bill will not.","N/A","ATOMIC ENERGY BILL 1958","/hansard/chamber.xscript/debate[4]/speech[6]/para[2]","N/A","N/A"
"0","0","0","1","0","0","0","1","OBYRNE, Justin","JYA","Tasmania","N/A","N/A","238",". The measure before the chamber is designed to amend the Atomic Energy Act of 1953. Senator McCallum referred to the brevity of the Ministers secondreading speech. My complaint relates not to the proposed amendments, but to certain matters important to the future development and exploitation of this tremendous source of power which have been left out. The Minister in charge of the bill in another place said that its purpose was to bring together under one piece of legislation all matters associated with the provision of atomic energy. He said that the bill provided great safeguards for secrets associated with Australias uranium fields and sources of supply, and the way in which the finished product was disposed of. However, the bill does nothing at all to give parliamentary authority for the most important issue facing the Australian people today the rapid development of this new source of power for peaceful purposes by the use of all the resources that we can place at the disposal of the scientists responsible for getting on with the job.  It has been truly said that we are on the threshold of a new era. Mankind has, in its short recorded history, passed through various stages in the struggle to overcome its environment, including the use of water power! and the most primitive use of metals. We have witnessed, in the present era, another great revolution brought about by mans mastery of steam and the development of industry generally. However, as a people, we have not grasped the importance of the era which we are how entering. The Minister spoke of the advances in atomic research and the construction, at Lucas Heights, in New South Wales, of a research reactor. He spoke also of the fact that Australia had become an important producer of uranium and said that plants in operation or under construction represented a capital outlay of £26,000,000. I have had the good fortune to see what is taking place at Rum Jungle. I pay a tribute to the people engaged in that work for the efficient way in which they are taking advantage of recent developments in the field of heavy earthmoving equipment. They are gouging into the bowels of the earth to extract this valuable ore. I pay a tribute to the engineers and scientists who have developed the technique for extracting uranium from the ore. Sometimes I wonder whether Australia has done its best to ensure the most advantageous future use of its uranium ore. The Australian Government made an agreement, with the United States Government under which the United States Government agreed to take considerable quantities of the uranium produced at Rum Jungle for the purpose of obtaining scientific data about its chemical content and so on, but that uranium appears to have been diverted into only one channel. What the Australian people are most interested in is the speedy development of means of using atomic energy for peaceful purposes. The Minister said","N/A","ATOMIC ENERGY BILL 1958","/hansard/chamber.xscript/debate[4]/speech[7]/talk.start/para","N/A","N/A"
"0","0","0","0","0","1","0","1","OBYRNE, Justin","JYA","N/A","N/A","N/A","N/A","In addition, the Australian Atomic Energy Commission is conducting research in and encouraging the industrial and other uses of radioisotopes. It has established arrangements under which research complementary to its own programme is being carried on in all the Australian universities. It has established training schemes at the undergraduate and postgraduate levels to ensure a supply of scientists for future needs in the atomic energy field. ","N/A","ATOMIC ENERGY BILL 1958","/hansard/chamber.xscript/debate[4]/speech[7]/quote[1]/para","N/A","N/A"
