"question_flag","answer_flag","interjection_flag","speech_flag","petition_flag","quote_flag","motionnospeech_flag","chamber_flag","name","name.id","electorate","party","role","page.no","content","subdebateinfo","debateinfo","path","Speaker","Time"
"0","0","0","0","0","1","0","1","ARMSTRONG, John Ignatius","K0C","N/A","N/A","N/A","N/A","The information and views there presented, and data that has since come to hand, has convinced the academy that Australia is suffering from a serious shortage of scientists and technologists.  The long term outlook is very grave: unless drastic measures are adopted the development of the country will be tragically hindered an ! lower living standards will prevail than would have accrued , if proper reliance had been placed on science and technology. The gathering shortage of trained personnel, if left uncorrected, will aggravate the position,","N/A","ATOMIC ENERGY BILL 1958","/hansard/chamber.xscript/debate[4]/speech[9]/quote/para[1]","N/A","N/A"
"0","0","0","1","0","0","0","1","ARMSTRONG, John Ignatius","K0C","N/A","N/A","N/A","N/A","Instead of a steadily increasing flow of  scientists, the country is actually experiencing a decreasing flow. In the years after the recent war, we were able to recruit many scientists from overseas, but now the process has gone into reverse. Better conditions and higher standards of work and salary elsewhere have caused a movement of scientists away from Australia. I believe that the findings of the Australian Academy of Science were put before the Cabinet, so it is not a matter of lack of knowledge of this fundamental problem. As is the case with many other matters in which the Government is concerned, everyone knows what is wrong, and everyone talks about it, but no one can be found who will do anything about it.  Turning now to the bill itself, I should like first to comment on the proposed reorganization of the Australian Atomic Energy Commission. Shortly after the present commission was appointed, Sir Jack Stevens was made fulltime chairman. He occupied that position for about two years, and then left to take an outside position with one of Australias big industries. The Government did not replace him with a fulltime chairman but, instead, allowed matters to drift along in the same old way that we know so well. Professor Baxter was brought up from deputy chairman to act as a parttime chairman. At last, the Government has felt obliged to appoint as a fulltime member not the chairman but a new executive officer df the commission. The Government apparently feels that top level ability is in such short supply that it must be spread very thinly. That is a serious mistake. Under the bill Professor Baxter will have the chief say as indeed he should in the commissions work. I suppose that it is a great understatement to say that he is an extremely busy man. Can he give to the commission the time, energy and thought that is needed if it is; to be properly developed and, at the same time, fulfil his other responsibilities including the very great one of controlling the New South Wales University of Technology, or the University of New South Wales, as it will shortly be known? So we find that these top men are spread so thinly I hope I make myself understood by using that expression that they are not able to give their best at any one point. Because of their great knowledge, it would be difficult to leave some of those men off these committees, but I feel that we are not getting full value from them because so many demands are made on .their services. The remarks I have been making refer to the top executive level, but when we come down to the, next level we find no shortage of manpower, particularly in the Business Advisory Group. There seems to be a great desire to get on to : that body. Whether the incentive to be on committees of this kind is the fact that they rarely, if ever, meet, I do not know. Perhaps the reason for wanting to be on them is that the names of the members are printed , on the most expensive paper and look beautiful when people read them. However, there are twenty members of the Business Advisory Group of the Australian Atomic Energy Commission. Can the Government tell me what are the duties of the members of the Business Advisory Group? Professor Baxter is the chairman of that group, just as he is the acting chairman of the Atomic Energy Commission, the Scientific Advisory Committee and the other bodies which deal with problems for which he must take some responsibility. The names of the members of the Business Advisory Group appear on page 5 of the report of the commission. I do not like to read out the names of prominent men over the air, but I do suggest to honorable senators that the list looks like, so to speak, a Melbourne Cup field. It is one of the largest fields that I have seen grouped together under one starter. The group comprises top representatives of Permewan Wright Limited, Imperial Chemical Industries of Australia and New Zealand Limited, the Commonwealth Bank of Australia, the English Electric Company Limited, the Colonial Sugar Refining Company Limited, the Electrolytic Zinc Company of Australasia Limited, Amalgamated Wireless (Australasia) Limited, Metal Manufactures Limited and the Bank of New South Wales. We have two banks represented. I see from the commissions report that this Business Advisory Group of twenty members met in March, 1957. It would be interesting if, when the Minister replies, he were to tell us how many times it has met since then, if at all. It would be interesting also to know how many of the men whose names appear on page 5 of the commissions report attended subsequent meetings, if such meetings have been held. I should like to know, too, what recommendations they have made to the commission. The group may have some value, but I cannot see what it is. I cannot see what a body of this size could do that a committee of two or three members could not do. I am certain that a committee of twenty members never could do the work that is required. I recall the late Mr. Chifleys statement that an ideal committee was a committee of two, and that if one of those two members were absent the committee was more effective. I do not know how many members would have to be absent from a meeting of the Business Advisory Group for it to be able to give efficient advice to the Australian Atomic Energy Commission. It is a fact that much of what we talk about in connexion with atomic energy has to do with the future. Older men like Ministers of the Crown and I are at a grave disadvantage. Because we were not born into this new scientific world, we have great difficulty in understanding the tremendous implications of hydrogen bombs, Sputniks and other scientific developments. I understand that one of the next steps will be to put a satellite into the orbit of the moon. We read about these things, but those of us who are honest will confess frankly that we have difficulty in understanding what is going on today. I do not remember much of what I learnt when I was at school, but one of the things I remember is that I was taught that the atom was the smallest particle of matter that it was irreducible. I was told that the atom was the basic constituent of all the substances that comprised the world. However, my belief that that was so was destroyed by the splitting of the atom. Even that one small thing that I remember from my school days has been proved to be wrong. That is why I am not very critical of the Government on this matter. We are living in a world where much is unknown, and it is only by the process of trial and error that our minds can develop properly. I want us to go as far and as fast as we can in the development of atomic energy for industry. I think that Australia is one of the countries that would derive great advantages from the application of nuclear energy to industry. The United States of America has no great need for nuclear power because it has conventional power available at the cheapest rates in the world half as cheap as in the United Kingdom. That explains what has happened in the United Kingdom, where there has been a degree of concentration on the development of atomic power stations, the best known being that at Calder Hall. The United Kingdom has also sought orders for the construction of atomic power stations overseas. America has only one such power station, and even American scientists say that the effort in America cannot be compared to that which has been made in the United Kingdom. America is lagging behind the United Kingdom in this work, but that is due to the fact that it has no internal problem due to a lack of conventional power. Therefore, it has no great need to develop nuclear power to supplement its own resources. We, however, need nuclear power to develop our vast continent. What are the Government and the Australian Atomic Energy Commisison doing to develop this source of power in Australia? Have we got to face the fact that if we want nuclear power stations in Australia, we will have to buy them from Great Britain? Is that where our future lies, or can we look forward, within the next five, six or even ten years, to making our own atomic power stations? That is the picture I should like to see. I should not like to think that the Government has said, in effect, When the time comes we will buy our atomic power stations from the United Kingdom, and in the meantime we will play around with the reactor that we have outside Sutherland. It is nice to have a few scientists playing around with that; it is something that we can talk about in the Parliament. That is not a policy that will bring us to the point where we can make our own power stations. I should like the Government to face up to this problem and to channel the work of the Atomic Energy Commission in the direction of the production of power in nuclear power stations. The position is far from clear. Senator Vincent said I am sure he was confident that what he said was right that the demand for uranium oxide must deteriorate because, for these purposes, uranium would be replaced by hydrogen. Yet in the report of the Atomic Energy Commission we find it stated that there is a growing demand for uranium oxide. The demand is growing despite the fact that uranium ore prices have dropped and contracts are harder to obtain. Some months ago, I showed the Minister for National Development a report on this subject that appeared in an American publication. , The same opinion was published again during the last couple of weeks, only in a much more severe form. It is very difficult to get good prices for uranium ore in the United States, yet the report of the Australian Atomic .Energy Commission stares that by 1958 the estimated free world production will be from 30,000 to 40,000 tons, a. year. . The commission also says that if requirements for uranium oxide continue to increase as expected, by 1975 .the total annual need could be from 4^000 to 100,000 tons. Senator Vincent, on the other hand, says that the demand for Uranium oxide must deteriorate. I do riot know who is right and who is wrong. At the moment the price of uranium has fallen, but the fall is in line with the fall of the prices of all metals. No metal has been able to stand tip under the economic barrage of the last eighteen months. The Government has been forced to take extraordinary steps to protect copper producers. The lead bonus at Broken Hill has been eliminated something that has not occurred for many years. The prices of all metals have dropped, some by more than half in the last eighteen months or two years. I only hope that the Australian Atomic Energy Commission has a clear policy for development at Rum Jungle and Mary Kathleen, although Mary Kathleen has some protection in that there we have a longterm contract with the British Government. I suggest that the British Government might do something with America in connexion with the sale of atomic power stations. At the moment, the Americans will not guarantee to supply uranium whereas the British Government guarantees to supply all the uranium .necessary to: keep in operation any atomic power station that it sells. In view of all these things, I must admit that it is hard to decide what should be done, but I suggest that if we confine our attention to what is best for Australia we shall not be far wrong  in the long run. A fulllime executive on the Australian Atomic Energy Commission may be necessary, but I doubt it. I incline to the view that this whole question of atomic energy for peaceful purposes is so important that it warrants a fulltime chairman of the commission. We have hardly scratched the surface of the problem yet, and for that reason we should endeavour to obtain the best brains possible : and give those brains the .fullest opportunity to concentrate on future steps to be taken in this most important, field. The Government should lay down a longrange plan, using the reactor at Menai as a basis. It should direct the Australian Atomic Energy Commission to construct, further nuclear power stations in Australia at the earliest possible : moment. I go so far as to venture the opinion that we may even see the time when that great part of SouthEast, Asia which is now bursting its bonds and reaching full status of nationhood will need the type of power that can be generated at nuclear power stations and when we may be in a  position to supply it,. .","N/A","ATOMIC ENERGY BILL 1958","/hansard/chamber.xscript/debate[4]/speech[9]/para[4]","N/A","N/A"
"0","0","0","1","0","0","0","1","SCOTT, Malcolm","K5K","Western Australia","N/A","N/A","250",". I rise to support this measure, the main purpose of which is to increase the personnel of the Australian Atomic Energy Commission by two, making ;one a full time commissioner: Senator Armstrong has criticized what the Australian Atomic Energy Commission has done in connexion with our scientists, but 1 point out that the commissions balancesheet for last year discloses that it granted £45,000 for research and £47,000 for studentships and scholarships; so that in all, the grants by the commission amounted to £92,000 out of a total expenditure of some £3,000,000 or £4,000,000. The Government has been very generous in its treatment, through the commission, of those people who have sought to enter this field of science. It has enabled them to receive university education for work in this field of science which is so important to the development of Australia.  At this stage, I point out that the Government proposes to bring before the House of Representatives and the Senate a bill to provide for the expenditure of £22,000,000 to aid the universities of Australia over the next three years.","N/A","ATOMIC ENERGY BILL 1958","/hansard/chamber.xscript/debate[4]/speech[10]/talk.start/para","N/A","N/A"
"0","0","1","0","0","0","0","1","TOOHEY, James","K8N","N/A","N/A","N/A","251","That is not enough. . ","N/A","ATOMIC ENERGY BILL 1958","/hansard/chamber.xscript/debate[4]/speech[10]/interjection[1]/talk.start/para","N/A","N/A"
"0","0","0","1","0","0","0","1","SCOTT, Malcolm","K5K","N/A","N/A","N/A","251","I suggest it is a most generous gesture when compared with what the Labour government did. ","N/A","ATOMIC ENERGY BILL 1958","/hansard/chamber.xscript/debate[4]/speech[10]/continue[1]/talk.start/para","N/A","N/A"
"0","0","1","0","0","0","0","1","MATTNER, Edward","KSS","N/A","N/A","N/A","251","It is £22,000,000 a year. ","N/A","ATOMIC ENERGY BILL 1958","/hansard/chamber.xscript/debate[4]/speech[10]/interjection[2]/talk.start/para","N/A","N/A"
"0","0","0","1","0","0","0","1","SCOTT, Malcolm","K5K","N/A","N/A","N/A","251","A total expenditure of £66,000,000 over the next three years. Much has been said about what Russia has done to encourage students to study the sciences. It has also been suggested that Russia .is paying her scientists much higher salaries than are being paid in Australia or in any of the free nations of the world. The Russians may have a few more scientists than we have at the moment, but it cannot be denied that the Australian Atomic Energy Commission is playing no mean part in encouraging people to take science degrees and engage in this important field of atomic energy development. ","N/A","ATOMIC ENERGY BILL 1958","/hansard/chamber.xscript/debate[4]/speech[10]/continue[2]/talk.start/para","N/A","N/A"
"0","0","1","0","0","0","0","1","TANGNEY, Dorothy","K7Y","N/A","N/A","N/A","251","How much is the scholarship worth? ","N/A","ATOMIC ENERGY BILL 1958","/hansard/chamber.xscript/debate[4]/speech[10]/interjection[3]/talk.start/para","N/A","N/A"
"0","0","0","1","0","0","0","1","SCOTT, Malcolm","K5K","N/A","N/A","N/A","251","We can go into that later. At the moment I wish to point out that, through the Australian Atomic Energy Commission, this Government has embarked on a field of research not undertaken by any previous government. The commission was established in 1953 for the purpose of developing atomic energy and the sources of atomic energy in Australia. Tn the five years of the commissions operation the Government has not found it necessary to make any major amendments to the legislation. The only reason why any amendment is being made now, if I read the Ministers secondreading speech correctly, is . that this field of research has become so important that an increase in the membership of the commission from three to five, with one fulltime commissioner, is warranted. ..  When .we consider the history of the development of atomic energy throughout the world, we see that from the time of the first atomic bomb in 1945 it has taken approximately thirteen .years to harness atomic energy for commercial purposes. The Australian Government, appreciating the importance df discoveries of  uranium, offered rewards to prospectors of up to £25,000. If a person found uranium in any part of Australia, provided that the deposit was more than 5 miles from other known deposits, he could claim the reward, and if the discovery was substantiated by the Department of National Development, a reward of up to £25,000 would be made. We have had several important discoveries in Australia. For instance, Mr. White discovered the Rum Jungle deposits and received a reward from the Government, through the Australian Atomic Energy Commission of £25,000. The Mary Kathleen field has since  been discovered and a reward of £25,000 was paid to the finder this year. It has been said that we in Australia have not pulled our weight in the ; development of uraniummining and atomicenergy.  I wish to emphasize that When the Mary Kathleen leases come into operation, Australia will be the fourth largest producer of uranium oxide in the world. Statistics disclose that by 1975, the total world requirements of uranium oxide will be 75,000 tons a year. According to the United States Atomic Energy Commission, America will require, for industrial purposes by 1975, between 20,00 and 30,000 tons a year, while the requirements of the rest of the free world will account for the balance of the 75,000 tons a year. At the present time, the total production of uranium oxide by the countries of the free world is only about 30,000 tons a year. Last year, the United States produced only 8,000 tons, from a. total of 4,000,000 short tons of uranium ore. Honorable senators will therefore appreciate that great quantities of. ore have to be handled in order to produce a small quantity of uranium oxide. When we realize that only 8,000 tons of uranium oxide were obtained from 4,000,000 tons of uranium ore, we can appreciate that large quantities of uranium ore will have to be located between now and 1975 if we are to keep up the supplies of uranium oxide that atomic power stations throughout the world will require.","N/A","ATOMIC ENERGY BILL 1958","/hansard/chamber.xscript/debate[4]/speech[10]/continue[3]/talk.start/para","N/A","N/A"
"0","0","1","0","0","0","0","1","TOOHEY, James","K8N","N/A","N/A","N/A","252","That is something that the Government can promise during the next election campaign. ","N/A","ATOMIC ENERGY BILL 1958","/hansard/chamber.xscript/debate[4]/speech[10]/interjection[4]/talk.start/para","N/A","N/A"
"0","0","0","1","0","0","0","1","SCOTT, Malcolm","K5K","N/A","N/A","N/A","252","The Australian Labour party makes plenty of wild promises, but I doubt whether the Government parties need to do so to win the next election.  The reserves of uranium ore in the United States, in November, 1956, amounted to 60,000,000 tons, the grade being only 2.5 per cent, uranium oxide. At the milling rate of approximately 5,000,000 to 6,000,000 tons annually, the known ore reserves in America have a life of only ten years. I notice from the report of the Australian Atomic Energy Commission that the commission is worried because prospecting is not being undertaken widely in Australia. I think that, in Australia, an idea has got about that the price of uranium oxide has fallen so much that nobody wants it. I believe, too, that the Australian people have the idea, fostered by the publicity given to the discovery by Australian scientists in England, in conjunction with English scientists, of ways and means to develop hydrogen power for peaceful purposes, that in the near future the need for uranium will cut out. In my opinion, the discovery by Dr. Thonemann and his colleagues in England is one of the greatest that has been made in the world in the last decade, or even since the turn of the century. To my mind, it is of far greater importance to the world than is the launching of a Sputnik into outer space which, although a considerable achievement, does not really mean very much in the development of power for peaceful uses. It is possible that the development of hydrogen  power in the future will be so economical and on such a large scale that we in Australia, if we get to the stage of installing the necessary plants, will be able tq reclaim areas that are now uninhabitable because of lack of water. I believe, however, that the generation of power from hydrogen will take a long time to achieve. It has been said by notable scientists that it mav take twenty years to do so. There is a possibility that it may be 30 years, or even 40 years, before such power can be harnessed for peaceful purposes. Perhaps that is the reason why Australians today are not searching more vigorously for additional uranium deposits. However, I understand that the reward still applies. I understand, also, that the encouragement that the Commonwealth Government has given to the uranium industry does not extend to any other industry, with the exception of goldmining. I refer to the fact that the net profit derived from the sale of uranium is tax free. The Government provided initially that it should be tax free until 1962, but the period has been extended to 1965; seven years from now. Uranium produced in Australia is sold at a guaranteed price. .","N/A","ATOMIC ENERGY BILL 1958","/hansard/chamber.xscript/debate[4]/speech[10]/continue[4]/talk.start/para","N/A","N/A"
"0","0","1","0","0","0","0","1","OFLAHERTY, Sidney","JYY","N/A","N/A","N/A","252","What is the price? ","N/A","ATOMIC ENERGY BILL 1958","/hansard/chamber.xscript/debate[4]/speech[10]/interjection[5]/talk.start/para","N/A","N/A"
"0","0","0","1","0","0","0","1","SCOTT, Malcolm","K5K","N/A","N/A","N/A","252","That has not been disclosed by the Government; but, to make a rough stab at it, I. should say it is between £10.000 and £12,500 per short ton. I have suggested that figure, because it has been stated that uranium oxide produced by Canada is sold at a price which is equivalent to between £10,000 and £12,000 in Australian currency.  Englands power requirements are mounting every day. Last year she consumed 214,000,000 tons of coal. It is estimated that that figure will rise to approximately 250,000,000 tons a year, and that her coal deposits have a life of between 150 and 200 years. That is why England is placing such emphasis on the use of uranium oxide for the production of nuclear power. On 17th October last year, Her Majesty the Queen turned a switch which fed atomic power from Calder Hall into the grid system throughout the British Isles. A British white paper issued in 1955 disclosed that by .1965 Britains output of nuclear power would be between. 1,500 and 2,000 megawatts. Since then., the target has been raised to between 5.000 and 6.000. megawatts,, which* is equivalent to the power output of 18,000,000. tons of coal. It is estimated that by 1 975 she will be using atomic power equivalent to the output of between 60.000.000 and 70,000,000 tons of coal. Sir Christopher Hinton, who is managing director of the British atomic energy authoritys industry group, estimates  that trie cost of nuclear power will decline. He believes that by 1956 the cost of producing a unit of nuclear power will be ,66d., that in 1970 it will be .43d., that in 1980 it will be .38d., and that by 1990 it will drop to less than onethird of a penny. Even today, this form of power is almost as cheap as power that is derived from conventional fuels such as coal.","N/A","ATOMIC ENERGY BILL 1958","/hansard/chamber.xscript/debate[4]/speech[10]/continue[5]/talk.start/para","N/A","N/A"
"0","0","1","0","0","0","0","1","KENNELLY, Patrick","KPK","N/A","N/A","N/A","253","It is much cheaper. . ","N/A","ATOMIC ENERGY BILL 1958","/hansard/chamber.xscript/debate[4]/speech[10]/interjection[6]/talk.start/para","N/A","N/A"
