"question_flag","answer_flag","interjection_flag","speech_flag","petition_flag","quote_flag","motionnospeech_flag","chamber_flag","name","name.id","electorate","party","role","page.no","content","subdebateinfo","debateinfo","path","Speaker","Time"
"0","0","0","1","0","0","0","1","GUILFOYLE, Margaret","C7D","Victoria","LP","Minister for Social Security","280","Perhaps I could deal with the point which Senator Colston has just raised while I am waiting for the other query to be checked. What the honourable senator has now suggested is the answer to the question which perhaps I did not fully answer previously. The figures in the second reading speech which the honourable senator has quoted refer to the increase in the patient contribution and to the removal of the concession under the subsidised health benefits plan. But those figures do not include the amounts which will relate to those items which are removed from the pharmaceutical benefits list. So the discrepancy between the higher figure that the honourable senator quoted in the speech of the Minister for Health (Mr Hunt) on 4 February and the figures shown in the second reading speech relates to the drugs which will be removed from the list. Does that answer the honourable senators question regarding the 2 different sets of figures? ","N/A","NATIONAL HEALTH BILL 1976","/hansard/chamber.xscript/debate[7]/speech[6]/talk.start/para","N/A","N/A"
"0","0","1","0","0","0","0","1","COLSTON, Malcolm","PF4","N/A","N/A","N/A","280","Yes. ","N/A","NATIONAL HEALTH BILL 1976","/hansard/chamber.xscript/debate[7]/speech[6]/interjection[1]/talk.start/para","N/A","N/A"
"0","0","0","1","0","0","0","1","GUILFOYLE, Margaret","C7D","N/A","N/A","N/A","280","I will now deal with the matter which was raised by Senator Cavanagh. It would seem that the honourable senator does not have the amendments which are in the original Act. Subsection (2a) of section 99 of the Act, in paragraph (a), reads: . . the Commonwealth price of the pharmaceutical benefit does not, at the time of the supply, exceed the appropriate maximum amount.  Paragraph (b) of the same subsection, in the last sentence, includes the words the appropriate maximum amount. Those amendments were added to the original Act at some other time. Apparently the copy of the Act which Senator Cavanagh has does not show those later amendments to it.","N/A","NATIONAL HEALTH BILL 1976","/hansard/chamber.xscript/debate[7]/speech[6]/continue[1]/talk.start/para","N/A","N/A"
"0","0","1","0","0","0","0","1","CAVANAGH, James","K6F","N/A","N/A","N/A","280","I see that those words are in the bound volume. ","N/A","NATIONAL HEALTH BILL 1976","/hansard/chamber.xscript/debate[7]/speech[6]/interjection[2]/talk.start/para","N/A","N/A"
"0","0","0","1","0","0","0","1","GUILFOYLE, Margaret","C7D","N/A","N/A","N/A","280","Then the honourable senator has the information he sought. ","N/A","NATIONAL HEALTH BILL 1976","/hansard/chamber.xscript/debate[7]/speech[6]/continue[2]/talk.start/para","N/A","N/A"
"0","0","0","1","0","0","0","1","HARRADINE, Brian","6H4","Tasmania","N/A","N/A","281","I will not traverse the issues that have already been covered. The position has been put very clearly. All that has been said about this Bill has been put very succinctly. I think that logic is certainly on this side of the chamber with regard to this particular piece of legislation. I propose to vote against the provisions in these clauses because I believe that the Government is acting in some haste to get them through when certain questions still remain to be answered. I do not see why the disadvantaged of this community should bear the brunt of Government attempts to reduce disproportionately the rate of inflation. I also feel that there are many people in the State of Tasmania, from which I come, who, if they have a number of children, will not be able to go to a public hospital, wait around and then obtain their prescriptions from that hospital. This will be the case particularly in a very populous area of the State which has been affected by the fall of the Tasman Bridge. I think that it would be better for the Government to delay consideration of this Bill until all the facts are to hand.  I for one am waiting for some information which has not yet come to hand. I would have liked to have heard from the Minister for Social Security (Senator Guilfoyle) what practical steps the Department of Health is taking to reduce the bureaucratic expenses that are involved in servicing the benefit. These expenses amount to almost half the cost of the benefit. If the Government is seeking to reduce spending it should let honourable senators know precisely what it intends to do, rather than abolishing altogether the benefits of which at least some of the low income families and groups have availed themselves. I propose to vote against the clauses. Question clauses stand as printed.","N/A","NATIONAL HEALTH BILL 1976","/hansard/chamber.xscript/debate[7]/speech[7]/talk.start/para","N/A","N/A"
"0","0","0","0","0","0","0","1","N/A","N/A","N/A","N/A","N/A","N/A","Clause 15 agreed to.","N/A","NATIONAL HEALTH BILL 1976","/hansard/chamber.xscript/debate[7]/para[4]","N/A","N/A"
"0","0","0","0","0","0","0","1","N/A","N/A","N/A","N/A","N/A","N/A","Clause 16 agreed to.","N/A","NATIONAL HEALTH BILL 1976","/hansard/chamber.xscript/debate[7]/para[5]","N/A","N/A"
"0","0","0","0","0","0","0","1","N/A","N/A","N/A","N/A","N/A","N/A","Title agreed to.","N/A","NATIONAL HEALTH BILL 1976","/hansard/chamber.xscript/debate[7]/para[6]","N/A","N/A"
"0","0","0","0","0","0","0","1","N/A","N/A","N/A","N/A","N/A","N/A","Bill reported without amendment; report adopted.","N/A","NATIONAL HEALTH BILL 1976","/hansard/chamber.xscript/debate[7]/para[7]","N/A","N/A"
"0","0","0","0","0","0","0","1","N/A","N/A","N/A","N/A","N/A","N/A","Bill (on motion by Senator Guilfoyle) read a third time.","Third Reading","NATIONAL HEALTH BILL 1976","/hansard/chamber.xscript/debate[7]/subdebate.1[2]/para","N/A","N/A"
"0","0","0","0","0","0","0","1","N/A","N/A","N/A","N/A","N/A","N/A","Debate resumed from 25 February, on motion by Senator Knight:","AddressinReply","GOVERNORGENERALS SPEECH","/hansard/chamber.xscript/debate[8]/subdebate.1/para[1]","N/A","N/A"
"0","0","0","0","0","1","0","1","N/A","N/A","N/A","N/A","N/A","N/A","That the following AddressinReply be agreed to:  To His Excellency the GovernorGeneral May it Please Your Excellency We, the Senate of the Commonwealth of Australia in Parliament assembled, desire to express our loyalty to our Most Gracious Sovereign, and to thank Your Excellency for the Speech which you have been pleased to address to Parliament.","AddressinReply","GOVERNORGENERALS SPEECH","/hansard/chamber.xscript/debate[8]/subdebate.1/quote[1]/para[1]","N/A","N/A"
"0","0","0","0","0","0","0","1","N/A","N/A","N/A","N/A","N/A","N/A","Upon which Senator Harradine had moved by way of amendment:","AddressinReply","GOVERNORGENERALS SPEECH","/hansard/chamber.xscript/debate[8]/subdebate.1/para[2]","N/A","N/A"
"0","0","0","0","0","1","0","1","N/A","N/A","N/A","N/A","N/A","N/A","That the following words be added to the AddressinReply, viz.: and the Senate is of the opinion that your advisers, having declared their intention of taking particular care over the special circumstances of the less populous States, should obtain the approval of those States prior to the implementation of your advisers new approach to Federalism ","AddressinReply","GOVERNORGENERALS SPEECH","/hansard/chamber.xscript/debate[8]/subdebate.1/quote[2]/para","N/A","N/A"
"0","0","0","1","0","0","0","1","BONNER, Neville","0V4","Queensland","N/A","N/A","281","Last evening before the Senate adjourned I was bringing to the attention of the Senate matters pertaining to the Aboriginal community known as Aurukun and to its concern regarding the mining venture which has been proposed in a Bill presented to the Queensland Parliament. Whilst speaking on this matter last evening I received some interjections from the other side of the chamber. I do not know that the interjections were terribly helpful to the people of Aurukun, nor do I feel that they were terribly helpful to me. So I shall endeavour during the rest of my remarks to ignore the inane interjections that one usually hears when talking on very important matters in this chamber. As I was saying last evening, I have received from some quarters criticism that I have been interfering or, supposedly, stirring the Aboriginal people in relation to this mining venture at Aurukun. I should like to read a letter that was written to me by the members of the Aboriginal Council at Aurukun dated 8 December 1975. The letter was addressed to Senator N. Bonner, Parliament House, Canberra, and stated: ","AddressinReply","GOVERNORGENERALS SPEECH","/hansard/chamber.xscript/debate[8]/subdebate.1/speech[1]/talk.start/para","N/A","N/A"
"0","0","0","0","0","1","0","1","BONNER, Neville","0V4","N/A","N/A","N/A","N/A","Dear Sir,  We are not happy about plans for mining at Aurukun. We are insulted because we have not been spoken to first. We want you to come to Aurukun for at least a couple of days and explain things to us and listen to what we have to say. We want you to come with the other people who are talking about mining Aurukun. We have written to them as well. Please tell us soon when you can come.","AddressinReply","GOVERNORGENERALS SPEECH","/hansard/chamber.xscript/debate[8]/subdebate.1/speech[1]/quote[1]/para[1]","N/A","N/A"
"0","0","0","1","0","0","0","1","BONNER, Neville","0V4","N/A","N/A","N/A","N/A","That letter was signed by 4 Aboriginal councillors at Aurukun. I answered the letter from my office in Brisbane by telegram addressed to the Chairman and Councillors of the Aurukun Aboriginal Community, via Thursday Island. The message read: ","AddressinReply","GOVERNORGENERALS SPEECH","/hansard/chamber.xscript/debate[8]/subdebate.1/speech[1]/para[1]","N/A","N/A"
"0","0","0","0","0","1","0","1","BONNER, Neville","0V4","N/A","N/A","N/A","N/A","Your letter received and understood. I give you my solemn promise that I will attend meeting as proposed at Aurukun as soon as arranged by your Councillors. Please telegram arrangements my home address 3 Short Street, Ipswich, directly they are finalised. I am gravely concerned and am insisting that fellow Aborigines Aurukun be totally consulted re proposed bauxite mining project. Best wishes and kind regards . . . Neville T. Bonner, Senator for Queensland. ","AddressinReply","GOVERNORGENERALS SPEECH","/hansard/chamber.xscript/debate[8]/subdebate.1/speech[1]/quote[2]/para","N/A","N/A"
"0","0","0","1","0","0","0","1","BONNER, Neville","0V4","N/A","N/A","N/A","N/A","So, as to the criticism that I am a selfappointed spokesman, certainly I am acting on behalf of my constituents, who contacted me and asked me to come to their community to discuss these matters with them.  Having received that message and answered it, I then contacted the Federal Minister for Aboriginal Affairs, Honourable Ian Viner, and invited him to come to Queensland because I was concerned about what was happening in relation to the mining venture at Aurukun. The Minister replied to me and drew up an itinerary for a visit. I accompanied him through Queensland and we made Aurukun one of the main points on the itinerary. The Minister, his secretary, the Queensland Director of Aboriginal Affairs and I stayed overnight at Aurukun. I understand from the people there and from the members of the Presbyterian Church that it was the first time in history that a Minister, either State or Federal, had ever spent a night and a day on the Aurukun Aboriginal Reserve or on any of the isolated reserves in Queensland. I want to pay tribute to the Minister because he took the time to do that. In my opinion and in the opinion of many of the people in Queensland, he had one of the longest, most informative and most fruitful meetings with a group of Aboriginal people that it has ever been my pleasure to attend. We sat under the trees at the Aurukun Mission surrounded by some 500 or 600 Aboriginal people men, women and children. The meeting went for something like 3% hours, during which time the people spoke to the Minister and told him, as they had told me on other occasions, of their concern about what is going to happen to their community. They spoke of the lack, of consultation and the lack of concern for them that has been apparent in other quarters. Other criticisms need to be answered, and in that regard I wish to refer to the editorial which appeared in the CourierMail on 27 January 1976. It stated:","AddressinReply","GOVERNORGENERALS SPEECH","/hansard/chamber.xscript/debate[8]/subdebate.1/speech[1]/para[2]","N/A","N/A"
"0","0","0","0","0","1","0","1","BONNER, Neville","0V4","N/A","N/A","N/A","N/A","Queensland Young Liberals, after hearing Senator Neville Bonner, have joined the growing list of people and organisations dissatisfied with the State Government s treatment of Aurukun Aborigines over bauxite mining in the area.  Others include the Presbyterian Church of Australia, the Aboriginal and Islander Catholic Council, the State Opposition, the Australian Conservation Council, Dean George, Mr F. G. Brennan Q.C., and Mr Frank Purcell, of Melbourne, the Aurukun peoples legal adviser (and a Liberal Federal election candidate). These organisations and people are not irresponsible. Most can speak with some authority on the matter. The State Government should pause before implementing its mining legislation and consult the Aborigines and their representatives about the future of the Aurukun reserve.","AddressinReply","GOVERNORGENERALS SPEECH","/hansard/chamber.xscript/debate[8]/subdebate.1/speech[1]/quote[3]/para[1]","N/A","N/A"
"0","0","0","1","0","0","0","1","BONNER, Neville","0V4","N/A","N/A","N/A","N/A","So I am not alone in speaking on these matters. I am not alone in trying to bring justice to people who are crying out for assistance and guidance on this matter. I also have with me, and I think it is worth mentioning at this point of time, a newspaper article indicating that 300 Aurukun Aborigines have petitioned the Queensland Parliament. The article states: ","AddressinReply","GOVERNORGENERALS SPEECH","/hansard/chamber.xscript/debate[8]/subdebate.1/speech[1]/para[5]","N/A","N/A"
"0","0","0","0","0","1","0","1","BONNER, Neville","0V4","N/A","N/A","N/A","N/A","A petition signed by 300 adults from the Aurukun Mission, opposing any mining at Aurukun, will be presented to the Speaker of State Parliament (Mr Houghton).  The Rev. Jr. Sweet, director of the Presbyterian Churchs Aboriginal and Overseas Mission section, said last night almost all adults at Aurukun must have signed the petition.","AddressinReply","GOVERNORGENERALS SPEECH","/hansard/chamber.xscript/debate[8]/subdebate.1/speech[1]/quote[4]/para[1]","N/A","N/A"
"0","0","0","1","0","0","0","1","BONNER, Neville","0V4","N/A","N/A","N/A","N/A","It is important that these matters be brought to the attention not only of my colleagues here in the Senate but also, through them, of the people of Australia. What is happening to the people of Aurukun is nothing short of a shoddy deal.  Let us consider what the people are asking for. They are asking for simple things. They are not asking for a whole range of things that will break the mining company or take money out of the coffers of the State Government. All they are asking for is true, meaningful consultation about what the project is going to mean to the people of Aurukun. What is it going to mean to them in a number of ways? If the mining goes on and a town is built in close proximity to the Aboriginal community of Aurukun and there is a work force of some 1 500 people, who I imagine in a mining venture of this kind would be mostly males, what protection is going to be given to the Aboriginal community? There may be some smiles and smirks when I ask about protection; but I am 53 years of age and I have been around the ridges. I have worked with men on all types of labouring work and I am conscious that when a number of men live in an isolated area such as this one they tend to wander. The concern of the Aboriginal people in this community is whether the mining workers are going to wander into the community. If that does happen, what will be the results and what authority will the people of the community have to deal with it? I am not saying that all miners are unscrupulous, but in any community there is always an element of unscrupulous people. If there are some of these unscrupulous men and they go on to the Aboriginal community, which is a group of 700 unsophisticated simpleliving people, with flagons of wine and with certain thoughts in their minds and they do take advantage of some of the young men and perhaps some of the young women, what protection are the Aboriginal people going to have from that kind of behaviour? No one has told them what they can do about it. There is the community council, which has a certain amount of authority delegated to it by the Department of Aboriginal Affairs through the Director. The community has its own Aboriginal police force; but what authority has it got, except over its own people in the community? If this sort of behaviour occurred and the police arrested one or two men and put them in their local gaol and the councillors sat in judgment on them, would that judgment carry weight? Would it be recognised by the white law, or would someone be able to say: No, you cannot do that. He is a white man. You cannot put him in your gaol. You can put your own people in your gaol, but you cannot put him in. We will let him go. He is a white man. He comes from the mining town? These are some of the matters that are raised. In relation to employment, the Second Schedule to the Queensland legislation provides that the mining company will employ employable Aborigines from the Aurukun community. What is an employable Aborigine? What is an employable person? That is not defined at all. I look at it this way: If the employment officer from the mining company visited the community with thoughts of employing some Aborigines, he might say: Look, councillors, I want 3 bulldozer drivers, 3 end loader drivers, 2 mechanics, and 1 plumber. The councillors would look at him blankly and say: We have never driven bulldozers. Nobody has taught us how to drive bulldozers. What do you mean drive a bulldozer? The employment officer would go away, feeling good, and report to the management: I went to the Aurukun community. I offered to employ 12 blokes. They have no employable Aborigines. So, the responsibility of that company, according to the Act, has been carried out.","AddressinReply","GOVERNORGENERALS SPEECH","/hansard/chamber.xscript/debate[8]/subdebate.1/speech[1]/para[6]","N/A","N/A"
"0","0","1","0","0","0","0","1","MISSEN, Alan","KUU","N/A","N/A","N/A","283","He can please himself, anyway. ","AddressinReply","GOVERNORGENERALS SPEECH","/hansard/chamber.xscript/debate[8]/subdebate.1/speech[1]/interjection[1]/talk.start/para","N/A","N/A"
"0","0","0","1","0","0","0","1","BONNER, Neville","0V4","N/A","N/A","N/A","283","That is true. He can. But if he went to the Aboriginal community and said: I want 3 stockmen, 4 men to put up a fence, and another 2 men to dig ditches, and to use a shovel, he will get them; there will be no trouble about that. Again, his responsibilities will have been carried out. But to what benefit of the Aboriginal people is this?  The Aboriginal councillors and the Aboriginal community are saying that these are the things that they want to talk about. They want some kind of training schemes to be established for their young men. They have pointed out to us that dozens of young men from the age of 17 years to 25 years are strong and intelligent but unfortunately are untrained for these fields of employment. They ask: What about them? You are going to employ 1500 people, but how many Aborigines will you employ? What are you going to do for them? Another point that they have raised is that, according to the legislation, the Aboriginal people of Queensland will receive 3 per cent of the net profits from this mining venture. I am told that it will be at least 3 years before there will be any profits whatsoever. But I have talked to other people around the traps who are more conversant with and know a little more about the mining industry. They said to me: Look, when you talk about net profits of a company like this, it could be 30 years before you get a razor . Again, the Aboriginal people are saying: Why should it be 3 per cent of the net profits? Why cannot we be paid on a royalty basis? Other people have said to me: You cannot do that; you would be setting a precedent. But this is not so at all because royalties are paid. The Queensland Government will certainly receive its royalties. But not the Aborigines, not the original owners; they are not entitled to royalties, I am told. They can get only 3 per cent of the net profits, perhaps after 3 years. But according to this Bill and according to the Queensland Government, that 3. per cent profit will not go to the Aurukun people. It is to go into a welfare fund. They will get a percentage of that 3 per cent of the net profits. There may be some who wonder why I have brought this matter up. I want this matter aired in this Federal Parliament and before the Senate because I believe that the Aurukun people, to use a common Australian expression, have been sold a pup. I, for one, will continue to press in every way that I can and in any way that I can for some assistance for these people and to see that the Aboriginal people of Aurukun at least are given justice in their claims in relation to this mining venture. I have spoken at length on this matter because I have lived with it now for some six or eight months. I have talked with the people. I have listened to the people. I want to see that something is done. The Federal Minister for Aboriginal Affairs, the Honourable Ian Viner, has told me that he is sympathetic about the problems faced by the people of Aurukun. I feel quite confident that he will be taking steps himself to do something about this matter. I wish to speak about another matter today. I refer to the problems that are now being faced in my State of Queensland by the Queensland people. Later in the year, these problems will become worse. I have had consultations on this matter and also a letter seeking my support from the office of the Queensland Minister for local Government and Main Roads, the honourable Russ Hinze. He will be pressing for assistance from the Federal Government, or for further assistance, in relation to the devastation that has been caused to roads in many areas of Queensland. For the benefit of some people from southern States who do not know much about Queensland, I should point out that it is a big State. It is a State with perhaps the greatest degree of decentralisation of any Australian State. I say that with some pride. It takes almost 2 hours flying in a DC9 aircraft to travel from Brisbane to Cairns and one is not at the top of Queensland even then. It takes some 2 hours to fly, again in a DC9, from Brisbane to Mt Isa, and one is still not at the border. Queensland is quite a big State. Dealing with decentralisation, I point out that at .the eastern seaboard one can start from Brisbane and travel through Nambour, Maryborough, Bundaberg, Gladstone, Rockhampton, Proserpine, Bowen, Townsville, Ingham, Tully, Innisfail and then arrive at Cairns. Honourable senators will realise from what I have said what I mean when speaking about decentralisation. That is the situation on the eastern seaboard where sugar, secondary industry, beef, and grain are the major industries.","AddressinReply","GOVERNORGENERALS SPEECH","/hansard/chamber.xscript/debate[8]/subdebate.1/speech[1]/continue[1]/talk.start/para","N/A","N/A"
"0","0","1","0","0","0","0","1","MCLAREN, Geoffrey","KTZ","N/A","N/A","N/A","284","What about peanuts? ","AddressinReply","GOVERNORGENERALS SPEECH","/hansard/chamber.xscript/debate[8]/subdebate.1/speech[1]/interjection[2]/talk.start/para","N/A","N/A"
