"question_flag","answer_flag","interjection_flag","speech_flag","petition_flag","quote_flag","motionnospeech_flag","chamber_flag","name","name.id","electorate","party","role","page.no","content","subdebateinfo","debateinfo","path","Speaker","Time"
"0","1","0","0","0","0","0","1","GREENWOOD, Ivor","KMX","N/A","LP","N/A","261","I know there has been some anticipation I think probably there is some anticipation still in the AlburyWodonga development area that a university will be established there. Notwithstanding that anticipation, a number of considerations are operating against the establishment of that university. But I think the previous Government acknowledged, as certainly we acknowledge, that the decision as to whether a university is to be established is a matter for the Universities Commission and in due course the Universities Commission will present a report on this matter. If the result were that a university was not to be established, I do not think the consequences which were outlined by the honourable senator would ensue. After all, a college of advanced education is situated at Wagga Wagga and is growing in repute and stature. It is close to the AlburyWodonga area. ","UNIVERSITY FOR ALBURYWODONGA","QUESTIONS WITHOUT NOTICE","/hansard/chamber.xscript/debate[1]/subdebate.1[25]/answer/talk.start/para","N/A","N/A"
"1","0","0","0","0","0","0","1","KNIGHT, John","KPV","N/A","N/A","N/A","261","Can the Minister representing the Minister for the Capital Territory say whether it is correct, as has been alleged, that the present Government has drastically reduced funds available for Commissioner for Housing loans in the Australian Capital Territory? If this is not true, can the Minister indicate what the position in fact is? ","HOUSING LOANS IN THE AUSTRALIAN CAPITAL TERRITORY","QUESTIONS WITHOUT NOTICE","/hansard/chamber.xscript/debate[1]/subdebate.1[26]/question/talk.start/para","N/A","N/A"
"0","1","0","0","0","0","0","1","WEBSTER, James","KAS","N/A","NCP/NP","N/A","261","The truth of the matter is that following Labors last Budget, funds for Commissioner for Housing loans were exhausted. In actual fact, the money that the Labor Party had applied for this purpose was totally insufficient for the 197576 year. Due largely to the representations of the honourable senator and his colleague in another place, the present Government has decided that this situation should be remedied in some way. It was clear that many people in the Australian Capital Territory were being disadvantaged. Following careful examination of the matter it was decided recently to make available an additional $3m for Commissioner for Housing loans in the Australian Capital Territory. The Government did this, despite the current economic difficulties, in recognition of the importance of these funds to the Australian Capital Territory at this time. To ensure that these funds assist also the housing construction industry it was decided that such loans should be directed towards new construction. It was emphasised that if Labors policy had been continued no money at all would have been available now for such loans this year. ","HOUSING LOANS IN THE AUSTRALIAN CAPITAL TERRITORY","QUESTIONS WITHOUT NOTICE","/hansard/chamber.xscript/debate[1]/subdebate.1[26]/answer/talk.start/para","N/A","N/A"
"1","0","0","0","0","0","0","1","COLSTON, Malcolm","PF4","N/A","N/A","N/A","261","I preface my question, which is directed to the Minister representing the Minister for Defence, by remarking that I am fully aware that at times it is imperative that each of the 3 services carry out exercises by night. However, is the Minister aware that a number of residents in the area close to the Amberley Royal Australian Air Force base have complained of excessive noise from low flying aircraft flying during the night in exercise Summer Rain this week? Can the Minister advise the Senate whether the exercise called for flying on 2 nights, namely, from 3 p.m. to 1 1 p.m. on Tuesday, and from 11.30 p.m. on Wednesday until 7.30 a.m. this morning. Does the Minister agree in principle that, if possible, the Royal Australian Air Force should comply with the curfew restrictions placed on commercial aircraft in Australia? Finally, will the Minister take up this matter with the Minister for Defence to ensure that any complaints from people in the Amberley district in relation to exercise Summer Rain are taken into consideration when future exercises are planned? ","NIGHT FLYING EXERCISES","QUESTIONS WITHOUT NOTICE","/hansard/chamber.xscript/debate[1]/subdebate.1[27]/question/talk.start/para","N/A","N/A"
"0","1","0","0","0","0","0","1","WITHERS, Reg","DV4","N/A","LP","N/A","261","I shall certainly take up the matter with my colleague in the other place. I am not aware that there have been complaints about excessive noise. Nobody has written to me to complain about it. Whether they have written directly to the Minister for Defence I know not. As to the hours within which the exercises are conducted, I think that that is matter for Service decision. I have always had an interest in aircraft noise because I am continually fascinated as I fly into airports to see the construction of new houses around airports. For instance, I recall that when we first started flying into Tullamarine there were virtually no houses, but now they seem to be creeping towards the airport. I imagine that in a year or two we will get an enormous number of complaints about aircraft noise from residents at Tullamarine. ","NIGHT FLYING EXERCISES","QUESTIONS WITHOUT NOTICE","/hansard/chamber.xscript/debate[1]/subdebate.1[27]/answer/talk.start/para","N/A","N/A"
"1","0","0","0","0","0","0","1","DAVIDSON, Gordon","JTT","N/A","N/A","N/A","261","My question is directed to the Minister representing the Minister for Repatriation. I ask: Has the Minister any details on the reports relating to the closing of an extension of the Daw Park Repatriation Hospital in Adelaide? The extension is known as Birr a lee. My concern is for the patients and also for the staff of this institution. Is any information available as to where these people will be placed? ","DAW PARK REPATRIATION HOSPITAL","QUESTIONS WITHOUT NOTICE","/hansard/chamber.xscript/debate[1]/subdebate.1[28]/question/talk.start/para","N/A","N/A"
"0","1","0","0","0","0","0","1","GUILFOYLE, Margaret","C7D","N/A","LP","N/A","262","I have no information with regard to the closure of the hospital referred to by the honourable senator but I shall obtain a reply from the Minister. ","DAW PARK REPATRIATION HOSPITAL","QUESTIONS WITHOUT NOTICE","/hansard/chamber.xscript/debate[1]/subdebate.1[28]/answer/talk.start/para","N/A","N/A"
"1","0","0","0","0","0","0","1","WALSH, Peter","TJ4","N/A","N/A","N/A","262","My question is directed to the Minister representing the Treasurer and relates to the question I asked yesterday regarding the costs and effects of the Governments 40 per cent investment allowance policy in a particular area. The Minister pointed out that my question was based on an estimate published in a newspaper which itself may be incorrect. In view of that, I ask: Does the Government have its own estimates relevant to this question? If so, will the Minister present them to the Senate? If not, is the Government flying blind on this issue without any idea of the consequences or costs of its policy? ","INVESTMENT ALLOWANCE FOR TRACTORS","QUESTIONS WITHOUT NOTICE","/hansard/chamber.xscript/debate[1]/subdebate.1[29]/question/talk.start/para","N/A","N/A"
"0","1","0","0","0","0","0","1","COTTON, Bob","JQR","N/A","LP","N/A","262","I sent the question the honourable member asked me yesterday through to the Treasury for a more definite answer, but it has been my experience with the Treasury that it is not noted for giving money away. I think the honourable senator will find that when the facts are available they will dispel his doubts. ","INVESTMENT ALLOWANCE FOR TRACTORS","QUESTIONS WITHOUT NOTICE","/hansard/chamber.xscript/debate[1]/subdebate.1[29]/answer/talk.start/para","N/A","N/A"
"1","0","0","0","0","0","0","1","KILGARIFF, Bernard","KPO","N/A","N/A","N/A","262","I direct a question to the Minister for Science. In view of the great importance of the cattle industry to the Northern Territory, can the Minister inform the Senate what research the Commonwealth Scientific and Industrial Research Organisation is undertaking in the Northern Territory to assist the agricultural and pastoral industries? Can the Minister also indicate what other work the CSIRO might be undertaking in the Northern Territory? ","CSIRO RESEARCH IN NORTHERN TERRITORY","QUESTIONS WITHOUT NOTICE","/hansard/chamber.xscript/debate[1]/subdebate.1[30]/question/talk.start/para","N/A","N/A"
"0","1","0","0","0","0","0","1","WEBSTER, James","KAS","N/A","NCP/NP","N/A","262","The honourable senator has asked a quite extensive question relating to research carried out by CSIRO in the Territory which he represents. I have been to Alice Springs to look at the work being done there by the various branches of CSIRO and it would take quite some time to indicate all the programs that are being carried out. The Division of Land Resources Management and the Division of Tropical Agronomy are in Alice Springs, as well as other divisions that are related to ecological matters. Certainly the entomology group has been carrying out most important work in the releasing of dung beetles, which I think eventually will be one of the most important programs for the eradication of the buffalo fly infestation in the Territory. Various other programs relating to virus disease in livestock are being carried out. I shall get the honourable senator a complete list of the work that is being done, if that would suit him. ","CSIRO RESEARCH IN NORTHERN TERRITORY","QUESTIONS WITHOUT NOTICE","/hansard/chamber.xscript/debate[1]/subdebate.1[30]/answer/talk.start/para","N/A","N/A"
"1","0","0","0","0","0","0","1","SIBRAA, Kerry","EJ4","N/A","N/A","N/A","262","My question is directed to the Minister representing the Minister for Business and Consumer Affairs. In the light of the statement by the Minister on 24 February 1976 to the effect that certain provisions of the Trade Practices Act are in conflict with the Governments economic program, will the Minister explain which of the provisions of the Act are not completely consonant with the Governments current economic objectives? When did the Minister realise that certain provisions fell into this category? Why were these faults not identified by the then Opposition during the passage of the Trade Practices legislation? ","TRADE PRACTICES ACT","QUESTIONS WITHOUT NOTICE","/hansard/chamber.xscript/debate[1]/subdebate.1[31]/question/talk.start/para","N/A","N/A"
"0","1","0","0","0","0","0","1","GREENWOOD, Ivor","KMX","N/A","LP","N/A","262","It is difficult to give the sort of answer which the honourable senator seeks through his inquiry as the question relates essentially to newspaper reports about the state of the Ministers mind. There are many things which could be said but they may not be relevant to those matters about which the honourable senator is seeking information. I suggest to the honourable senator that if he re phrases his question and places it on the notice paper, he will get a considered reply, which is what I think the question really warrants. ","TRADE PRACTICES ACT","QUESTIONS WITHOUT NOTICE","/hansard/chamber.xscript/debate[1]/subdebate.1[31]/answer/talk.start/para","N/A","N/A"
"1","0","0","0","0","0","0","1","MISSEN, Alan","KUU","N/A","N/A","N/A","262","My question is addressed to the Minister representing the AttorneyGeneral. Has the Australian Law Reform Commission been requested to report on problems involved in the operation of varying laws in Australia relating to defamation? Has the Commission reported on such a reference? Have negotiations between the Commonwealth and the States been undertaken on this matter? If so, can the Minister report on the progress of those negotiations? ","DEFAMATION LAWS","QUESTIONS WITHOUT NOTICE","/hansard/chamber.xscript/debate[1]/subdebate.1[32]/question/talk.start/para","N/A","N/A"
"0","1","0","0","0","0","0","1","GREENWOOD, Ivor","KMX","N/A","LP","N/A","262","My understanding is that the matter has not been referred to the Australian Law Reform Commission. It has been discussed at meetings of the Standing Committee of AttorneysGeneral in times past. But I will refer the inquiry to the AttorneyGeneral. I am sure that he can give a considered reply. ","DEFAMATION LAWS","QUESTIONS WITHOUT NOTICE","/hansard/chamber.xscript/debate[1]/subdebate.1[32]/answer/talk.start/para","N/A","N/A"
"1","0","0","0","0","0","0","1","HARRADINE, Brian","6H4","N/A","N/A","N/A","263","My question is directed to the Minister for Industry and Commerce in his capacity as Minister representing the Treasurer. The Minister will recall that last Thursday in the Senate he promised to obtain further information for me in respect of subscriptions to the Australian Savings Bonds, series 1, He will be aware also that on the evening following my question the Treasurer admitted that the bonds had attracted some large subscriptions from institutions and professional investors. Is the Minister yet in a position to provide the Senate with the promised information, particularly the role played by professional investors ? ","GOVERNMENT BONDS","QUESTIONS WITHOUT NOTICE","/hansard/chamber.xscript/debate[1]/subdebate.1[33]/question/talk.start/para","N/A","N/A"
"0","1","0","0","0","0","0","1","COTTON, Bob","JQR","N/A","LP","N/A","263","The figures that I have are not finalised. I can quote out of my head for the honourable senator the approximate ones, but I am waiting for more definite information which is what the honourable senator was looking for. About $756m was attracted by series 1 of the savings bonds. The average subscription was approximately $6,600, I think, and about 125 000 people subscribed. It does not look as if many bonds were taken up by what might be called the fairly dubious method of investment by institutions and large organisations. It is essential to wait until the figures finally come in and to see from a closer examination of the whole situation what the position is. That is being done. The Treasurer, I think the honourable senator will also remember, made some comments about the need to check whether the issue had been taken up by larger groups rather than smaller groups. The basic evidence would indicate that this did not happen, but there is a need to check further. I am sorry that this has taken longer than perhaps the honourable senator would like, but it does take time to get these things. ","GOVERNMENT BONDS","QUESTIONS WITHOUT NOTICE","/hansard/chamber.xscript/debate[1]/subdebate.1[33]/answer/talk.start/para","N/A","N/A"
"1","0","0","0","0","0","0","1","CAMERON, Donald Newton","K3T","N/A","N/A","N/A","263","Can the Minister for Social Security inform the Senate when legislation will be introduced to provide a pension for fathers supporting dependent children, similar to the pension provided for supporting mothers? ","SUPPORTING FATHERS PENSION","QUESTIONS WITHOUT NOTICE","/hansard/chamber.xscript/debate[1]/subdebate.1[34]/question/talk.start/para","N/A","N/A"
"0","1","0","0","0","0","0","1","GUILFOYLE, Margaret","C7D","N/A","LP","N/A","263","No proposal is before the Government at present to introduce a pension of the nature mentioned by the honourable senator. To introduce something of that nature would be a matter of policy or a matter for a budget proposal. If that were the case an appropriate announcement would be made. But, at this stage, there is no proposal of that kind before the Government. ","SUPPORTING FATHERS PENSION","QUESTIONS WITHOUT NOTICE","/hansard/chamber.xscript/debate[1]/subdebate.1[34]/answer/talk.start/para","N/A","N/A"
"1","0","0","0","0","0","0","1","RYAN, Susan","GD5","N/A","N/A","N/A","263","Can the Minister representing the Minister for Immigration and Ethnic Affairs inform the Senate whether the Commonwealth Employment Service keeps any record of what proportion of the unemployed are migrants from nonEnglish speaking countries and of how disadvantaged they are in seeking employment because of language difficulties? Is the counter staff at Commonwealth Employment Service offices advising migrants of the existence of free English classes which are available to them? ","ENGLISH CLASSES FOR MIGRANTS","QUESTIONS WITHOUT NOTICE","/hansard/chamber.xscript/debate[1]/subdebate.1[35]/question/talk.start/para","N/A","N/A"
"0","1","0","0","0","0","0","1","GUILFOYLE, Margaret","C7D","N/A","LP","N/A","263","I shall refer the specific question from the honourable senator to the Minister. I hope that migrants are being advised of the availability of English courses wherever any government agency comes into contact with people who are able to take advantage of them. With regard to the statistical matter, I shall refer it to the Department and have an answer for the honourable senator. ","ENGLISH CLASSES FOR MIGRANTS","QUESTIONS WITHOUT NOTICE","/hansard/chamber.xscript/debate[1]/subdebate.1[35]/answer/talk.start/para","N/A","N/A"
"0","1","0","0","0","0","0","1","CARRICK, John","2U4","N/A","LP","N/A","263","I briefly add to the storehouse of knowledge of Senator McAuliffe on greeting cards and postage rates. I am advised that during December 1975 the 6 capital cities central mail exchange handled 233.9 million articles. This was a drop in traffic of 1 5.7 per cent from the previous December when 277.5 million articles were handled. I can conclude only that the greeting cards were hand delivered. ","GREETING CARDS","QUESTIONS WITHOUT NOTICE","/hansard/chamber.xscript/debate[1]/subdebate.1[36]/answer/talk.start/para","N/A","N/A"
"0","1","0","0","0","0","0","1","GUILFOYLE, Margaret","C7D","N/A","LP","N/A","263","I have some information which answers a question from Senator Davidson with regard to the Birr a lee Repatriation Hospital in South Australia. I think it may be advisable to put that information on the record today. The honourable senator asked about staff and other matters, lt is correct that the Government is considering the closure of this repatriation hospital because its present operation is uneconomic. An additional 10 nursing staff are required to lift the bed capacity to an economic level. Recruitment problems of staff are severe. If the hospitals were closed all staff would be offered positions at Daw Park where they can be absorbed without difficulty. Every effort will be made to accommodate patients in private nursing homes as an interim measure and at the Repatriation General Hospital, Daw Park. There are many difficulties in the hospital we are discussing. Staff difficulties and staff recruitment have limited the capacity of the hospital to 28 patients and the average daily bed occupancy is only 25. The difficulties which are mentioned are matters which are being considered by the Government. The staff will be offered the positions I have mentioned. ","DAW PARK REPATRIATION HOSPITAL","QUESTIONS WITHOUT NOTICE","/hansard/chamber.xscript/debate[1]/subdebate.1[37]/answer/talk.start/para","N/A","N/A"
"0","1","0","0","0","0","0","1","WEBSTER, James","KAS","N/A","NCP/NP","N/A","264","Yesterday Senator McAuliffe asked me a question on aerial reconnaissance of tropical cyclones. I realise his interest in the Queensland area. When I replied to the honourable senator I indicated that I would provide him with some further information. I am informed that aerial reconnaissance of tropical cyclones requires specially instrumented and strengthened aircraft. An indicative cost of a squadron of such aircraft is about $15m capital and $5m recurrent per annum in order to keep the squadron running. One squadron would be required for the Queensland coast and additional squadrons would be needed if the same coverage were to be given to the northwest coast and to the Darwin area. Only the United States of America operates aircraft on a regular basis to detect and measure the intensity of tropical cyclones.  The possibility of employing cyclone reconnaissance aircraft has been examined in a number of studies. It has been shown that in the Australian situation the large cost of providing the service would not be commensurate with the estimated improvement in the warning system. The detection and tracking of tropical cyclones off the Australian coast will be improved when the Japanese geosynchronous meteorological satellite is launched in 1977. Australia is cooperating with the Japanese in the project and will install a turn around ranging station in Australia. It will be one of 3 such stations which will control the position of the satellite. Receiving equipment will be installed to provide Australia with far more frequent satellite coverage than is available for present weather conditions. At the present time there is no method of accurately predicting the movement of tropical cyclones, but I can assure Senator McAuliffe that the Bureau of Meteorology constantly reviews its operational procedures, participates in international conferences and carries out research so as to keep abreast of methods and technology.","CYCLONE WARNINGS","QUESTIONS WITHOUT NOTICE","/hansard/chamber.xscript/debate[1]/subdebate.1[38]/answer/talk.start/para","N/A","N/A"
"1","0","0","0","0","0","0","1","MCAULIFFE, Ronald","KSY","N/A","N/A","N/A","264","Mr Deputy President, I seek leave to ask the Minister for Science a question concerning the information he has just given. ","CYCLONE WARNINGS","QUESTIONS WITHOUT NOTICE","/hansard/chamber.xscript/debate[1]/subdebate.1[38]/question/talk.start/para","N/A","N/A"
"1","0","0","0","0","0","0","1","DEPUTY PRESIDENT, The","10000","N/A","N/A","N/A","264","Is leave granted? There being no objection, leave is granted. ","CYCLONE WARNINGS","QUESTIONS WITHOUT NOTICE","/hansard/chamber.xscript/debate[1]/subdebate.1[38]/question/continue[1]/talk.start/para","N/A","N/A"
"1","0","0","0","0","0","0","1","MCAULIFFE, Ronald","KSY","N/A","N/A","N/A","264","I thank the Minister for Science for the information he has so speedily gathered and provided to me. Apparently he feels that the cost of introducing aerial reconnaissance is prohibitive. I ask: How does he think that cost compares with the estimated cost of the damage that has been caused by cyclones in Australia during in, say, the last 5 years? ","CYCLONE WARNINGS","QUESTIONS WITHOUT NOTICE","/hansard/chamber.xscript/debate[1]/subdebate.1[38]/question/continue[2]/talk.start/para","N/A","N/A"
"1","0","0","0","0","0","0","1","WEBSTER, James","KAS","N/A","N/A","N/A","264","I think the honourable senator would know that there are very few nations in the world that have available to them the sums of money of which I am speaking. The comment that I had made to the honourable senator was that this matter had been looked at and it was felt that the cost was not commensurate with the estimated improvement in the type of reporting. The honourable senators question suggests that the use of reconnaissance aircraft would cure the problem and would avoid the damage that is done by cyclones; which is of course an erroneous base upon which to commence. ","CYCLONE WARNINGS","QUESTIONS WITHOUT NOTICE","/hansard/chamber.xscript/debate[1]/subdebate.1[38]/question/continue[3]/talk.start/para","N/A","N/A"
"0","0","0","1","0","0","0","1","GREENWOOD, Ivor","KMX","Victoria","LP","Minister for Environment, Housing and Community Development","264","Pursuant to section 28 of the Legislative Drafting Institute Act 1974, 1 present the first annual report of the Legislative Drafting Institute for the period from 9 December 1 974 to 30 June 1975. ","N/A","LEGISLATIVE DRAFTING INSTITUTE","/hansard/chamber.xscript/debate[2]/speech/talk.start/para","N/A","N/A"
"0","0","0","0","0","0","0","1","N/A","N/A","N/A","N/A","N/A","N/A","Bill received from the House of Representatives.","N/A","AUSTRALIAN SECURITY INTELLIGENCE ORGANIZATION BILL 1976","/hansard/chamber.xscript/debate[3]/para[1]","N/A","N/A"
"0","0","0","0","0","0","0","1","N/A","N/A","N/A","N/A","N/A","N/A","Ordered that the Bill may be taken through all its stages without delay.","N/A","AUSTRALIAN SECURITY INTELLIGENCE ORGANIZATION BILL 1976","/hansard/chamber.xscript/debate[3]/para[2]","N/A","N/A"
"0","0","0","0","0","0","0","1","N/A","N/A","N/A","N/A","N/A","N/A","Bill (on motion by Senator Greenwood) read a first time.","N/A","AUSTRALIAN SECURITY INTELLIGENCE ORGANIZATION BILL 1976","/hansard/chamber.xscript/debate[3]/para[3]","N/A","N/A"
"0","0","0","1","0","0","0","1","GREENWOOD, Ivor","KMX","Victoria","LP","Minister for Environment, Housing and Community Development","264","I move:  That the Bill be now read a second time. Mr Deputy President, copies of my second reading speech have been circulated. It is the same as the second reading speech which was delivered in the House of Representatives. I am prepared to read it if any honourable senator so desires; but, for the reasons I have given, I seek leave to have it incorporated in Hansard.","Second Reading","AUSTRALIAN SECURITY INTELLIGENCE ORGANIZATION BILL 1976","/hansard/chamber.xscript/debate[3]/subdebate.1/speech/talk.start/para","N/A","N/A"
