"question_flag","answer_flag","interjection_flag","speech_flag","petition_flag","quote_flag","motionnospeech_flag","chamber_flag","name","name.id","electorate","party","role","page.no","content","subdebateinfo","debateinfo","path","Speaker","Time"
"0","0","0","1","0","0","0","1","BAUME, Peter","ME4","New South Wales","N/A","N/A","268","The Senate is debating the National Health Bill which is, in fact, part of the Governments program for economic recovery in this country. It is interesting that the Opposition intends to oppose the Bill while agreeing to many of the clauses. I would have thought it more appropriate for it to support the second reading and to confine its opposition to those parts of the Committee examination which it found difficult or offensive. I should like to congratulate Senator Grimes on his first appearance leading for the Opposition, to say how well he speaks in Opposition and that we hope he will long continue to hold the position to which he has now been translated.  The Bill before us has been made necessary by the economic disarray which we find in Australia. It has been necessary for our Government to examine closely all expenditure and to seek means by which we can cut expenditure to minimise the damage to Australias economy which is a direct consequence of 3 years government by Senator Grimes  Party. Had his Government not ignored the effects of its policies on the economy this Bill and the removal of certain benefits would not have been necessary. It is a pity that we have to examine the removal of certain benefits and propose an increase in the cost of certain pharmaceutical products. But we are looking at savings of more than $8m in the remainder of this financial year and of $36m in a full year. The main clause of the Bill to which I intend to direct myself is clause 12 which, as Senator Grimes has indicated, concerns the increase in the fee payable by a citizen for part of the pharmaceutical benefit, the fee going up from $1.50 to $2. That clause of the Bill will amend section 84 of the principal Act which deals with this particular matter. Senator Grimes has said that he cannot see any purpose in a further increase in the pharmaceutical prescription fee. Inflation is running at between 1 3 per cent and 1 5 per cent at present and since the increase which the Labor Government proposed last year we have had a considerable further inflationary upward pressure in one year, and 15 per cent of $1.50 is approximately 20c. We can already see that part of that increase merely allows for the inflation which the Labor Party brought to this country by its policies. I want to examine some of the history of the costing of the pharmaceutical benefits scheme. When the Labor Government first came to office Mr Whitlam appointed a task force which was instructed to examine the continuing expenditure policies of the previous LiberalCountry Party Government. Item 9 on page 79 of that review concerned an examination of the pharmaceutical benefits scheme. At that time the Labor Partys advisers drew attention to some of the dangers in the pharmaceutical benefits scheme as they saw them. They drew attention to what they considered to be the dangers of overprescription. They recommended, among other things, the possibility of a higher charge being made for certain drugs which might be prescribed under the scheme. There is no doubt that the Governments review committee examined the possibility of making higher charges on the public for drugs available under the pharmaceutical benefits scheme. It seems to me that the Labor Party is not objecting to the principle that people should pay for drugs, though it did object when the principle was introduced. The Opposition is objecting only to the quantum. I think that Senator Grimes is nodding his head in agreement. So, the Labor Party is merely arguing about the amount which is being proposed. Honourable senators might care to examine what the effect of the charge has been over the years. I remind the Senate that until 1959 that is to say, for the first 19 years of operation of the scheme there was no charge at all for drugs prescribed under the scheme. In 1959 a charge for drugs prescribed under the scheme was introduced. During the period that the charge was 50c the cost of drugs went up gradually. During the last year in which 50c was the amount payable that is, 197071 the average cost of a prescription was, in fact, $2.21. Since that time the average cost of a prescription has risen progressively. There have been several jumps in the contribution which the patient or the citizen is expected to make. In 197172, for example, when the charge to the member of the public was $1, the average cost of a prescription had gone up to $2.45. In 197475 the cost had risen to about $2.80. It was at that stage, in September 1975, that the Labor Government proposed an increase in the patient contribution to $1.50. But since September 1975 the cost of drugs has risen again. The latest figures which I have been able to obtain they include the December quarter but do not include rises in the cost of prescriptions in the JanuaryFebruary period of this year show that the average cost of a prescription is now $3.17. That is to say, there has already been a rise of almost 50c per prescription since September 1975. The fact is that there is a steady rise in the cost per prescription in keeping with the inflation which we have inherited from a spendthrift and reckless Labor government. This rise is not due to increased profits for drug companies. It is in fact associated with the implementation of some of the findings of the Scott Committee with which, I am sure, honourable senators opposite are familar, since they had the Committee report before them for so long; took so long to act upon it and, in fact, did so little when they did act. There was an increase in the cost of drugs due to adjustments made as a result of the acceptance of some of the findings of the Scott Committee. I say again that the increase in the cost per prescription has been about 50c since September 1975. The only unsatisfactory feature that occurs to me is that the percentage of each prescription cost which is being paid by the citizen has increased steadily. It has increased as a result of measures taken by LiberalNational Country Party and Labor governments. The Labor Governments move last September to increase the prescription cost to $1.50 significantly increased the percentage of the prescription cost borne by the citizen. I think we should keep in mind that there is developing a trend whereby the patient is now responsible for about 60 per cent of the cost of an average prescription. The second reading speech of the Minister for Health (Mr Hunt) made it clear that eligible pensioners will continue to be able to obtain their drugs free of charge. The only problem I foresee in this area is one to which Senator Grimes adverted, that is, if the list of pharmaceutical benefits is pruned considerably special hardship may fall upon pensioners. The reason for this is that certain drugs which appear on the general list and which may have cost less than $2 may be removed now as part of a cost saving program and will not be available to pensioners unless the drugs appear in some form on the list of benefits. I am sure our Government will be interested in looking at this. It might be necessary to examine the list of drugs available to pensioners and perhaps to bring back a group of drugs to be made available to pensioners only. I certainly do not know if what Senator Grimes said is correct, but if a further list of drugs is to be removed from today or from next week we would want to know whether this would disadvantage the pensioner population. If they are to continue to be able to obtain drugs free of charge then I hope the list is adequately comprehensive. In my period of study overseas following the time when Senator Grimes was a student of mine I worked in the United States of America and, as I am sure Senator Grimes will agree, I was appalled at the complete lack of benefits for people in need in the hospital where I worked. In fact, I can remember purchasing Dig oxen to give to a patient who needed the drug. But equally, when I worked in the United Kingdom and when I worked in some of the outpatient departments in our hospitals, I was appalled by the waste of drugs which occurs when they are free at the point of distribution. We have to seek a middle road I am sure that there is a bipartisan approach here whereby people make some contribution to the cost of drugs to help cost effectiveness.","Second Reading","NATIONAL HEALTH BILL 1976","/hansard/chamber.xscript/debate[5]/subdebate.1/speech[2]/talk.start/para","N/A","N/A"
"0","0","1","0","0","0","0","1","GRIMES, Don","9V4","N/A","N/A","N/A","269","Who writes the prescriptions though, Senator? ","Second Reading","NATIONAL HEALTH BILL 1976","/hansard/chamber.xscript/debate[5]/subdebate.1/speech[2]/interjection/talk.start/para","N/A","N/A"
"0","0","0","1","0","0","0","1","BAUME, Peter","ME4","N/A","N/A","N/A","269","I think Senator Grimes has raised a very worthwhile point. Part of the problem of overprescribing does rest with the medical profession, of which we are both members. I have never moved away from that position. Part of the problem involves educating our profession to an awareness of drug costs as well as an awareness of the needs of their patients. One makes many marginal decisions on whether or not to order a drug. To know whether or not a drug should be given requires the exercise of considerable delicacy.  I am concerned that 2 things should occur: First of all, I am concerned that the review of the whole pharmaceutical benefits scheme which was promised in another place should go ahead. I was delighted to see the Minister for Health in another place promise that such an inquiry was to be instituted. I hope that that inquiry will consider both the administrative costs of the pharmaceutical benefit scheme and the possible savings in administration. I am not convinced at all that we are making maximum use of the pharmacists. They possess considerable expertise which may help us in controlling some of the administration costs. Secondly, I hope we will review the whole question of the benefits made available to Australian citizens under the scheme and of how these benefits can be extended and protected. After all, administrative costs I believe $1.3m was the amount were a factor considered in making the decision to withdraw the special pharmaceutical benefit for those on subsidised health benefit costs. If the previous Labor Government took a decision that it was administratively feasible to use the pharmacists in its Medibank scheme we may find there are ways in which we can achieve administrative savings and not have to affect the benefits available or to increase prices. The other thing that I am concerned to know is that there will be continuing consultation between all the provider groups as well as the consumer groups when this kind of decision has to be reviewed in the future or if further decisions have to be made. I have always taken the view that the providers, whether they be the Private Hospitals and Nursing Homes Association, State Ministers of Health or the Pharmacy Guild, have a lot of expertise which can be brought to bear on the question of the costs of a scheme like the pharmaceutical benefits scheme. In the end, the financial welfare of the patient is often their own welfare. For example, they may have views on the implications of the removal under this Bill of some of the benefits, removals which I consider are mainly machinery matters. It has been necessary for the Government to look at all areas of expenditure. We face a financial crisis in this country which will have the gravest implications for every citizen if adequate measures are not taken to control the level of government spending and to slow the rate of inflation. It is unfortunate that in this review the welfare area has had to be considered at all. I believe that the Government has moved carefully in proposing the provisions which appear in this BDI. I believe that those provisions are not unreasonable. I believe that, combined with the Ministers assurance that there is going to be a thorough review of the whole scheme and with an understanding that all affected groups will be consulted, these measures will serve to help the Governments attempt to control inflation and they will help it in its long term objective of assisting those in need in a nation with a stable and secure economy. Sitting suspended from 12.42 to 2.1S p.m.","Second Reading","NATIONAL HEALTH BILL 1976","/hansard/chamber.xscript/debate[5]/subdebate.1/speech[2]/continue/talk.start/para","N/A","N/A"
"0","0","0","1","0","0","0","1","COLEMAN, Ruth","5V4","Western Australia","N/A","N/A","270","Prior to the suspension of the sitting, the Senate was discussing the National Health Bill and the amendments proposed to the National Health Act by the Government. The objections of the Opposition to the amendments proposed by the Bill have already been well covered by my colleague, Senator Grimes. I express my own concern that the Government does have a commitment to assist the disadvantaged. As a result of the amendments proposed by this legislation, the disadvantaged will be further disadvantaged. The patient contribution to the cost of a prescription, for instance, is to increase from $ 1 .50 to $2. This will be a burden on those who can least afford it. It is all very well to say that the Australian Labor Government started the process by increasing by 50c the then $1 charge in 1974. There was a great deal of discussion in our Party committee at that time whether we were in actual fact doing the right thing. I believe it has been proved subsequently that we were wrong.  To me, this does not take away from the fact that there is no value at all to the low income earner to be able to attend a medical practitioner with the knowledge that he can obtain medical treatment free when he leaves that surgery with a pile of prescriptions in his hand in respect of which he must pay $2 each. Senator Baume made the point I think in response to an interjection from Senator Grimes that it is not the patient who over prescribes; it is the doctor. A patient cannot write out a prescription; a doctor can. The medical profession must accept some responsibility in this area as also, I believe, must the drug manufacturers. We hear Senator Baume say that the cost of drugs is rising. In which area does he mean the cost of drugs is rising? Does he mean at the consumer level or at the manufacturing level? Is he referring to the level of profits being extracted by drug manufacturers? I believe and I have no evidence to the contrary that the drug manufacturers that operate in this country are making tremendous profits. I believe also that most pharmaceutical chemists are making reasonable profits.","Second Reading","NATIONAL HEALTH BILL 1976","/hansard/chamber.xscript/debate[5]/subdebate.1/speech[3]/talk.start/para","N/A","N/A"
"0","0","1","0","0","0","0","1","MISSEN, Alan","KUU","N/A","N/A","N/A","270","There is evidence to the contrary, Senator, and it has been quoted. ","Second Reading","NATIONAL HEALTH BILL 1976","/hansard/chamber.xscript/debate[5]/subdebate.1/speech[3]/interjection[1]/talk.start/para","N/A","N/A"
"0","0","0","1","0","0","0","1","COLEMAN, Ruth","5V4","N/A","N/A","N/A","270","I am concerned, Senator Missen, that I can go to a doctor and be prescribed a certain ointment. Unlike Senator Grimes I can give the Senate the name of that ointment. It is neosporin. I can get from a doctor a prescription for neosporin for my childs ailments. I can get that ointment on a prescription at a cost of $4.60. But I can go to the same chemist without a prescription and, provided that I inform the chemist that I am buying the same article in the same sized tube for my dog, I can get it for $3.40. There is some definite imbalance in the system. I would suggest that this is an area in which a comprehensive investigation is needed. ","Second Reading","NATIONAL HEALTH BILL 1976","/hansard/chamber.xscript/debate[5]/subdebate.1/speech[3]/continue[1]/talk.start/para","N/A","N/A"
"0","0","1","0","0","0","0","1","CAVANAGH, James","K6F","N/A","N/A","N/A","270","Look after dogs but not children. ","Second Reading","NATIONAL HEALTH BILL 1976","/hansard/chamber.xscript/debate[5]/subdebate.1/speech[3]/interjection[2]/talk.start/para","N/A","N/A"
"0","0","0","1","0","0","0","1","COLEMAN, Ruth","5V4","N/A","N/A","N/A","270","It is rather like food manufacturers always stressing that they will state on the label of their products the ingredients used but saying that the only thing that prevents them is that there could be pilfering of the actual trade recipes. Yet those manufacturers will consistently label accurately the contents of tins of dog and cat food, but they will not label the ingredients of most of the foods that are transmitted to human beings. Much the same situation applies in the area of drugs. How many times has this happened to those who go into a pharmacy with a prescription? If one happens to have an honest chemist, that chemist will say: Really, there is no value in this prescription, because I can sell the product to you for less than I would charge to supply it on prescription. It is a patent medicine. Alternatively, how many times does the chemist simply take down from a shelf a tube of ointment or a bottle of medicine, apply a label to it and sell it to the customer on script? It is a patent medicine. It is available. We do not need to go to the doctor to get that medicine, except that we need to know what it is that we require. I am concerned that those people who rely on these pharmaceutical benefits are the ones who will be disadvantaged even further. I know that the scheme is not successful. I know that only 10 per cent of the people who are eligible actually use it. ","Second Reading","NATIONAL HEALTH BILL 1976","/hansard/chamber.xscript/debate[5]/subdebate.1/speech[3]/continue[2]/talk.start/para","N/A","N/A"
"0","0","1","0","0","0","0","1","BAUME, Peter","ME4","N/A","N/A","N/A","271","Which benefit is this? ","Second Reading","NATIONAL HEALTH BILL 1976","/hansard/chamber.xscript/debate[5]/subdebate.1/speech[3]/interjection[3]/talk.start/para","N/A","N/A"
"0","0","0","1","0","0","0","1","COLEMAN, Ruth","5V4","N/A","N/A","N/A","271","I am talking about the pharmaceutical benefit. ","Second Reading","NATIONAL HEALTH BILL 1976","/hansard/chamber.xscript/debate[5]/subdebate.1/speech[3]/continue[3]/talk.start/para","N/A","N/A"
"0","0","1","0","0","0","0","1","BAUME, Peter","ME4","N/A","N/A","N/A","271","I think you mean the subsidised health benefits? ","Second Reading","NATIONAL HEALTH BILL 1976","/hansard/chamber.xscript/debate[5]/subdebate.1/speech[3]/interjection[4]/talk.start/para","N/A","N/A"
"0","0","0","1","0","0","0","1","COLEMAN, Ruth","5V4","N/A","N/A","N/A","271","Yes. I am now going on to the subsidised health benefits. Only about 10 per cent of those who are eligible use the scheme. But that does not mean that these benefits should be taken away from the 10 per cent who do utilise the service. That does not mean that we should lay an additional charge on those people who require this assistance most. This is similar in effect to what we understand will happen to the Australian Legal Aid Office. The people who require this assistance may not necessarily know that this is there, so because it is not going to be utilised much the people who do use the service will be penalised. ","Second Reading","NATIONAL HEALTH BILL 1976","/hansard/chamber.xscript/debate[5]/subdebate.1/speech[3]/continue[4]/talk.start/para","N/A","N/A"
"0","0","1","0","0","0","0","1","MISSEN, Alan","KUU","N/A","N/A","N/A","271","You have no basis for saying that. ","Second Reading","NATIONAL HEALTH BILL 1976","/hansard/chamber.xscript/debate[5]/subdebate.1/speech[3]/interjection[5]/talk.start/para","N/A","N/A"
"0","0","0","1","0","0","0","1","COLEMAN, Ruth","5V4","N/A","N/A","N/A","271","No, not at this time, because the Government has not come out with a strong and definite policy on what will happen to the Australian Legal Aid Office. I am hopeful that, when the Government does decide to move on it, you, Senator Missen, may remember some of the comments that you made in this chamber last year. ","Second Reading","NATIONAL HEALTH BILL 1976","/hansard/chamber.xscript/debate[5]/subdebate.1/speech[3]/continue[5]/talk.start/para","N/A","N/A"
"0","0","1","0","0","0","0","1","MISSEN, Alan","KUU","N/A","N/A","N/A","271","I remember them very well. ","Second Reading","NATIONAL HEALTH BILL 1976","/hansard/chamber.xscript/debate[5]/subdebate.1/speech[3]/interjection[6]/talk.start/para","N/A","N/A"
"0","0","0","1","0","0","0","1","COLEMAN, Ruth","5V4","N/A","N/A","N/A","271","I hope that you may act on them. But there are other considerations to be taken into account in respect of this legislation. How many of the staff at present working in the  Department of Social Security of the Department of Health who are already engaged specifically in the area of the subsidised health benefits plan and administering the $2 and the $5 payments that will apply when the National Health Act is amended, will find themselves retrenched or transferred, or subsequently in some way either have to accept a downgrading from their present levels or ultimately become unemployed? Has the Government considered the amount of money to be saved by that action? I have no doubt that Senator Baume s figures would be correct. He said this action would save $8m to the the end of this financial year and $30m in a full year. If a great number of people working in these departments are to become unemployed and are therefore to receive unemployment benefits and the other assistance provided to those who are unemployed, is there any advantage in simply putting forward an amending Bill in respect of legislation which has not been successful since the outset? Might I suggest that the Bill be withdrawn in its entirety, be reconsidered and be replaced by proposals that will work for the benefit of those people in our society who need this assistance.","Second Reading","NATIONAL HEALTH BILL 1976","/hansard/chamber.xscript/debate[5]/subdebate.1/speech[3]/continue[6]/talk.start/para","N/A","N/A"
