"question_flag","answer_flag","interjection_flag","speech_flag","petition_flag","quote_flag","motionnospeech_flag","chamber_flag","name","name.id","electorate","party","role","page.no","content","subdebateinfo","debateinfo","path","Speaker","Time"
"0","0","0","0","0","0","0","1","N/A","N/A","N/A","N/A","N/A","N/A","The PRESIDENT (Senator the Hon. Condor Laucke) took the chair at 11 a.m., and read prayers.","N/A","N/A","/hansard/chamber.xscript/business.start/para","N/A","N/A"
"1","0","0","0","0","0","0","1","WRIEDT, Ken","ISW","N/A","N/A","N/A","253","My question is directed to the Leader of the Government in the Senate. Perhaps it should be addressed to the Minister representing the Treasurer, but initially I will direct it to Senator Withers. Did the Premier of Western Australia, Sir Charles Court, recently seek approval from the Federal Government to borrow overseas large sums of money for the purpose of developing Western Australias mineral and industrial potential? If so, have any negotiations taken place between Federal Treasury officials and Western Australian Government Treasury officials in pursuance of that request? Does the Government reject the principle of large overseas borrowings in order to develop Australias mineral resources and would a State government wishing to make such borrowings receive favourable co side ration from the Australian Government? ","OVERSEAS BORROWING FOR MINING DEVELOPMENT","QUESTIONS WITHOUT NOTICE","/hansard/chamber.xscript/debate[1]/subdebate.1[1]/question/talk.start/para","N/A","N/A"
"0","1","0","0","0","0","0","1","WITHERS, Reg","DV4","N/A","LP","N/A","253","The only knowledge I have is that I think I saw newspaper reports some weeks ago alleging that the Premier of Western Australia was going to put certain propositions to the Government. I have no knowledge of whether he did put those propositions to the Government, but I will seek the information for the Leader of the Opposition. As to the balance of the question, it relates to a matter of Government policy and if the Government decides on a policy line, that will eventually be announced in the Parliament. ","OVERSEAS BORROWING FOR MINING DEVELOPMENT","QUESTIONS WITHOUT NOTICE","/hansard/chamber.xscript/debate[1]/subdebate.1[1]/answer/talk.start/para","N/A","N/A"
"1","0","0","0","0","0","0","1","DAVIDSON, Gordon","JTT","N/A","N/A","N/A","253","My question is directed to the Minister for Education and relates to training courses for translators and interpreters. Does the Minister agree that there is a need for the provision of these services in a number of centres where the concerns of ethnic and migrant communities are involved? Is any reconsideration being given to decisions which apparently have been taken which terminated some of the training courses for translators and interpreters? Can the Minister give me any information in this area which not only will assist ethnic communities but also will provide an opportunity for people who have special skills in interpreting and translating? ","TRANSLATORS AND INTERPRETERS","QUESTIONS WITHOUT NOTICE","/hansard/chamber.xscript/debate[1]/subdebate.1[2]/question/talk.start/para","N/A","N/A"
"0","1","0","0","0","0","0","1","CARRICK, John","2U4","N/A","LP","N/A","253","The Government would agree and I would agree that it is most important that there should be adequate training of interpreters and translators and that there should be opportunities for their employment once they are trained. The present difficulty arises out of the failure of the previous Government to make forward planning for financing the training courses which my Department was undertaking. The background is that in 1975 courses were set up at 3 institutions. They were the Royal Melbourne Institute of Technology, the Canberra College of Advanced Education and the University of New South Wales. Those courses were funded initially by the then Department of Labor and Immigration on the understanding that the funding would be picked up in the education triennium and funded forward. There was an abandonment of the triennium and, therefore, no funding. On top of that, the present Government put a restriction on the availability of funds. I am happy to say to the honourable senator that the Department of Immigration and Ethnic Affairs has found the necessary money. Notwithstanding the intricacies of financial arrangements, the Department of the Treasury and the Department of the Prime Minister have agreed that that money can be transferred to my Department. My Department will finance the courses. The courses will go on. We will put them in the triennium. ","TRANSLATORS AND INTERPRETERS","QUESTIONS WITHOUT NOTICE","/hansard/chamber.xscript/debate[1]/subdebate.1[2]/answer/talk.start/para","N/A","N/A"
"1","0","0","0","0","0","0","1","KEEFFE, James","KPG","N/A","N/A","N/A","253","My question is directed to the Minister representing the Treasurer. Can the Minister inform the Parliament whether it is a fact that the Prime Minister or more correctly, the Right Honourable the Prime Minister is duplicating all communications, including cables and general correspondence, etc., and conveying copies to his property, Nareen, for storage and reference purposes? Is all or some of the material being transferred by the expensive telex method? Has the Prime Minister also established an elaborate security system on his property? In view of the fact that the Prime Minister is constantly reminding the Australian people that 1976 is the year of financial restraint, can the Minister inform the Senate of (a) the weekly cost of transferring the correspondence and (b) the weekly cost of the security system? ","THE PRIME MINISTER","QUESTIONS WITHOUT NOTICE","/hansard/chamber.xscript/debate[1]/subdebate.1[3]/question/talk.start/para","N/A","N/A"
"0","1","0","0","0","0","0","1","COTTON, Bob","JQR","N/A","LP","N/A","253","I have never been to the Prime Ministers property but I imagine that he has an electric fence on that property to keep all kinds of rubbish out of the place. All one can do is direct that the long question asking for a lot of detail I would imagine totally unproven as to its fact and intent to the Prime Minister. ","THE PRIME MINISTER","QUESTIONS WITHOUT NOTICE","/hansard/chamber.xscript/debate[1]/subdebate.1[3]/answer/talk.start/para","N/A","N/A"
"1","0","0","0","0","0","0","1","KILGARIFF, Bernard","KPO","N/A","N/A","N/A","254","I ask a question of the Minister representing the Minister for the Northern Territory. I have been advised that on several occasions in the last week the Australian Broadcasting Commission has referred to further cuts being made in Government expenditure in the Northern Territory and has listed various projects. I believe that the information comes from an unnamed source. As the Minister for the Northern Territory has previously indicated the amount of cuts for this financial year and the deferment of further amounts to the next financial year, will the Minister comment on those news items, having in mind that there is considerable apprehension in the Northern Territory community with many firms in the building industry retrenching staff because of their uncertainty for the future? ","EXPENDITURE IN THE NORTHERN TERRITORY","QUESTIONS WITHOUT NOTICE","/hansard/chamber.xscript/debate[1]/subdebate.1[4]/question/talk.start/para","N/A","N/A"
"0","1","0","0","0","0","0","1","WEBSTER, James","KAS","N/A","NCP/NP","N/A","254","I imagine that the honourable senator refers to an item of news on the Australian Broadcasting Commission. It is my understanding that the ABC did broadcast a statement or statements listing for deferral a number of specific projects in the authorised works program for the Northern Territory. The source of the statements is unknown. Certainly they were not authorised by the Minister although some deferrals of projects not cancellation of projects but some deferrals had been foreshadowed in a statement made by the Minister on 4 February. I have been advised that the civil works program in the Northern Territory has been discussed by my colleagues, the Minister for Construction and the Minister for the Northern Territory, and that recommendations will soon be put to the Government. However, the honourable senator may be assured that when the information is to hand and the Minister is aware of the facts he will make a statement. I will see that that statement is made also in this place. ","EXPENDITURE IN THE NORTHERN TERRITORY","QUESTIONS WITHOUT NOTICE","/hansard/chamber.xscript/debate[1]/subdebate.1[4]/answer/talk.start/para","N/A","N/A"
"1","0","0","0","0","0","0","1","GRIMES, Don","9V4","N/A","N/A","N/A","254","My question is to the Minister representing the Minister for Health. Is it a fact that today a list of some 45 drugs to be deleted from the pharmaceutical benefits list, including all the long acting antihistamines, has been circulated to doctors and pharmacists in this country and that the frequency of the publication of the list of benefits is to be reduced? Will the Minister inform the Senate of the names of the drugs that are to be deleted and the reasons for their removal from the list? Also, what will be the saving to the Government as a result of their removal from the list and what will be the saving to the Government as a result of the cut in the frequency of the printing of that pharmaceutical benefits list? ","PHARMACEUTICAL BENEFITS DRUGS","QUESTIONS WITHOUT NOTICE","/hansard/chamber.xscript/debate[1]/subdebate.1[5]/question/talk.start/para","N/A","N/A"
"0","1","0","0","0","0","0","1","GUILFOYLE, Margaret","C7D","N/A","LP","N/A","254","I am not aware whether the original premise of the question is accurate. I have no information or the subject, but I will obtain an answer for the honourable senator. ","PHARMACEUTICAL BENEFITS DRUGS","QUESTIONS WITHOUT NOTICE","/hansard/chamber.xscript/debate[1]/subdebate.1[5]/answer/talk.start/para","N/A","N/A"
"1","0","0","0","0","0","0","1","JESSOP, Donald","KKD","N/A","N/A","N/A","254","My question, which is directed to the Minister representing the Minister for Primary Industry, concerns the alarming spread of water hyacinth in the tributaries of the Darling River in New South Wales. This is presenting a serious threat to the River Murray in South Australia, following sustained flooding in the upper reaches. Can the Minister say whether large scale efforts are planned to eradicate this monster weed? ","WATER HYACINTH","QUESTIONS WITHOUT NOTICE","/hansard/chamber.xscript/debate[1]/subdebate.1[6]/question/talk.start/para","N/A","N/A"
"0","0","1","0","0","0","0","1","MCAULIFFE, Ronald","KSY","N/A","N/A","N/A","254","Senator McLaren asked this question last week. You are a week behind. ","WATER HYACINTH","QUESTIONS WITHOUT NOTICE","/hansard/chamber.xscript/debate[1]/subdebate.1[6]/question/interjection/talk.start/para","N/A","N/A"
"1","0","0","0","0","0","0","1","JESSOP, Donald","KKD","N/A","N/A","N/A","254","I know. I also happen to be interested in this matter. Will the Government examine the need to provide financial and technological assistance to the Government of New South Wales or to some other authority in order to see that this work proceeds without delay? ","WATER HYACINTH","QUESTIONS WITHOUT NOTICE","/hansard/chamber.xscript/debate[1]/subdebate.1[6]/question/continue/talk.start/para","N/A","N/A"
"0","1","0","0","0","0","0","1","COTTON, Bob","JQR","N/A","LP","N/A","254","I am interested in this matter and I understand that there is sustained interest in it in the Senate. We are talking about the part of the world where I was born and where I lived for a long time. Historically, massive floods out of Queensland from time to time have caused all sorts of problems down that river system such as Bathurst bur and Noogoora bur. The water hyacinth problem, I have to admit quite freely, probably is generated in the high country of New South Wales. It is a serious problem. It is something which ought to be taken up as the honourable senator suggests. I certainly shall direct my attention to the matter. I do not want to spend the rest of my life chopping out water hyacinth. ","WATER HYACINTH","QUESTIONS WITHOUT NOTICE","/hansard/chamber.xscript/debate[1]/subdebate.1[6]/answer/talk.start/para","N/A","N/A"
"1","0","0","0","0","0","0","1","BISHOP, Reginald","K1Y","N/A","N/A","N/A","254","My question is directed to the Leader of the Government in the Senate. It follows other questions in relation to reductions in staff ceilings through tout the Commonwealth  Public Service. No doubt the Minister has seen statements by a number of important organisations that industrial action will be taken if any retrenchments occur. Is it clear now that it is the Governments intention that where the staff is to be reduced this will be done on the basis of the criterion the Minister reported last week, which was that the reduction has to be achieved by retirement, wastage, etc; or will the reduction occur, as the unions expect, through a number of retrenchments? If it is clear that no such retrenchments will occur will the Minister make a clear statement? If the position about sackings is unclear, will the Minister advocate what seems necessary, and that is the calling of a top level conference of all the staff associations with a responsible group in order to achieve some sort of consultation and arrangement in respect of this important matter?","PUBLIC SERVICE STAFF REDUCTIONS","QUESTIONS WITHOUT NOTICE","/hansard/chamber.xscript/debate[1]/subdebate.1[7]/question/talk.start/para","N/A","N/A"
"0","1","0","0","0","0","0","1","WITHERS, Reg","DV4","N/A","LP","N/A","255","The honourable senator asked me a similar question the other day. I undertook to get an answer for him in detail from the Minister for Defence. I regret to inform the honourable senator and the Senate that so far that reply has not arrived. I put a signal through the system stating that I wanted an urgent reply to the question. When that reply comes in I shall pass it on to Senator Bishop. As to the other matters which the honourable senator raised today, I shall make certain that my colleague in the other place, who is handling this matter, is alerted to the points raised by Senator Bishop relating to possible industrial action and his suggestion as to consultation. I shall see that he gets that information quite early. ","PUBLIC SERVICE STAFF REDUCTIONS","QUESTIONS WITHOUT NOTICE","/hansard/chamber.xscript/debate[1]/subdebate.1[7]/answer/talk.start/para","N/A","N/A"
"1","0","0","0","0","0","0","1","BONNER, Neville","0V4","N/A","N/A","N/A","255","My question is directed to the Minister for Education. I refer to a recent newspaper report indicating that 4 recently qualified Aboriginal teachers had been unable to obtain teaching employment. Can the Minister give the Senate any information on this matter? If not, will he have an investigation made at the earliest possible time? ","ABORIGINAL TEACHERS","QUESTIONS WITHOUT NOTICE","/hansard/chamber.xscript/debate[1]/subdebate.1[8]/question/talk.start/para","N/A","N/A"
"0","1","0","0","0","0","0","1","CARRICK, John","2U4","N/A","LP","N/A","255","Some few days ago I saw a report in the New South Wales Press to the effect that 4 Aboriginal teachers had not been able to get teaching employment. Because it is vitally important that all such teachers should, if possible, be placed since there is a scarcity of them, with their special knowlege, I sought some information. As I understand it they were trained at the Armidale Teachers College under Aboriginal study grants. Therefore, the knowledge of them was not with the Education Department of New South Wales as they were not bonded to that Department and they had no contractual responsibilities to that Department. They did not make application until January, as I understand the position. Therefore, they were very late in placement. I understand that one of these Aborigines is now returning to further study and does not seek employment. I am advised that the New South Wales Department of Education has written to three of them inviting them to come and have a talk. We will keep our eyes on the matter and endeavour to get a satisfactory solution. ","ABORIGINAL TEACHERS","QUESTIONS WITHOUT NOTICE","/hansard/chamber.xscript/debate[1]/subdebate.1[8]/answer/talk.start/para","N/A","N/A"
"1","0","0","0","0","0","0","1","BUTTON, John","4F4","N/A","N/A","N/A","255","My question is directed to the Minister representing the Minister for Foreign Affairs. I ask: Has the Government any means of checking a statement made by the leader of the UDT that 60 000 people have been killed in East Timor? Can the Government confirm or deny the accuracy of that report? What means of communication has the Government with East Timor? Further, following the seizure of a radio in Darwin on 24 January of this year, was an application made by a Mr Neilley in Darwin for a radio licence in order that he might receive messages from East Timor? If so, what has happened to that application? Is it within the Ministers discretion to grant or refuse such an application? ","TIMOR","QUESTIONS WITHOUT NOTICE","/hansard/chamber.xscript/debate[1]/subdebate.1[9]/question/talk.start/para","N/A","N/A"
"0","1","0","0","0","0","0","1","WITHERS, Reg","DV4","N/A","LP","N/A","255","I will seek information from my colleague in the other place as to whether 60 000 people were killed and also as to the other matters raised within a foreign affairs context. I imagine that the application for a radio licence would be a matter that would fall within the responsibility of my colleague the Minister for Post and Telecommunications. I do not know whether my colleague who represents that portfolio in this chamber could add anything to the matter. I certainly know nothing about the radio aspect. ","TIMOR","QUESTIONS WITHOUT NOTICE","/hansard/chamber.xscript/debate[1]/subdebate.1[9]/answer/talk.start/para","N/A","N/A"
"0","0","1","0","0","0","0","1","BUTTON, John","4F4","N/A","N/A","N/A","255","Was such an application made following the seizure of the radio? ","TIMOR","QUESTIONS WITHOUT NOTICE","/hansard/chamber.xscript/debate[1]/subdebate.1[9]/answer/interjection/talk.start/para","N/A","N/A"
"0","1","0","0","0","0","0","1","WITHERS, Reg","DV4","N/A","N/A","N/A","255","I do not know anything about that matter, but I imagine that the question of whether a radio ought to be permitted to operate would come under the Wireless Telegraphy Act, which is not administered by the Minister for Foreign Affairs. As the honourable senator is interested in that, I will also ask the Minister for Post and Telecommunications whether he can give an answer to the second part of the question. ","TIMOR","QUESTIONS WITHOUT NOTICE","/hansard/chamber.xscript/debate[1]/subdebate.1[9]/answer/continue/talk.start/para","N/A","N/A"
"1","0","0","0","0","0","0","1","CHANEY, Fred","EF4","N/A","N/A","N/A","256","My question is addressed to the Minister representing the Minister for Post and Telecommunications and refers to media reports today that the New South Wales branch of the Australian Broadcasting Commission Staff Association has decided to have a 24hour strike each Monday for a month in protest against cuts in the Australian Broadcasting Commissions budget and the alleged consequential sacking of ABC employees. As an officer of an ABC staff association or union claimed on radio this morning that the position of ABC employees is being misrepresented by the media, can the Minister tell us the facts so that the Senate may know whether this is an unfortunate case of the biter being bitten? ","AUSTRALIAN BROADCASTING COMMISSION STAFF DISPUTE","QUESTIONS WITHOUT NOTICE","/hansard/chamber.xscript/debate[1]/subdebate.1[10]/question/talk.start/para","N/A","N/A"
"0","1","0","0","0","0","0","1","CARRICK, John","2U4","N/A","LP","N/A","256","I did see this mornings newspaper reports to the effect that a decision had been taken by a meeting of the New South Wales branch, I think, of the Australian Broadcasting Commission Staff Association to have some form of 24hour strike on each Monday for a month. I understand that the branch has alleged that this is in protest against Government cuts, which it alleges will result in sackings within the ABC. I did see some reference to the fact that it may spread to Tasmania and Victoria. I am aware that last week branches of the ABC Staff Association in other States held meetings and decided not to strike.  I do not want to say anything that will exacerbate the situation because quite clearly it is a matter which is between the Commission, an independent body, and its staff, but I think it ought to be said that 2 points need clarification. The Australian Broadcasting Commission has said that it will reach the staff ceilings agreed to with the Government, that is 7200 employees, by June of this year without any retrenchments of permanent staff but by simple wastage and the nonfilling of vacancies. There has been a reference to the termination of the services of some 220 employees. I understand that there is a number of employees on shortterm temporary employment within the ABC, many of whose shortterm contracts will finish soon. When the contracts are finished presumably they will be terminated. I repeat that the Commission has said to the Staff Association, as I understand it, that there will be no sackings of permanent employees. While I am on my feet let me also say this: It is being said that the Commonwealth Government has imposed a cutback of, I think, some $8.4m upon the Australian Broadcasting Commission. That is simply not true. What is true is that the Commission asked the Government for an amount of, I think, $7.3m in excess of the Budget allocation and this was refused. The cutback is in the order of $1.3m. The sum of $8.4m is derived from assuming that the Commission would have gained $7.3m whereas it has actually lost $ 1.3m. The simple fact is that the total cutback in the Budget is in the order of $ 1.3m. As I understand it, the ABC has said that it can absorb that cutback within its budget without any sackings of permanent staff.","AUSTRALIAN BROADCASTING COMMISSION STAFF DISPUTE","QUESTIONS WITHOUT NOTICE","/hansard/chamber.xscript/debate[1]/subdebate.1[10]/answer/talk.start/para","N/A","N/A"
"1","0","0","0","0","0","0","1","MULVIHILL, James","KVK","N/A","N/A","N/A","256","My question, which is directed to the Minister for Education, really is supplementary to the question asked by Senator Davidson which concerned the outflow of people who have been trained as interpreters and translators. I want to deal with the other side of the coin, that is, the recognition professionally of the finished product. Perhaps the Minister can elucidate upon this point for me: During the hearings of Senate Estimates Committee E last year, the then Secretary of the Department of Labor and Immigration, Mr McKenzie, indicated that the then Government was creating an authority of nine persons more or less to ensure and protect the professional recognition of translators and interpreters. In the Governments reallocation of responsibilities, will these people be given professional protection. If not, they could face a situation similar to that faced by some of the diluted engineers after World War II. What is to happen in this regard? ","TRANSLATORS AND INTERPRETERS","QUESTIONS WITHOUT NOTICE","/hansard/chamber.xscript/debate[1]/subdebate.1[11]/question/talk.start/para","N/A","N/A"
"0","1","0","0","0","0","0","1","CARRICK, John","2U4","N/A","LP","N/A","256","I acknowledge, both to Senator Davidson and to Senator Mulvihill the absolute importance of having properly qualified interpreters and translators available. I acknowledge also the need for the establishment of standards and within those standards the protection of those people in terms of recognition and remuneration. I am unaware how far the matter has proceeded. I am unaware of the demarcation dispute between departments. I am aware that my colleague, the Minister for Immigration and Ethnic Affairs, breathes down my neck hourly in relation to the need to get these people and to get them on the job. I will undertake to talk with him and, indeed, with Mr Street, the Minister for Employment and Industrial Relations, if the matter overlaps into his Department and obtain a clear answer for the honourable senator. ","TRANSLATORS AND INTERPRETERS","QUESTIONS WITHOUT NOTICE","/hansard/chamber.xscript/debate[1]/subdebate.1[11]/answer/talk.start/para","N/A","N/A"
"0","1","0","0","0","0","0","1","MULVIHILL, James","KVK","N/A","N/A","N/A","256","Mr President, I wish to direct a supplementary question to the Minister for Education. Will he also examine the record of proceedings of Senate Estimates Committee E last year, which met under a very competent chairman? If he does so, he will find that very important evidence was given before that Committee which will help him in this matter. ","TRANSLATORS AND INTERPRETERS","QUESTIONS WITHOUT NOTICE","/hansard/chamber.xscript/debate[1]/subdebate.1[11]/answer/continue[1]/talk.start/para","N/A","N/A"
"0","1","0","0","0","0","0","1","CARRICK, John","2U4","N/A","N/A","N/A","257","I would be delighted to do so. ","TRANSLATORS AND INTERPRETERS","QUESTIONS WITHOUT NOTICE","/hansard/chamber.xscript/debate[1]/subdebate.1[11]/answer/continue[2]/talk.start/para","N/A","N/A"
