"question_flag","answer_flag","interjection_flag","speech_flag","petition_flag","quote_flag","motionnospeech_flag","chamber_flag","name","name.id","electorate","party","role","page.no","content","subdebateinfo","debateinfo","path","Speaker","Time"
"0","0","0","1","0","0","0","1","HARRADINE, Brian","6H4","Tasmania","N/A","N/A","446","I seek leave to propose a motion to suspend Standing Orders. ","N/A","SUSPENSION OF STANDING ORDERS","/hansard/chamber.xscript/debate[21]/speech[1]/talk.start/para","N/A","N/A"
"0","0","1","0","0","0","0","1","BAUME, Peter","ME4","N/A","N/A","N/A","446","Leave is not granted. ","N/A","SUSPENSION OF STANDING ORDERS","/hansard/chamber.xscript/debate[21]/speech[1]/interjection/talk.start/para","N/A","N/A"
"0","0","0","1","0","0","0","1","BAUME, Peter","ME4","N/A","N/A","N/A","N/A","Motion (by Senator Harradine) proposed: ","N/A","SUSPENSION OF STANDING ORDERS","/hansard/chamber.xscript/debate[21]/speech[1]/para","N/A","N/A"
"0","0","0","0","0","1","0","1","BAUME, Peter","ME4","N/A","N/A","N/A","N/A","That so much of Standing Orders be suspended as would prevent discussion of General Business, Notice of Motion No. 3, being proceeded with forthwith. ","N/A","SUSPENSION OF STANDING ORDERS","/hansard/chamber.xscript/debate[21]/speech[1]/quote/para","N/A","N/A"
"0","0","0","1","0","0","0","1","PRESIDENT, The","10000","N/A","N/A","N/A","446","A motion has been agreed to that this matter be made an order of the day for the next day of sitting. Therefore, it is out of order to move for the suspension of Standing Orders at this stage. The matter has been disposed of. ","N/A","SUSPENSION OF STANDING ORDERS","/hansard/chamber.xscript/debate[21]/speech[2]/talk.start/para","N/A","N/A"
"0","0","0","1","0","0","0","1","RAE, Peter","CAK","Tasmania","N/A","N/A","446","by leave I wish to make a brief statement which might help Senator Harradine. I have every reason to believe that this matter can be dealt with with reasonable expedition. Already there has been an indication, by the fact that there was agreement to Senator Harradines motion being declared formal today, that the matter came up before a number of other matters in which people may be interested. I believe that the matter can be proceeded with. It is certainly my wish that it be proceeded with expeditiously. I wish to assure Senator Harradine that, whilst what I have moved and what has been carried may mean a very brief delay, that delay will not be for very long. It is better that the matter be dealt with fully and properly when it comes on for debate than that it be dealt with on some other basis. ","N/A","SUSPENSION OF STANDING ORDERS","/hansard/chamber.xscript/debate[21]/speech[3]/talk.start/para","N/A","N/A"
"0","0","0","1","0","0","0","1","GRIMES, Don","9V4","Tasmania","N/A","N/A","446","by leave As a senator from Tasmania, I accept that this is an important matter. Like other honourable senators on this side of the chamber, I accepted the substituting of Senator Harradine s previous notice of motion for the one originally moved by Senator Rae. Now I view with interest the amended motion of Senator Rae. One hears a lot in this place about bipartisan approaches and about cooperating with each other. It has been very interesting for Opposition senators to hear of the cosy little arrangements that have been made between Senator Rae and Senator Harradine. The Opposition is perfectly happy to cooperate but I merely make the request that when these arrangements are made the Opposition occasionally be consulted, especially when people are going to move the suspension of Standing Orders and things of that nature. It is a noncontentious issue and an issue on which we can all agree. What is proposed will be of great benefit to the State.  Senator HARRADINE (Tasmania)by leave I can assure Senator Grimes that there was no cosy arrangement, or any arrangement at all, for that matter. I was not aware of the fact that apparently Senator Rae has some support to have this matter debated first the next time the Senate is dealing with General Business, Notices of Motion. I sought to move for the suspension of Standing Orders only because I believed that in the normal course of events the motion would go on the bottom of the Notice Paper. I am now satisfied that the matter can be dealt with expeditiously, presumably next week or the following sitting week. In that case, I accept the situation. While I am on my feet, I mentioned to Senator Rae that he is being less than fair in suggesting that my motion was totally out of date. Certainly some of it was, but that part relating to family allowances was not. I believed that that could best be dealt with in another manner; that is to say, the Senate could deal with the substantial increase in family allowances, and then with their indexation.","N/A","SUSPENSION OF STANDING ORDERS","/hansard/chamber.xscript/debate[21]/speech[4]/talk.start/para","N/A","N/A"
"0","0","0","1","0","0","0","1","SIBRAA, Kerry","EJ4","New South Wales","N/A","N/A","447","I move:  (1 ) That a Select Committee of the Senate be appointed to inquire into and report upon (a)all provisions of the Commonwealth Electoral Act 1918 and associated regulations and procedures, and in particular (i)changes that should be made to Parts XIII to XV of the Commonwealth Electoral Act which deal with methods of polling and the present system of counting returned votes; and (ii)changes that should be made to Parts XVI and XVII of the Commonwealth Electoral Act so as to determine the best means of ensuring the public disclosure of the sources and amounts of donations to political parties and candidates, and to prevent abuses of existing limitations on electoral expenses; and (b)an appropriate method of allotting proportionate subsidies by the Australian Government to political parties and candidates. (2)That provisions relating to membership, powers and proceedings of the Committee be contained in a subsequent Resolution. This is an issue on which I have spoken before, as have a number of my colleagues. I have raised the issue at Estimates committee hearings as well as in the Parliament but I have not got anywhere with it. I admit that electoral reform is not a crusading issue and that there is only limited public interest in it. A good example of that at the moment is that the New South Wales Government has a parliamentary committee investigating public funding. It is not looking at whether there should be public funding but at what is the best system for New South Wales. In other words, there will be public funding in New South Wales. Yet if one looks at the editorial columns and letters to the editors in the newspapers, one realises that it certainly has not become a public issue. I raise the matter because I believe it is crucial to our democratic political institutions. I wish to deal with some items in the Commonwealth Electoral Act that I think need reforming. The two major political parties and the minor parties have expressed dissatisfaction with the current Electoral Act. There has never been a complete overhaul of the Act, although Senator Withers and Senator Chaney, when they were the Ministers concerned, promised a full review. Both Ministers expressed dissatisfaction with the current laws. But what has been done? Have there been any ministerial statements or departmental papers from the present Minister for Administrative Services, Mr John McLeay? All we have heard is a deafening silence. I believe that electoral reform should be bipartisan. I believe that the Liberal Party has some interest in it but it tends to be luke warm on the matter. The National Country Party seems to be opposed to change. If ever proof were needed as to why Australias electoral procedures are outdated, we need only look at the time it takes to determine the results of Federal elections. One has only to go back to 1961, look at the House of Representatives election and realise that it was three or four weeks before this country knew who would be Prime Minister and which political party would form the Government. Let us compare that situation with that of Great Britain where there are over 400 or 500 seats, I think. The result is nearly always known within a period of 48 hours. We have only to look at the United States where there are literally hundreds of thousands of polling booths spread over the country, spread over four distinct time zones, and yet we know who is the President of the United States sometimes within 24 hours after the poll, and at the most 48 hours afterwards. Compared with that, let us look at the Senate election in New South Wales in 1975. The ballot took place on 1 3 December and we received the result on 6 February, nearly two months later. There were two recounts in that Senate election in New South Wales which showed grave inconsistencies in the way that the ballot had been counted. On the first count the winning candidate, which just happened to be me, won by 854 votes. After the second recount, the winning margin was 2016 votes. I know that some people might say that in a ballot of some nearly 3 million voters, with 74 candidates, that is not a great deal of discrepancy to find. If we look at the final total formal vote we find that at least 12,000 additional informal votes were found during the second recount, but thousands of votes also changed hands because votes credited to the Labor Party should have been credited to the Liberal Party, and vice versa. There was a massive exchange of votes in that recount which had been credited to wrong candidates on the first and second count. Of course new quotas had to be struck, which could quite easily have brought about a different result. Even at the end of the recounting I was convinced that if there had been another count more informal votes would have been found, and more votes credited to the wrong candidates. New quotas would again have to be struck, and there would have been a different result. Naturally as the successful candidate I did not push for that. But there were 74 candidates and in that situation, which is something I am going to come to later in my speech, there had to be complete confusion. I believe that if we had a Senate committee we could inquire into a computerised tallying of votes. We could examine voting machines and we could do it in a bipartisan way and not under any pressure. Our present system of exhaustive preferential voting discriminates heavily against the aged, the infirm, migrants and Aborigines. In those electorates where there are high concentrations of socially disadvantaged electors, one finds by far the highest informal voting figures. In the 1 977 election for the House of Representatives, the electorate of Sydney had a 4.27 per cent informal vote. In Bradfield, which encompasses perhaps the highest income area in the Sydney metropolitan area, only 1.3 per cent of the votes cast were informal. In the 1 977 Senate elections, 4.9 per cent of the votes cast in Bradfield were informal; but in Sydney, in a disadvantaged area, 12.5 per cent of the votes cast for the Senate were informal. This was despite the fact that the member for Sydney put multilingual advertisements for the Senate in all the newspapers that went through his electorate. He took the ALP howtovote card of the Senate, which again was printed in a multilingual fashion, and put it into every letterbox in the electorate. I am sure that no similar measures were taken in the electorate of Bradfield Even though there was a conscious effort in Sydney and I believe that the informal vote came down from about 15 per cent in the previous election it was still a very bad 12.5 per cent. In every election there is the same pattern. In electorates with a large population, poor working class areas and large ethnic communities, there is a large number of informal votes. The main reason for this informal vote is that we still have a compulsory preferential voting system. The only possible justification for that system is that it perhaps reflects in greater detail the wishes of the voters of that electorate. But I think there are two arguments to that particular point. Firstly, if we had an optional preferential system, it would still allow people to express their preference if they so desired. Secondly, in a compulsory preferential system, it effectively disfranchises about 9 to 10 per cent of the electorate in New South Wales in Senate elections and results in up to one to two per cent being a donkey vote, which means of course that candidates can be elected to the Senate purely because people are forced to vote for 50 to 70 candidates, or whatever it may be. The results are similar in other States and I believe the percentages would be the same. The last Legislative Council ballot in New South Wales was the first democratic election that the Legislative Council in New South Wales has ever had. It was conducted under an optional preferential system. That means, to cast a formal vote a person could vote for No. 1 to No. 9 only and that vote would be formal. That did not stop people, if they wanted to, from voting for every single person on the ballot paper. The result of that election was that only 4 per cent of votes were informal. I still believe that in a Statewide ballot in a State the size of New South Wales, 4 per cent is too high. I know within the Labor Party in New South Wales there are people who are hoping that by the time the next Legislative Council election is held it will be conducted on a list system. I would hope that that would be the case. I believe that in voting for the Senate elections we have to look at joke  candidates. I have no objection to genuine candidates standing for the Senate, regardless of how many votes they get. If they are standing for a recognised party or a recognised organisation which can be proved to have support throughout New South Wales, I do not care how many votes they get. I consider them to be genuine candidates. But in recent years we have had people who have confessed to standing for the Senate because they wanted to use it as a tax lurk. In my opinion they are not genuine candidates. I believe that in order to be a genuine candidate for the Senate in a State like New South Wales, one of the things at least that should be required is that a candidate should be nominated by at least one person in every Federal electorate council throughout the State. I believe that some of the candidates that we have had in the past would have great difficulty in getting somebody to nominate them in all the 44 or 45 electorates in New South Wales. I believe that we have to increase the deposit. The system as it exists at the moment allows malpractice. If somebody is prepared to put up an amount of, say, $10,000 in New South Wales, and it would be even less in the other States, he could so confuse the ballot paper as we have already seen in New South Wales that we could have a situation where one person in ten was voting informal in a Senate election. We should be looking to allowing the candidates to have their party affiliation indicated on the ballot paper. There should be clear instuctions on formal voting in the different languages of the major ethnic groups prominently displayed in each polling booth, preferably having both English and foreign language instructions printed on the ballot paper. I realise that there may be some difficulty in that, but I do not believe there is any advantage to any party under the present system. I suppose it could be said that a few years ago even the major parties had difficulties in manning the polling booths right throughout the State. But since the events of the Federal election in 1975 I have found that, whether it is at a State level or a Federal level, the two major parties in our State have had no difficulty at all in manning the polling booths. Therefore, I do not think there is any advantage to anybody if the party affiliation is indicated on the ballot paper. Again, a number of Labor candidates in New South Wales are hoping that at the next State election, both for the lower House and for the Legislative Council, we will be able to get this reform through. I think we should also examine the rights of Australian permanent residents who at the moment are being deprived of the right to vote. Even though we have temporary residents who are British subjects, as long as they have been here for three months they are allowed to vote. Many people who migrate maintain their former citizenship for one reason or another. They should not be disfranchised when others are allowed to vote. The situation exists at the moment where we have Maltese, people from Gibralta or British migrants who can vote without Australian citizenship, whereas we have Greeks, Yugoslavs, Italians, Lebanese and others who are deprived of this right. I believe that is discriminatory and should be abolished. I think all these areas where people are discriminated against, either by the letter of the electoral laws or by the unnecessarily complicated electoral procedures, should be examined so that the best way of eliminating these biases can be determined. I remind the Senate what Senator Chaney said, regarding the Governments policy, when he was Minister for Administrative Services. He answered allegations concerning attempts by the Government of Western Australia in the State election before last there effectively to deprive Aboriginals of the right to vote. In the State election held in Western Australia last weekend, the same sort of thing occurred. I quote from Hansard of 6 June 1979, page 2731. Senator Chaney said:","N/A","COMMONWEALTH ELECTORAL ACT","/hansard/chamber.xscript/debate[22]/speech[1]/talk.start/para","N/A","N/A"
"0","0","0","0","0","1","0","1","N/A","N/A","N/A","N/A","N/A","N/A","I emphasise that it is part of the general view of the Government that not only Aboriginals but also other disadvantaged people in the community disadvantaged in the sense that they are less able than others to take advantage of the electoral laws which exist to safeguard their rights to vote should be assisted in regard to this matter, lt is part of our general thrust to assist all of those disadvantaged groups. 1 underline the Government s view by saying a few words as to why we regard this matter as important. It would be generally true to say that the disadvantaged voter, that is the person who does have these difficulties, is also disadvantaged in other respects. In other words, the difficulty in exercising the vote is not likely to be the only difficulty that that person faces, whether it is a migrant who is not able to speak or read English, or whether it is an Aboriginal who is not able to speak or perhaps to read or write English. These people, being in greater need of assistance, have a particular interest in who forms the government of the country. For that reason, it is important that they have some say in who should govern the country, or indeed their State. ","N/A","COMMONWEALTH ELECTORAL ACT","/hansard/chamber.xscript/debate[22]/speech[1]/quote[1]/para","N/A","N/A"
"0","0","0","1","0","0","0","1","None","9V4","N/A","N/A","N/A","N/A","I agree and I hope that all honourable senators agree with that statement. I agree wholeheartedly with the sentiments expressed and wish that Senator Chaney was still the Minister. We have to close some loopholes in the Commonwealth Electoral Act that allow for possible cheating. In some large rural areas we have too many polling booths where only a small number of electors vote. The Riverina is a perfect example of this. It has polling booths where fewer than 100 people vote and where neither of the major parties is able to man those polling booths. In Gwydir a similar situation exists. In the last Federal election we had Aboriginals who were going to vote in small polling booths, but who were actively encouraged not to vote. Of course if this had occurred in a large town such as Moree, they could have seen somebody who was a member of a major party. But in the small, outlying polling booths they were bluffed out of the right to vote. I believe that we need a later closure of electoral rolls. At the moment we have an early closure. Therefore the situation exists where people can look at the death notices to find out who has died between the closing of the rolls and the election date. I am not saying that people actively do that, but certainly a situation exists whereby people can look at the death notices and find out that perhaps that person would have liked to vote for a certain party.  People also have access to real estate agents rental rolls. I believe that this is something else which can be manipulated. If we had a system where we used modern computers we could stop these abuses. Also we should look carefully at voting on private property and voting on private property where there are telephones. In New South Wales, where I have had some experience as a former assistant secretary of the Australian Labor Party, whenever there was a byelection we were able to send people out to work on booths where there had never been party workers before. If we had enough people we put them inside the booth as well as outside the booth. What happened in nearly every instance is that not only did the total vote drop but also the Labor Party vote increased. At the last State election in New South Wales, in a country electorate on the north coast an electorate Senator Douglas McClelland and I know very well we were able to put people inside certain booths for the first time. Whilst it could be argued that the Labor vote did not increase, because there was a natural swing to the Labor Party anyway, it was interesting that, in every instance, the total number of people voting in those small voting booths dropped when we had our scrutineers inside. I believe that sections 145, 146 and 147 of the Act which deal with expenditure are a joke. They are unenforceable and should be scrapped. As we have just seen in Tasmania, the question is: Who complies with the provisions? How many people here have been genuinely elected under those sections of the Act? Two committees of the Parliament have looked at pecuniary interests and there must be publication by candidates and parties of the source of their contributions for campaigns. The public must know where members of parliament and parties are getting donations from and what amounts are involved. Why have we kept these aspects quiet? What have Australian political parties tried to hide in the past regarding donations to them? In the United States of America, members of the public can gain access to this information in detail at any time during and after an election campaign. I went to the Electoral Commission in Washington. It is possible to get a list for 10 cents a copy. The Electoral Commission was packed with ordinary citizens and members of the Press who wanted to find out who was donating sums of $10 and upwards to the campaigns of the various presidential candidates. I know that people will say that only the presidential elections are subsidised at the moment, but I do not believe it will be long before the congressional races and the Senate races in America will be subsidised also. I think that all these matters should be looked at in detail as a matter of urgency by a committee. People s faith in our democratic system at the moment is quite shaky. I think that anybody would agree that there is a mood of cynicism particularly amongst young people today towards the political parties and to the political system. I do not think that we should wait for a major scandal before we take some action. We have had a number of scandals. Perhaps they have only been minor scandals. On this side of the chamber we had the Iraqi loans affair. On the other side of the chamber Mr Garland, Mr Lynch and Mr Eric Robinson are three Ministers who have been in trouble, all in one way or another associated with electoral matters and the funding of election campaigns. As I have said, other countries have waited until major scandals have occurred before reviewing the laws. I do not believe that we can afford to wait that long especially as we have had these allegations of impropriety. We do not want a crisis in Australia equivalent to a Watergate. We must act as soon as possible. I wish to say a few words about public funding. In 1932 the Sydney Morning Herald carried the following interchange between W. A. Holman, the then Premier of New South Wales, and Justice Halse Rogers. The interchange took place during the royal commission into the tin hare inquiry. I will quote from the Australian Quarterly which reprinted the article. It stated:","N/A","COMMONWEALTH ELECTORAL ACT","/hansard/chamber.xscript/debate[22]/speech[1]/para[13]","N/A","N/A"
"0","0","0","0","0","1","0","1","N/A","N/A","N/A","N/A","N/A","N/A","Mr Holman, addressing the Royal Commission, said that party funds were one of the inevitable byproducts of the party system, especially with elections becoming more and more intensive and expensive. ","N/A","COMMONWEALTH ELECTORAL ACT","/hansard/chamber.xscript/debate[22]/speech[1]/quote[2]/para","N/A","N/A"
"0","0","0","1","0","0","0","1","None","9V4","N/A","N/A","N/A","N/A","That was in 1932 in New South Wales. The article continues: ","N/A","COMMONWEALTH ELECTORAL ACT","/hansard/chamber.xscript/debate[22]/speech[1]/para[19]","N/A","N/A"
