"question_flag","answer_flag","interjection_flag","speech_flag","petition_flag","quote_flag","motionnospeech_flag","chamber_flag","name","name.id","electorate","party","role","page.no","content","subdebateinfo","debateinfo","path","Speaker","Time"
"0","0","0","1","0","0","0","1","KILGARIFF, Bernard","KPO","N/A","N/A","N/A","430","It is all right for the senator to excuse himself now. It is quite true, as the honourable senator said, that Russia lost a tremendous number of people in the last World War. I do not know the number. The honourable senator says that it was 25 million; I would not argue with him. But that is no excuse. Many millions of other people were killed, as the honourable senator said. Some six million Jews were gassed and were removed from this earth. They were put in trenches like a lot of animals that had been destroyed in a field. Because the Soviets lost so many people in the Second World War is no excuse for their continuing on through the decades treating the smaller nations as they were treated in Leningrad. I have been there. I know what they went through there. There is absolutely no excuse for them to continue on in the present manner. It is no good this country or any other saying that we must not stand up to the Soviets. The honourable senator is implying that because Russia is a market for us we must keep on selling things to the Russians and we must not do anything to upset them. This is absolutely playing into their hands.  The word detente has been used to quite an extent in debate in the last week or two. What does detente mean? I have listened to the debate and know what has happened in countries such as the USSR. Detente has many different meanings. The democracies let us call ourselves the flower people would like everything in the world to be nice, everyone to be happy and so on. In fact our actions ensure this to quite a degree. If there has been trouble, fighting or an invasion we regard that as very bad, but we should endeavour to overcome it so that in the future the world will live in peace and there will be no further invasions. That is our definition of detente. We have seen the invasions of Hungary and Czechoslovakia. If we do not look out now we will start waving the flag of detente again even after the invasion of Afghanistan. We will note that the Soviets have invaded Afghanistan and will say that they should not do anything further and gulp up more small countries. So, we will practice detente. If we do not look out we will again feed in technology and do other sorts of things in an endeavour to make friends with the Soviet. How does the USSR look at detente? I suggest that its thoughts are very different. In all the deliberate moves the Soviets make in swallowing up these small countries they go only so far as they have done in the case of Afghanistan and then they halt. They then talk to the democracies and endeavour to get the message across that they will not do anything further, that they will not be naughty again or carry out any further invasions. While all detente and talks on peace, liaison and cooperation go on as they have over the years the Soviets are preparing once again to flex their muscles and move into the next country. Detente to the Soviets means not peace, liaison and cooperation but a breathing space so that they can gather their strength for the next invasion. I ask anyone to dispute that. Surely we have learnt enough over the last few years to know that this communist countrys only intention is to continue on until it has world control. I believe the action that the Australian Government and the Prime Minister have taken in the last few months has been invaluable in very many ways. Australia is a small country, but it was one of the first to stand and to indicate to other nations that we should all join together and resist this continuing peril from Russia. I think the Prime Minister is to be commended. He has made these visits and moved from country to country. I believe he has brought about a liaison and a cooperation that were most necessary. Someone asked in the debate last week: Why should the Prime Minister, the leader of the country, do such a thing? Why do we not leave it to the Department of Foreign Affairs? What absolute rot! As the leader of Australia, the leader of the Government, it was his responsibility to do exactly what he has done. I believe he has achieved tremendous results. Let me refer to the situation of America. Surely it is apparent that in the last few years America has grown more and more inward looking. It has withdrawn from the troubles around the world. It has presented a low profile. It has been withdrawing within itself. In the last few years when it has had a responsibility I believe that as a superpower it always has had this responsibility to help to achieve reasonable control in a world crisis situation it has withdrawn. This has happened particularly since it withdrew from Vietnam. It would be true to say that in this last year or two Australia would not have known where it stood in regard to American policies. But now there has been a move by the Soviets. It has been an aggressive move which has resulted in the deaths of tens of thousands of people in Afghanistan. Russia, by taking over Afghanistan, is now situated in the heart of the world s oil producing countries and in very close proximity to a warm water port. At last the Americans","Ministerial Statement","AFGHANISTAN: AUSTRALIAS ASSESSMENT AND RESPONSE","/hansard/chamber.xscript/debate[16]/subdebate.1/speech[2]/continue[3]/talk.start/para","N/A","N/A"
"0","0","1","0","0","0","0","1","WALSH, Peter","TJ4","N/A","N/A","N/A","431","Are you sure you have the right country, because you are not pronouncing it correctly? ","Ministerial Statement","AFGHANISTAN: AUSTRALIAS ASSESSMENT AND RESPONSE","/hansard/chamber.xscript/debate[16]/subdebate.1/speech[2]/interjection[4]/talk.start/para","N/A","N/A"
"0","0","0","1","0","0","0","1","KILGARIFF, Bernard","KPO","N/A","N/A","N/A","431","The honourable senator has had his say. At least now we can see that America has once again become the strong country strong in outlook, as it was before. I believe that Australia, in indicating its support for American policy, has been a part of this situation, which has given America a stronger resolve. ","Ministerial Statement","AFGHANISTAN: AUSTRALIAS ASSESSMENT AND RESPONSE","/hansard/chamber.xscript/debate[16]/subdebate.1/speech[2]/continue[4]/talk.start/para","N/A","N/A"
"0","0","1","0","0","0","0","1","WALSH, Peter","TJ4","N/A","N/A","N/A","431","Grovelling, just as in the dark days of the late sixties. ","Ministerial Statement","AFGHANISTAN: AUSTRALIAS ASSESSMENT AND RESPONSE","/hansard/chamber.xscript/debate[16]/subdebate.1/speech[2]/interjection[5]/talk.start/para","N/A","N/A"
"0","0","0","1","0","0","0","1","KILGARIFF, Bernard","KPO","N/A","N/A","N/A","431","There are many things that some members of the Opposition do not like. We have at times discussed the possibility of having a bipartisan approach to the situation. England has achieved it. That country under the leadership of Mrs Thatcher, is to be commended because all parties have seen their way clear to agreeing on a common outlook. ","Ministerial Statement","AFGHANISTAN: AUSTRALIAS ASSESSMENT AND RESPONSE","/hansard/chamber.xscript/debate[16]/subdebate.1/speech[2]/continue[5]/talk.start/para","N/A","N/A"
"0","0","1","0","0","0","0","1","ROCHER, Allan","ZI4","N/A","N/A","N/A","431","And the Opposition there is to be commended. ","Ministerial Statement","AFGHANISTAN: AUSTRALIAS ASSESSMENT AND RESPONSE","/hansard/chamber.xscript/debate[16]/subdebate.1/speech[2]/interjection[6]/talk.start/para","N/A","N/A"
"0","0","0","1","0","0","0","1","KILGARIFF, Bernard","KPO","N/A","N/A","N/A","431","Yes, I very much agree with the honourable senator. The Labour Party in the United Kingdom is to be commended. I am not saying that many members of the Labor Party in this Parliament are not to be commended; they are. We have heard some very fine speeches on their attitudes to the Afghanistan invasion. The people I refer to are the moderates and the people who are looked upon as members of the right wing. ","Ministerial Statement","AFGHANISTAN: AUSTRALIAS ASSESSMENT AND RESPONSE","/hansard/chamber.xscript/debate[16]/subdebate.1/speech[2]/continue[6]/talk.start/para","N/A","N/A"
"0","0","1","0","0","0","0","1","PRIMMER, Cyril","K1M","N/A","N/A","N/A","431","Who Paul Keating? ","Ministerial Statement","AFGHANISTAN: AUSTRALIAS ASSESSMENT AND RESPONSE","/hansard/chamber.xscript/debate[16]/subdebate.1/speech[2]/interjection[7]/talk.start/para","N/A","N/A"
"0","0","0","1","0","0","0","1","KILGARIFF, Bernard","KPO","N/A","N/A","N/A","431","You do the naming, Senator. It is not for me to name those people on the Opposition side. As I have said before, I believe that there are many Opposition senators who come into that category, such as Senator Wheeldon perhaps and Dr Klugman, to name two. Why is it that the left wing members have not seen fit to come forward as have their partners in the Labor Party? I think the answer on this issue is very plain, and I think they have publicly displayed their attitude. They have shown to the communistled unions of the country that they are loyal to them. (Quorum formed). Some members of this Parliament have indicated to the communistled unions that they have said the things that are expected of them, and I would say that that is to the detriment of Australia. Of course the communistled unions can then say to the Soviets: What good boys we are. ","Ministerial Statement","AFGHANISTAN: AUSTRALIAS ASSESSMENT AND RESPONSE","/hansard/chamber.xscript/debate[16]/subdebate.1/speech[2]/continue[7]/talk.start/para","N/A","N/A"
"0","0","1","0","0","0","0","1","PRIMMER, Cyril","K1M","N/A","N/A","N/A","431","What a load of codswallop you are talking. ","Ministerial Statement","AFGHANISTAN: AUSTRALIAS ASSESSMENT AND RESPONSE","/hansard/chamber.xscript/debate[16]/subdebate.1/speech[2]/interjection[8]/talk.start/para","N/A","N/A"
"0","0","1","0","0","0","0","1","MCINTOSH, Gordon","KTJ","N/A","N/A","N/A","431","Where are your guts? You name them and name the unions. ","Ministerial Statement","AFGHANISTAN: AUSTRALIAS ASSESSMENT AND RESPONSE","/hansard/chamber.xscript/debate[16]/subdebate.1/speech[2]/interjection[9]/talk.start/para","N/A","N/A"
"0","0","0","1","0","0","0","1","KILGARIFF, Bernard","KPO","N/A","N/A","N/A","431","The honourable senator has asked me where are my guts. May I ask him where are his. Is he naming himself as one of the communists that I am describing who feel they have to answer to the left wing controlled unions? ","Ministerial Statement","AFGHANISTAN: AUSTRALIAS ASSESSMENT AND RESPONSE","/hansard/chamber.xscript/debate[16]/subdebate.1/speech[2]/continue[8]/talk.start/para","N/A","N/A"
"0","0","1","0","0","0","0","1","MCINTOSH, Gordon","KTJ","N/A","N/A","N/A","431","You are the one making the accusations but you will not name anyone. ","Ministerial Statement","AFGHANISTAN: AUSTRALIAS ASSESSMENT AND RESPONSE","/hansard/chamber.xscript/debate[16]/subdebate.1/speech[2]/interjection[10]/talk.start/para","N/A","N/A"
"0","0","0","1","0","0","0","1","KILGARIFF, Bernard","KPO","N/A","N/A","N/A","431","I am not making accusations. The second part of the statement on Afghanistan is directed at Australia s defence requirements. I applaud this part of the statement. I also applaud the first part because, as I have said before, I believe that the Prime Minister, despite the derogatory statements and attacks that have been made on him, has achieved tremendous results. It is surprising that in this debate he has been singled out and attacked maliciously on many occasions by honourable senators who should have been getting on with debating the statement.  The defence of Australia is an extremely important subject. To a person such as myself who comes from the north it is probably more important than it is to some people because in the north we can still see the scars of the Second World War. At Broome we can see at low water mark the wrecks of 1 8 to 20 large seaplanes which carried refugees. They have been a reminder all these years that if we are to keep Australia safe certain things have to be done. Japanese, American and Australian bombers and fighters still lie around the coastline where they crashed many years ago. They are memorials of the past and reminders of what should be done now. The people of the north are very heartened to see that action has been taken by the Government to build up our defences. Despite the assurances that were given after the Second World War the people of the north at times still feel that the Brisbane line thinking still exists. They have been afraid that in the future planning for the defence of Australia the north would once again be forgotten and not developed, and that whatever defence facilities were established would be located in the southern part of Australia. The people of the north were afraid that the Brisbane line mentality still exists. But this statement gives an assurance the first real assurance that has been given that the north is looked upon as the frontier of Australia. Because it is the frontier of Australia, that is where Australia must be defended along the Indian Ocean coastline. We will see some 75 new fighters in Australia. It has been suggested that the squadrons of Mirages presently based at Butterworth in Malaysia will be returned to Australia and will be positioned in the north.","Ministerial Statement","AFGHANISTAN: AUSTRALIAS ASSESSMENT AND RESPONSE","/hansard/chamber.xscript/debate[16]/subdebate.1/speech[2]/continue[9]/talk.start/para","N/A","N/A"
"0","0","1","0","0","0","0","1","BISHOP, Reginald","K1Y","N/A","N/A","N/A","432","Who said that, Senator? ","Ministerial Statement","AFGHANISTAN: AUSTRALIAS ASSESSMENT AND RESPONSE","/hansard/chamber.xscript/debate[16]/subdebate.1/speech[2]/interjection[11]/talk.start/para","N/A","N/A"
"0","0","0","1","0","0","0","1","KILGARIFF, Bernard","KPO","N/A","N/A","N/A","432","I said that it has been reported. Senator Bishop might remember that the other day I asked the Leader of the Government in the Senate whether the report that those squadrons were returning to Australia, which was supposed to have emanated from the Department of Defence, was correct. The Leader of the Government refuted that claim and said that there were no such plans at present. But I think it is reasonable to assume that that will happen. It is possible that we will have another FFG destroyer. We will have more patrol boats. Aerodromes in Western Australia will be upgraded or new ones will be built. A new supply vessel for the north is to be constructed. An aircraft carrier possibly will come from the United States of America.  So many tangible developments are occurring that I think we can feel assured that at least some realistic measures will be taken. But I think that one of the real indications to the people of the north that that is so is that not only will the Government spend some $95m this year on defence there is more to come over the next few years but also, more money is to be spent within the Navy and the Air Force on training and on sea and air movement. As far as surveillance and other operations are concerned, that will mean that more steaming will be done by the Navy and more flying will be done by the Air Force. Previously there have been restrictions. To my mind, there has been a lack of reconnaissance and surveillance in the north. I believe that with this extra funding that will be rectified. In the Darwin area, as in Cairns, patrol boat bases are being constructed. That, together with the use of the new Fremantle type of patrol boat, will be an advantage in the patrolling of and reconnaissance within the Indian Ocean area. Those patrol boats will be able to operate further out to sea than the earlier patrol boats were able to operate. So those bases will be of considerable benefit. I suggest that, as the Navy base just off Fremantle in Western Australia is to be upgraded for use by the Americans and for use by our boatsI applaud thata further base should be built in the north. I think that the facilities at the new patrol boat base which is being constructed now in Darwin should be extended so that when FFG destroyers arrive there shortly they will be able to be maintained and serviced there. Once again, I think that that would be most advantageous. There is to be an increase in the strength of the Services. That surely will have to be a morale lifter for the people who are now serving Australia. Last Friday I had an opportunity to attend, as did members of the Joint Committee on Foreign Affairs and Defence, including Senator Reg Bishop, a firepower demonstration at Puckapunyal. I saw the young officers there and watched a demonstration of the firepower of the weapons used. I believe that, particularly among the young officers, the morale was considerable. One aspect we ought to consider when we are enlarging our Defence Force the Navy, Army and Air Force concerns industrial support to meet defence needs. Although today I asked the AttorneyGeneral (Senator Durack) a question relating to industrial support to meet defence needs and allied matters and asked him what was happening in that direction, whether we will be more selfsufficient in armaments than we have been, I was not really given an assurance by the AttorneyGeneral. I draw attention to the October 1 977 report of the Joint Committee on Foreign Affairs and Defence. I think that the conclusions drawn and recommendations made in that report are very pertinent to the problems being experienced in the munitions and defence industry. The Committee stated:","Ministerial Statement","AFGHANISTAN: AUSTRALIAS ASSESSMENT AND RESPONSE","/hansard/chamber.xscript/debate[16]/subdebate.1/speech[2]/continue[10]/talk.start/para","N/A","N/A"
"0","0","0","0","0","1","0","1","KILGARIFF, Bernard","KPO","N/A","N/A","N/A","N/A","The Committee sees the munitions industry as an essential national defence industry which is in serious decline as the result of a very severe decrease in defence workload since 1970. In the government munitions factories, which form the backbone of the industry, the workforce is down to a level which is barely capable in most areas of maintaining essential capabilities and skills. There are clements of the workforce that are not gainfully employed. The costs of maintaining capacity arc increasing and yet not enough money is being spent on the necessary upgrading of facilities to achieve higher levels of productivity. ","Ministerial Statement","AFGHANISTAN: AUSTRALIAS ASSESSMENT AND RESPONSE","/hansard/chamber.xscript/debate[16]/subdebate.1/speech[2]/quote[1]/para","N/A","N/A"
"0","0","0","1","0","0","0","1","KILGARIFF, Bernard","KPO","N/A","N/A","N/A","N/A","That report was printed in 1977. I hope that in the intervening period there has been further upgrading in the industry and that, particularly now, we will see further upgrading. In the most recent reports of the Joint Committee on Foreign Affairs and Defence on Australian defence procurement, which was produced in November 1 979, the Committee stated: ","Ministerial Statement","AFGHANISTAN: AUSTRALIAS ASSESSMENT AND RESPONSE","/hansard/chamber.xscript/debate[16]/subdebate.1/speech[2]/para[18]","N/A","N/A"
"0","0","0","0","0","1","0","1","KILGARIFF, Bernard","KPO","N/A","N/A","N/A","N/A","On several occasions the Committee has supported the gradual consolidation of personnel expert in foreign contract administration, procurement practice or law. Such a group could form part of any career procurement service which is formed for the Defence Department. In this way, it will be possible to collect under one roof all the procurement skills necessary for defence procurement both inside and outside Australia.  For these reasons, the Committee recommends that those functions of the Department of Administrative Services relative to the procurement of major military equipment for the Defence Force be transferred to the Department of Defence. The Committee considers that such a transfer will add further to Defence Department capacity in the fields of: drafting of specifications: contracts and contract management; foreign procurement law and practice: local procurement law and practice, as necessary . . .","Ministerial Statement","AFGHANISTAN: AUSTRALIAS ASSESSMENT AND RESPONSE","/hansard/chamber.xscript/debate[16]/subdebate.1/speech[2]/quote[2]/para[1]","N/A","N/A"
"0","0","0","1","0","0","0","1","KILGARIFF, Bernard","KPO","N/A","N/A","N/A","N/A","So it goes on. The Committee recommended that the administrative part of government should be reviewed and that work undertaken by the Department of Administrative Services should be handed over to the Department of Defence. (Quorum formed). Before the quorum was called I was saying that while we are now upgrading our defence forces let us also look at our munitions industry and the defence related industries to ensure that they are in a better condition than they have been over the years.  A lot of nonsense has been stated in this debate. I suggest that a lot of that nonsense emanated from the other side of the chamber prior to my speech. However, I compliment the Australian for its editorial of Monday, 25 February. I think that what it said is what many people have tried to say over the last two weeks. 1 believe that it has a message for everybody the people in the Parliament and the people of Australia. I seek leave to have the editorial entitled There are no medals for the dead incorporated in Hansard. Leave granted. The document read as follows","Ministerial Statement","AFGHANISTAN: AUSTRALIAS ASSESSMENT AND RESPONSE","/hansard/chamber.xscript/debate[16]/subdebate.1/speech[2]/para[19]","N/A","N/A"
