"question_flag","answer_flag","interjection_flag","speech_flag","petition_flag","quote_flag","motionnospeech_flag","chamber_flag","name","name.id","electorate","party","role","page.no","content","subdebateinfo","debateinfo","path","Speaker","Time"
"0","0","0","1","0","0","0","1","GUILFOYLE, Margaret","C7D","Victoria","LP","Minister for Social Security","408","( 12.25) I acknowledge that Senator Grimes has brought forward a broad and general motion, as he terms it, and I welcome the opportunity to have some more general discussion on matters of assistance to all people in low income groups in Australia. I recognise that the breadth of the matter raised does not allow us to pursue at any great depth many matters. But what has been said by Senator Grimes has raised many questions and perhaps we would be entitled to seek some views from the Opposition with regard to those questions. It is a wide debate, but despite that fact we would need to see what specific reforms could be proposed in this country if we were to direct more assistance to those who are in need and not one particular group. I refer to not just those who might be entitled to pensions but all low income groups.  Honourable senators have to ask: Would we change the tax scales, because tax is mentioned in the wording of the matter raised? Would we look at the tax threshold? Would we look at the indexation of tax to see that inflation does not increase tax year by year? Would we look at how we give allowances, whether they be for children or dependent spouses or in whatever other area? Because of the high level of expenditure in the social security area we would need to ask ourselves about the levels of pensions and about what ought to be an incomefree area which would have relationship to the pension. We would need to see what are to be the fringe benefits, those things outside the pension entitlement which undoubtedly are of very real value to those who receive them. We would need to look at income tests that would be placed on the various pensions and benefits. I think it is fair to say that Senator Grimes has not attempted to be specific on any of these issues and I am not able to canvass these issues in a general debate. Senator Grimes has spent some time discussing the Wilson proposal, as it is referred to in the Press. Perhaps I ought to say that that is a proposal which has been developed by a subcommittee of the Government members Health and Welfare Committee and is one that has had some discussion in the general community. The purpose of raising the matter, I think, is to have some discussion. If we could have some discussion in Australia about welfare matters and assistance to low income groups, then I think it would be a very helpful and healthy sign because whenever matters such as these are raised it usually is in a combative sense. It usually is not so that we can have a discussion about these matters. It usually is to point to many things and to seek more expenditure in welfare or reductions in tax or to try to get commitments that perhaps are not within the reach of all Australians. On this occasion, when perhaps some time has been given to discuss one proposal from a subcommittee of Government members, I ought to say that it is not the only proposal that the Government would have in its mind if it were seeking to have reform either of taxation or social security systems. The Government is not available to canvass publicly what its proposals would be either for the next Budget or at any other stage. It makes these proposals and uses input and information that comes from a number of sources. But it is true to say that we do not have nearly enough public discussion about these matters. We could recall that about six months ago the Leader of the Opposition (Mr Hayden) in his reply to the Budget Speech was very careful to avoid any specific commitments. I think that that would be conceded by anybody. There were no effective alternatives proposed. Indeed other than the matter that Senator Grimes raised today with regard to supplementary assistance through the family allowance scheme, nothing that could be regarded as a real alternative was suggested in the discussion that has been raised. For some time I have been talking about the relationship of income security payments to what has been called a poverty line in this country. I have expressed in this place and in other places my concern. I doubt that we have an Australian poverty line that relates to present day conditions. I have recently asked the Social Welfare Policy Secretariat, in consultation with my own Department, to examine the whole issue of alternative approaches to measure a poverty line that would be relative to Australia in the 1980s. I have asked the Social Welfare Policy Secretariat to take up this matter with the Australian Bureau of Statistics, and to look particularly at the ways in which we could use household expenditure data so that equivalence scales that would have some meaning could be derived. The Senate will recall that Professor Hendersons poverty lines used equivalence scales that were derived in New York in 1954 because there was no Australian data that could be applied. If we are to read in our newspapers and to hear through our media, as we do at such frequent intervals, that certain numbers of people in this country are living below the poverty line, it seems to me that there ought to be some contemporary measurement of what would be an appropriate poverty line below which no person in this country should be allowed to fall. The matters that have been raised bring to mind some of the things that have occurred since this Government came to office. If we are to relate to tax the motion before the Senate, we cannot ignore the Governments actions in Budgets since 1976 which have assisted families. The tax adjustments introduced in the Budgets of 1976, 1977, February 1978 and July 1978 have meant an increase in the basic threshold of 54.5 per cent, an increase in the dependent spouse rebate of 49.25 per cent and an increase in the sole parent rebate of 108.5 per cent. The full movement in the consumer price index since 197576 has been about 47 per cent. The figures I have given could be related to that movement. So it can be shown that in real terms there has been a benefit. The February 1978 tax reform introduced a standard rate of tax for some 90 per cent of taxpayers. This reduced at most income levels the difference in tax payable by one and two income families. The family allowance reform introduced in 1976 extended additional assistance to families who, only because of their low income, could not avail themselves of the former tax rebates for dependent children. Government action in the social security area, which is designed to assist families, needs to give recognition to the concept of full indexation of basic pension payments and basic benefit payments for those who are over 18 with dependants and those who are under 18 and married. Assistance has been provided to sole fathers since 1977 when supporting parents benefits were introduced, and fringe benefits were extended to supporting parents in 1979. I mention those as some examples of assistance that has been given. There has been quite some debate in the public arena recently with regard to tax. We should recognise the matters that have been referred to by the Treasurer (Mr Howard) with regard to steps that have been taken towards creating a more equitable taxation system and the number of ways in which the Government has reduced the tax scales. It changed the spouse rebates and it has done the things that I mentioned earlier. They have been of assistance to all those people who pay tax. Of course, with the increase in the tax threshold there are many people in the low income groups who now pay no tax. That is a considerable and direct benefit to them. It should be recognised that a taxpayer with a wholly dependent spouse is now able to earn up to $5,698 without paying any income tax. That shows that there has been an improvement in the position of that very low income group of people which was previously subjected to taxation and which now, through those increases I have mentioned, is not subjected to taxation at all. Senator Grimes referred briefly to the attitude of his party to the introduction of a capital gains tax. I think that other members of the Opposition have spoken about that matter. He said that a change to the income test would benefit those with large assets. He did not include in the groups of people he mentioned those living in rural poverty who, through the means test as it formerly applied, may not have been entitled to the receipt of pensions but who, through changes to the income test, may be eligible to receive pensions or part pensions.","Discussion of Matter of Public Importance","WELFARE AND TAXATION REFORM: LOW INCOME FAMILIES","/hansard/chamber.xscript/debate[5]/subdebate.1/speech[3]/talk.start/para","N/A","N/A"
"0","0","1","0","0","0","0","1","BAUME, Peter","ME4","N/A","N/A","N/A","409","Were they not particularly identified by Professor Hendersons inquiry as being in need? ","Discussion of Matter of Public Importance","WELFARE AND TAXATION REFORM: LOW INCOME FAMILIES","/hansard/chamber.xscript/debate[5]/subdebate.1/speech[3]/interjection[1]/talk.start/para","N/A","N/A"
"0","0","1","0","0","0","0","1","GUILFOYLE, Margaret","C7D","N/A","N/A","N/A","409","N/A ","Discussion of Matter of Public Importance","WELFARE AND TAXATION REFORM: LOW INCOME FAMILIES","/hansard/chamber.xscript/debate[5]/subdebate.1/speech[3]/interjection[2]/talk.start/para","N/A","N/A"
"0","0","0","1","0","0","0","1","GUILFOYLE, Margaret","C7D","N/A","N/A","N/A","N/A","They were, because in some years these people had absolutely no income. ","Discussion of Matter of Public Importance","WELFARE AND TAXATION REFORM: LOW INCOME FAMILIES","/hansard/chamber.xscript/debate[5]/subdebate.1/speech[3]/para[10]","N/A","N/A"
"0","0","1","0","0","0","0","1","GRIMES, Don","9V4","N/A","N/A","N/A","409","Their homes were never considered in the means test. You know that. ","Discussion of Matter of Public Importance","WELFARE AND TAXATION REFORM: LOW INCOME FAMILIES","/hansard/chamber.xscript/debate[5]/subdebate.1/speech[3]/interjection[3]/talk.start/para","N/A","N/A"
"0","0","1","0","0","0","0","1","GUILFOYLE, Margaret","C7D","N/A","N/A","N/A","409","N/A ","Discussion of Matter of Public Importance","WELFARE AND TAXATION REFORM: LOW INCOME FAMILIES","/hansard/chamber.xscript/debate[5]/subdebate.1/speech[3]/interjection[4]/talk.start/para","N/A","N/A"
"0","0","0","1","0","0","0","1","GUILFOYLE, Margaret","C7D","N/A","N/A","N/A","N/A","Their properties meant they were unable to receive pension entitlements, but the change to the income test has now allowed them to receive benefits. The problem of a lack of cash income for many people in rural areas has been alleviated by that change. It is a change that I think has assisted families in Australia. It is not a change that I believe has related only to the people who have been mentioned by Senator Grimes. Senator Grimes mentioned the seminar that was arranged by the Australian Council of Social Service. 1 agree with him when he says that not enough discussion was given in the media to the many matters that were raised at that seminar. It is unfortunate that a simplistic approach can be taken in discussing welfare matters. If one were to ask people in this country what were the issues involved, they would have very little understanding of the issues that have been raised by Senator Grimes or those which would be of concern to me in putting forward proposals for future Budgets.  We need to find the answers to some of the issues. When I put forward my proposals for forward expenditure for the next three years I will need to look at the increases in costs that will be required to be found to maintain the present system, given the increases in the number of beneficiaries in all the categories. I will need to take account not only of the large number of intergenerational transfers that occur from the taxpaying group to the ageing group but also the fact that there will be inescapable expenditure if we are to maintain the income security system. It is fine to pose the questions but there is a need to determine what some of the answers can be. When the Government introduced the family allowances system in 1976 it brought increased assistance to 300,000 families who had not enjoyed tax rebates because they were at a very low income level. Since 1976 those family allowances have been paid to over two million families, covering more than four million children. This has been of benefit to those who have dependent children and for whom the cost of children is a primary responsibility. No one ignores the fact that it would be of great expense to index family allowances. When the amount of $ 1,000m is paid out under any government scheme, the cost of indexation in relation to that scheme, with inflation running at anything up to 10 per cent or thereabouts, soon reaches an amount of $ 100m. Therefore, the fact that the benefits have not been increased is acknowledged. It was not possible to do these things in more recent Budgets. The pensions and benefits which must cover those who are in the lowest income groups they are the groups in the large majority of cases who have no income other than social security pension or benefit payments have increased significantly faster than prices since the mid 1960s. Under the Fraser Government most social security and benefit payments have reached record levels relative to average weekly earnings, and it should be recorded that the standard rate of pension has increased from $14 a week as at December 1968 to $57.90 a week as at December 1979. That is an increase of over 300 per cent. As a percentage of the average weekly earnings the pension during that period has risen from 20 per cent to about 24 per cent. The married rate also has increased substantially. They may just be figures but they are an acknowledgement of what has been achieved and what has been provided through using the resources of the Australian people to direct those payments to people who are in need. If we are to discuss Senator Grimes  motion, I should mention that he does refer to the need for reform of the taxation and social security systems to improve the position of low income families. We would then have to look at the performance of the Labor Party when it was in office. We see that there were promises to raise the basic pension rate to 25 per cent, which could not be achieved. That rate moved from 1 9.9 per cent to 23. 1 per cent, but it was not able to reach 25 per cent. The Labor Party promised to abolish the means test within the life of the next Parliament. It was not abolished in the three years of office of the Australian Labor Party, and I think if we were to read the statements of Senator Grimes and look at the platform of the Labor Party we would see that that is no longer a promise that would be made. The Australian Labor Party has constantly criticised the family allowance scheme, although more recently it is finding that it is a scheme that is well accepted and efficient, as mentioned by Senator Grimes in the Senate Hansard in 1979. 1 must say that the policy of the Labor Party with regard to family allowances is not clear. It speaks of a review of the family allowance program in order to direct resources to low income families and to provide for an annual review of payments to maintain their value. But we would need to ask the question: Would the current scheme be means tested to limit family allowances to higher income families, or would the increases in the future be means tested and, if so, at what level of income? These are the questions which seriously ought to be posed if we are talking about reform of the social security system. Does the promise of an annual review mean indexation? I think Senator Grimes referred to that and its cost today. {Quorum formed). I was referring to the Australian Labor Partys policy. As I conclude my remarks, I should like to mention the national compensation scheme and the national superannuation scheme to which the Labor Party is committed through its recent conference, and line up those policies with the other needs that there may be for a reform of the taxation and social security system, and pose the question: What effect would they have in light of expenditure, and what reforms would then be proposed by the Labor Party to maintain the existing system and to improve it? These are questions which are raised in a serious manner, and I think at some time we would like to hear answers.","Discussion of Matter of Public Importance","WELFARE AND TAXATION REFORM: LOW INCOME FAMILIES","/hansard/chamber.xscript/debate[5]/subdebate.1/speech[3]/para[11]","N/A","N/A"
"0","0","0","1","0","0","0","1","MELZER, Jean","KUJ","Victoria","N/A","N/A","411","I rise in this debate glad, I must say, that the Minister for Social Security (Senator Dame Margaret Guilfoyle) has shown concern that these issues should be given wider debate and discussion, and very pleased to hear that we will not have any income splitting forced on us by the people on her side of the Parliament who seem to see it as an answer to the unemployment problem, an answer which will push women back into the home and, they say, provide jobs for the many young people who cannot find jobs in this country at the moment. This question of additional assistance to improve the position of low income families comes at a time when it is becoming more and more obvious that the bulk of the population in Australia is falling into that position of being a low income family. I think the latest figures show that about 70 per cent of the workers in this country receive below the average weekly earnings, which means that people in a family position are having a very hard time in making that income go around and being able to do for their children what they want to do.  The Minister made some comment on the fact that over the last few years pensions have risen in proportion to earnings. But when one recalls that, after tax, incomes have risen by 52.8 per cent since December 1978 and prices have risen by 40.6 per cent in that period it means that even though their position may have been improved on a percentage basis, people on low incomes in this country are having an increasingly hard time in filling that gap. What fascinates me is that while the Government shows some concern for the position of low income families, it does very little for them, but it actively encourages the corporate section of our country. I think this was shown in the last Budget Speech, when the Treasurer (Mr Howard) said:","Discussion of Matter of Public Importance","WELFARE AND TAXATION REFORM: LOW INCOME FAMILIES","/hansard/chamber.xscript/debate[5]/subdebate.1/speech[4]/talk.start/para","N/A","N/A"
"0","0","0","0","0","1","0","1","MELZER, Jean","KUJ","N/A","N/A","N/A","N/A","Overall business profits improved last year. This process must continue if recovery is to be consolidated. ","Discussion of Matter of Public Importance","WELFARE AND TAXATION REFORM: LOW INCOME FAMILIES","/hansard/chamber.xscript/debate[5]/subdebate.1/speech[4]/quote[1]/para","N/A","N/A"
