"question_flag","answer_flag","interjection_flag","speech_flag","chamber_flag","name","name.id","electorate","party","role","page.no","content","subdebateinfo","debateinfo","path","Speaker","Time"
"1","0","0","0","1","Wong, Sen Penny","00AOU","N/A","ALP","N/A","957"," Mr President, I ask a supplementary question. In light of his comments, and in light of the Minister for Agricultures comments—A $1 billion dollar threshold for foreign investment screening is an absurdity—I ask the minister, can he explain the policy rationale for the $1 billion threshold that remains applicable to the purchase of agricultural land by investors from the United States, Chile and New Zealand? And will he rule out renegotiating any of those agreements? ","Foreign Investment","QUESTIONS WITHOUT NOTICE","/hansard/chamber.xscript/debate[7]/subdebate.1[9]/question[2]/talk.text/body/p","Senator WONG (South Australia—Leader of the Opposition in the Senate) ","(14:47):"
"0","1","0","0","1","Abetz, Sen Eric","N26","N/A","LP","N/A","957"," In relation to agreements, I would never rule out renegotiation of agreements generally. ","Foreign Investment","QUESTIONS WITHOUT NOTICE","/hansard/chamber.xscript/debate[7]/subdebate.1[9]/answer[2]/talk.text/body/p[1]","Senator ABETZ (Tasmania—Leader of the Government in the Senate, Minister Assisting the Prime Minister for the Public Service and Minister for Employment) ","(14:48):"
"0","1","0","0","1","MemberInterjecting","00AOU","N/A","N/A","N/A","N/A","Senator Wong: Andrew Robb is going to be very unhappy. You just agreed to renegotiating the US free trade agreement.  Senator Abetz: Mr President, I have been going for five seconds and the Leader of the Opposition in the Senate cannot contain herself—rude, obnoxious interjections, nonstop. It is about time that she showed the sort of leadership that the Labor Party in this place needs—and, more importantly, that the Australian people actually expect at question time. This is a government that is concerned to ensure that foreign investment takes place in this country in a manner that is attuned to public opinion and public views. Lets be very clear: we on this side have always welcomed foreign investment; foreign investment is vitally important for the agricultural sector; we welcome it, but it needs to be checked.","Foreign Investment","QUESTIONS WITHOUT NOTICE","/hansard/chamber.xscript/debate[7]/subdebate.1[9]/answer[2]/talk.text/body/p[2]","N/A","N/A"
"0","0","1","0","1","Wong, Sen Penny","00AOU","N/A","ALP","N/A","957","N/A ","Foreign Investment","QUESTIONS WITHOUT NOTICE","/hansard/chamber.xscript/debate[7]/subdebate.1[9]/answer[2]/interjection[1]/talk.start","N/A","N/A"
"0","0","1","0","1","Abetz, Sen Eric","N26","N/A","LP","N/A","957","N/A ","Foreign Investment","QUESTIONS WITHOUT NOTICE","/hansard/chamber.xscript/debate[7]/subdebate.1[9]/answer[2]/interjection[2]/talk.start","N/A","N/A"
"1","0","0","0","1","Wong, Sen Penny","00AOU","N/A","ALP","N/A","957"," Mr President, I ask a further supplementary question. Does the minister agree with the Queensland Farmers Federation, which says the governments foreign investment decision throws barriers in the way of foreign investment and sends the wrong message to overseas investors who see value in investing in Australian agriculture? ","Foreign Investment","QUESTIONS WITHOUT NOTICE","/hansard/chamber.xscript/debate[7]/subdebate.1[9]/question[3]/talk.text/body/p","Senator WONG (South Australia—Leader of the Opposition in the Senate) ","(14:49):"
"0","1","0","0","1","Abetz, Sen Eric","N26","N/A","LP","N/A","957"," It will not surprise the honourable senator that chances are I do not agree with that assertion.  As I understand it, around the world, agribusinesses and agricultural land are seen as absolutely prized assets, and that is even more the case in our country, Australia, because of the regimes we have in place, the rule of law that applies and the general stability that we enjoy in our country. As a result I have no doubt that Australia will still be seen as a very good place to invest, both with domestic money and with international money. All we are seeking to do is ensure that there is an appropriate regime around foreign investment to ensure that we know what is going on. That is why, through the Australian Taxation Office, we will establish a register of agricultural lands owned by foreign enterprises.","Foreign Investment","QUESTIONS WITHOUT NOTICE","/hansard/chamber.xscript/debate[7]/subdebate.1[9]/answer[3]/talk.text/body/p[1]","Senator ABETZ (Tasmania—Leader of the Government in the Senate, Minister Assisting the Prime Minister for the Public Service and Minister for Employment) ","(14:49):"
"1","0","0","0","1","Mason, Sen Brett","84M","N/A","LP","N/A","957"," My question is to the Assistant Minister for Education and Training, Senator Birmingham, representing the Minister for Education and Training. Can the minister outline to the Senate how the governments approach to funding higher education differs from alternative approaches which have been proposed? ","Higher Education","QUESTIONS WITHOUT NOTICE","/hansard/chamber.xscript/debate[7]/subdebate.1[10]/question[1]/talk.text/body/p","Senator MASON (Queensland) ","(14:50):"
"0","1","0","0","1","Birmingham, Sen Simon","H6X","N/A","LP","N/A","958"," I thank Senator Mason—who has great expertise in the area of higher education—for his question. ","Higher Education","QUESTIONS WITHOUT NOTICE","/hansard/chamber.xscript/debate[7]/subdebate.1[10]/answer[1]/talk.text/body/p[1]","Senator BIRMINGHAM (South Australia—Assistant Minister for Education and Training) ","(14:51):"
"0","1","0","0","1","Opposition senators","N/A","N/A","N/A","N/A","N/A","Opposition senators interjecting—  The PRESIDENT: Just a moment, Senator Birmingham. Pause the clock. On my left: Senator Carr, Senator Conroy, Senator Cameron. Order! Senator Birmingham, please continue.","Higher Education","QUESTIONS WITHOUT NOTICE","/hansard/chamber.xscript/debate[7]/subdebate.1[10]/answer[1]/talk.text/body/p[2]","N/A","N/A"
"0","1","0","0","1","MemberContinuation","H6X","N/A","N/A","N/A","N/A","Senator BIRMINGHAM: Our governments reforms ensure that we can maintain the uncapped demanddriven system of providing undergraduate university places; we can ensure we maintain taxpayer subsidised places for every single undergraduate student who is admitted by a university  That should be welcomed. It should be welcomed by those opposite, because none less than the former Prime Minister Ms Gillard in her book My Story cites the uncapping of university places as a particularly proud moment, a particularly proud decision to unchain Australian universities. Our reforms move even further in the unchaining of Australian universities. They lift the shackles in relation to pathway courses and diploma courses. They ensure there will be more opportunities for more students, particularly more students from disadvantaged backgrounds, to take advantage of those pathway places. But it is acknowledged that current funding models are unsustainable. Our reforms ensure that we address that unsustainability.","Higher Education","QUESTIONS WITHOUT NOTICE","/hansard/chamber.xscript/debate[7]/subdebate.1[10]/answer[1]/talk.text/body/p[4]","N/A","N/A"
"0","1","0","0","1","Senator Kim Carr","N/A","N/A","N/A","N/A","N/A","Senator Kim Carr interjecting— ","Higher Education","QUESTIONS WITHOUT NOTICE","/hansard/chamber.xscript/debate[7]/subdebate.1[10]/answer[1]/talk.text/body/p[7]","N/A","N/A"
"0","1","0","0","1","MemberContinuation","H6X","N/A","N/A","N/A","N/A","Senator BIRMINGHAM: The opposition, though, offers no alternative—except for Senator Carr. Senator Carr has said:  The demand driven system is for a finite period. That is not what the legislation says. That is not what Ms Gillard says about her proud achievement. That is not what universities believe to be the case. Our reforms are about trying to maintain the fine achievements that Ms Gillard speaks of. It seems that Senator Carr wants to come along and undo those reforms by denying university students their right to a place. (Time expired)","Higher Education","QUESTIONS WITHOUT NOTICE","/hansard/chamber.xscript/debate[7]/subdebate.1[10]/answer[1]/talk.text/body/p[8]","N/A","N/A"
"0","0","1","0","1","PRESIDENT, The","10000","N/A","N/A","N/A","958","N/A ","Higher Education","QUESTIONS WITHOUT NOTICE","/hansard/chamber.xscript/debate[7]/subdebate.1[10]/answer[1]/interjection/talk.start","N/A","N/A"
"1","0","0","0","1","Mason, Sen Brett","84M","N/A","LP","N/A","958"," Mr President, I ask a supplementary question. Can the minister advise the Senate of the consequences should the governments higher education reforms not proceed? ","Higher Education","QUESTIONS WITHOUT NOTICE","/hansard/chamber.xscript/debate[7]/subdebate.1[10]/question[2]/talk.text/body/p","Senator MASON (Queensland) ","(14:54):"
"0","1","0","0","1","Birmingham, Sen Simon","H6X","N/A","LP","N/A","958"," If our reforms do not pass, we will be consigning Australian universities and through them, students, to a decline into mediocrity. They are not my words. They are the words of Universities Australia. Universities Australia recognises that the current system is unsustainable. Universities will be stuck with inadequate and unpredictable resources and an unsustainable status quo. Worse still, they will face the continued fear, the continued threat that Senator Carr would get his way and would manage to put a cap back in place in relation to university places. Universities would face that constant fear, as would students, that the vulnerable and the disadvantaged may be denied a place at university because the cap would be reinstituted, as Senator Carr seems to want to do. In fact, as one economist has described it, he wants to bring back Moscow on the Molonglo. He wants to put the bureaucrats back in charge of deciding who goes to university— (Time expired) ","Higher Education","QUESTIONS WITHOUT NOTICE","/hansard/chamber.xscript/debate[7]/subdebate.1[10]/answer[2]/talk.text/body/p","Senator BIRMINGHAM (South Australia—Assistant Minister for Education and Training) ","(14:54):"
"1","0","0","0","1","Mason, Sen Brett","84M","N/A","LP","N/A","959"," Mr President, I ask a further supplementary question. Can the minister advise the Senate of any other potential consequences should the governments higher education reforms not proceed. ","Higher Education","QUESTIONS WITHOUT NOTICE","/hansard/chamber.xscript/debate[7]/subdebate.1[10]/question[3]/talk.text/body/p","Senator MASON (Queensland) ","(14:55):"
"0","1","0","0","1","Birmingham, Sen Simon","H6X","N/A","LP","N/A","959"," I thank Senator Mason again. There are serious consequences. Without these reforms, some 80,000 students each year would miss out on Commonwealth support for their higher education places, meaning that either there would not be places for them or they would have to pay higher fees. Without these reforms, the unfair loan fees on FEE‑HELP and VET FEEHELP would continue. Without these reforms, many thousands of new parents would not have the benefit of the proposed HECS indexation pause. Without these reforms, the ability of regional and other universities to offer diploma and similar courses would be lost. Without these reforms, there would be no Commonwealth scholarships. There would be no higher education participation program scholarships. Without these reforms, there would be a range of losses for future students, especially those from disadvantaged backgrounds. But, worst of all, without these reforms our universities would not be able to stay at the worldclass standard they are and would face the constant threat that Senator Carr— (Time expired) ","Higher Education","QUESTIONS WITHOUT NOTICE","/hansard/chamber.xscript/debate[7]/subdebate.1[10]/answer[3]/talk.text/body/p","Senator BIRMINGHAM (South Australia—Assistant Minister for Education and Training) ","(14:55):"
"1","0","0","0","1","Conroy, Sen Stephen","3L6","N/A","ALP","N/A","959"," My question is to the Minister representing the Prime Minister, Senator Abetz. Do documents exist that confirm an understanding, agreement or commitment for Japan to build Australias new submarine fleet? ","Defence Procurement","QUESTIONS WITHOUT NOTICE","/hansard/chamber.xscript/debate[7]/subdebate.1[11]/question[1]/talk.text/body/p","Senator CONROY (Victoria—Deputy Leader of the Opposition in the Senate) ","(14:57):"
"0","1","0","0","1","Abetz, Sen Eric","N26","N/A","LP","N/A","959"," Not to my knowledge. ","Defence Procurement","QUESTIONS WITHOUT NOTICE","/hansard/chamber.xscript/debate[7]/subdebate.1[11]/answer[1]/talk.text/body/p","Senator ABETZ (Tasmania—Leader of the Government in the Senate, Minister Assisting the Prime Minister for the Public Service and Minister for Employment) ","(14:57):"
"0","1","0","0","1","Conroy, Sen Stephen","3L6","N/A","ALP","N/A","959"," Mr President, I ask a supplementary question. I refer the minister to a news report in The Australian yesterday, and I quote:  … the federal government singlemindedly pursued a plan to buy the navys new submarines from Japan. I ask the minister again: do documents exist that confirm an understanding, agreement or commitment for Japan to build submarines for Australia?","Defence Procurement","QUESTIONS WITHOUT NOTICE","/hansard/chamber.xscript/debate[7]/subdebate.1[11]/answer[2]/talk.text/body/p[1]","Senator CONROY (Victoria—Deputy Leader of the Opposition in the Senate) ","(14:57):"
"0","1","0","0","1","Abetz, Sen Eric","N26","N/A","LP","N/A","959"," Not to my knowledge—for a second time. ","Defence Procurement","QUESTIONS WITHOUT NOTICE","/hansard/chamber.xscript/debate[7]/subdebate.1[11]/answer[3]/talk.text/body/p","Senator ABETZ (Tasmania—Leader of the Government in the Senate, Minister Assisting the Prime Minister for the Public Service and Minister for Employment) ","(14:58):"
"1","0","0","0","1","Conroy, Sen Stephen","3L6","N/A","ALP","N/A","959"," Mr President, I ask a further supplementary question. I refer the minister to Peter Hartchers article in TheAge,on 20 February, and I quote:  The government was on the brink of announcing the decision to buy Japanese. So I ask the minister again: do documents exist that confirm an understanding, agreement or commitment for Japan to build submarines for Australia?","Defence Procurement","QUESTIONS WITHOUT NOTICE","/hansard/chamber.xscript/debate[7]/subdebate.1[11]/question[2]/talk.text/body/p[1]","Senator CONROY (Victoria—Deputy Leader of the Opposition in the Senate) ","(14:58):"
"0","1","0","0","1","Abetz, Sen Eric","N26","N/A","LP","N/A","960"," For the readers of Hansard, see the answers to the two questions above. ","Defence Procurement","QUESTIONS WITHOUT NOTICE","/hansard/chamber.xscript/debate[7]/subdebate.1[11]/answer[4]/talk.text/body/p","Senator ABETZ (Tasmania—Leader of the Government in the Senate, Minister Assisting the Prime Minister for the Public Service and Minister for Employment) ","(14:58):"
"1","0","0","0","1","Ruston, Sen Anne","243273","N/A","LP","N/A","960"," My question is to the Minister for Human Services, Senator Payne. Can the minister explain to the Senate how the age and complexity of her departments main ICT system makes it difficult to implement reform? ","Department of Human Services: ICT System","QUESTIONS WITHOUT NOTICE","/hansard/chamber.xscript/debate[7]/subdebate.1[12]/question[1]/talk.text/body/p","Senator RUSTON (South Australia—Deputy Government Whip in the Senate) ","(14:58):"
"0","1","0","0","1","Payne, Sen Marise","M56","N/A","LP","N/A","960"," I thank Senator Ruston for that question. This is an issue which has been discussed recently both in estimates and elsewhere. We are running an ICT payment system in the Department of Human Services, which is now more than 30 years old. It was, in fact, built in the early 1980s. Some of us in the chamber can still remember those days. I think Mr Hawke was Prime Minister; the late, great Peter Brock was winning at Bathurst; and—it was a very long time ago—the Parramatta Eels won a premiership.  The system originally delivered $10 billion worth of payments to around 2.5 million people, but it has become a critical piece of government infrastructure that is now responsible for delivering payments of about $100 billion to 7.3 million people each year. That equates to about $12 million every hour. The system is stable and it is reliable, but it does not have the sort of flexibility and longevity that we need in that particular system. To meet todays needs, the original system has been repeatedly upgraded and extended, I am advised, over 350 times. What we now have is a web of interconnected systems with addons and attachments. A simple update, for example, often requires changes to many different parts of the system. So if you want to make muchneeded policy changes they can, through the ICT process, take a number of months to implement. We have a very highly skilled and committed team of ICT experts who work in this area in human services. In fact, it speaks for itself when I say that some of them as individuals have actually worked on this same system for more than two decades. But there are very few organisations around the world that still use this type of computer system, and that makes attracting appropriately skilled staff—some of the few who are still familiar with that system—quite difficult, and retaining them is also a significant challenge.","Department of Human Services: ICT System","QUESTIONS WITHOUT NOTICE","/hansard/chamber.xscript/debate[7]/subdebate.1[12]/answer[1]/talk.text/body/p[1]","Senator PAYNE (New South Wales—Minister for Human Services) ","(14:59):"
"1","0","0","0","1","Ruston, Sen Anne","243273","N/A","LP","N/A","960"," Mr President, I ask a supplementary question. Can the minister inform the Senate how the current ICT system creates extra work and impacts on staff and customers? ","Department of Human Services: ICT System","QUESTIONS WITHOUT NOTICE","/hansard/chamber.xscript/debate[7]/subdebate.1[12]/question[2]/talk.text/body/p","Senator RUSTON (South Australia—Deputy Government Whip in the Senate) ","(15:01):"
"0","1","0","0","1","Payne, Sen Marise","M56","N/A","LP","N/A","960"," Notwithstanding the efforts that have been made to bring the system into the 21st century—and dragging it through the 20th century, in fact—that 1980s foundation does make things needlessly complicated for staff, for government and, in fact, for our customers on a number of occasions. This is largely because it is built around individual payments and not around the person or their family and their particular circumstances. If you are a customer who starts a new claim, even if you are an existing customer, the current system treats you as a new customer; so you are required to provide all of your details again, even if they been provided previously, and it does build a certain level of frustration amongst both staff and customers.  We would like to be able to deliver seamless digital services. They are commonplace in the private sector and there is a certain expectation amongst customers that that is what they should receive. If you want to order online you can often track your delivery. You cannot do the same, necessarily, with your payments. (Time expired)","Department of Human Services: ICT System","QUESTIONS WITHOUT NOTICE","/hansard/chamber.xscript/debate[7]/subdebate.1[12]/answer[2]/talk.text/body/p[1]","Senator PAYNE (New South Wales—Minister for Human Services) ","(15:01):"
"1","0","0","0","1","Ruston, Sen Anne","243273","N/A","LP","N/A","961"," Mr President, I ask a further supplementary question. Will the minister advise the Senate what the government is doing to improve the current ICT system? ","Department of Human Services: ICT System","QUESTIONS WITHOUT NOTICE","/hansard/chamber.xscript/debate[7]/subdebate.1[12]/question[3]/talk.text/body/p","Senator RUSTON (South Australia—Deputy Government Whip in the Senate) ","(15:02):"
"0","1","0","0","1","Payne, Sen Marise","M56","N/A","LP","N/A","961"," I do thank Senator Ruston for that question, which we did have an opportunity to canvass briefly in the estimates process. The government is considering a business case to replace the current system. We have made an enormous amount of progress with a suite of digital apps and with online services, but it is a difficult process and the current system no longer meets the expectations of customers.  If we had an appropriately modern ICT system that would definitely improve service delivery, it would remove the ongoing cost to taxpayers—","Department of Human Services: ICT System","QUESTIONS WITHOUT NOTICE","/hansard/chamber.xscript/debate[7]/subdebate.1[12]/answer[3]/talk.text/body/p[1]","Senator PAYNE (New South Wales—Minister for Human Services) ","(15:02):"
"0","1","0","0","1","Opposition senators","N/A","N/A","N/A","N/A","N/A","Opposition senators interjecting— ","Department of Human Services: ICT System","QUESTIONS WITHOUT NOTICE","/hansard/chamber.xscript/debate[7]/subdebate.1[12]/answer[3]/talk.text/body/p[3]","N/A","N/A"
"0","1","0","0","1","MemberContinuation","M56","N/A","N/A","N/A","N/A","Senator PAYNE: which some of us care about—not those opposite, obviously—and it would also increase ability to implement reforms. We would ensure that our welfare system as it stands is able to interact properly and seamlessly with other Commonwealth government departments—which, of course, my colleagues have every right to expect in 2015 and in the years going forward. It would reduce the redtape burden on customers, on staff and on other government agencies. (Time expired) ","Department of Human Services: ICT System","QUESTIONS WITHOUT NOTICE","/hansard/chamber.xscript/debate[7]/subdebate.1[12]/answer[3]/talk.text/body/p[4]","N/A","N/A"
"0","1","0","0","1","MemberInterjecting","N26","N/A","N/A","N/A","N/A","Senator Abetz: Mr President, I ask that further questions be placed on the Notice Paper. ","Department of Human Services: ICT System","QUESTIONS WITHOUT NOTICE","/hansard/chamber.xscript/debate[7]/subdebate.1[12]/answer[3]/talk.text/body/p[5]","N/A","N/A"
"0","0","1","0","1","Abetz, Sen Eric","N26","N/A","LP","N/A","961","N/A ","Department of Human Services: ICT System","QUESTIONS WITHOUT NOTICE","/hansard/chamber.xscript/debate[7]/subdebate.1[12]/answer[3]/interjection/talk.start","N/A","N/A"
